"ID","info","inCore","count","MK-ID"
"Lin Xw, 2000, COMP BIOCHEM PHYS A","Lin Xw, 2000, COMP BIOCHEM PHYS A, V126, P415",False,1,"None"
"Meek Rw, 2015, PLOS BIOL","Meek Rw, 2015, PLOS BIOL, V13",False,1,"None"
"Olivotto I, 2010, AQUACULTURE","Olivotto I, 2010, AQUACULTURE, V308, P124",False,1,"None"
"Papadakis Ie, 2009, AQUACULTURE","Papadakis Ie, 2009, AQUACULTURE, V286, P45",False,1,"None"
"Paperna I, 1980, J FISH DIS","Paperna I, 1980, J FISH DIS, V3, P363",False,1,"None"
"Paperna I, 1984, ANN PARASITOL HUM CO","Paperna I, 1984, ANN PARASITOL HUM CO, V59, P7",False,1,"None"
"Pérez-Sánchez J, 1999, AQUACULTURE","Pérez-Sánchez J, 1999, AQUACULTURE, V177, P117",False,1,"None"
"Raja Ra, 2015, ADV MARINE BRACKISHW","Raja Ra, 2015, ADV MARINE BRACKISHW, P247",False,1,"None"
"Reinecke M, 1998, INT REV CYTOL","Reinecke M, 1998, INT REV CYTOL, V183, P1",False,1,"None"
"Saraiva A, 2011, AQUACULTURE","Saraiva A, 2011, AQUACULTURE, V320, P34",False,1,"None"
"Secombes C J, 1996, THE FISH IMMUNE SYSTEM: ORGANISM","Secombes C J, 1996, THE FISH IMMUNE SYSTEM: ORGANISM, PATHOGEN, ,",False,1,"None"
"Sindermann Cj, 1984, HELGOLANDER MEERESUN","Sindermann Cj, 1984, HELGOLANDER MEERESUN, V37, P505",False,1,"None"
"Subasinghe Rp, 1998, J APPL ICHTHYOL","Subasinghe Rp, 1998, J APPL ICHTHYOL, V14, P123",False,1,"None"
"Subasinghe Rr, 2005, PREV VET MED","Subasinghe Rr, 2005, PREV VET MED, V67, P117",False,1,"None"
"Thorarinsson R, 2006, AQUACULTURE","Thorarinsson R, 2006, AQUACULTURE, V256, P42",False,1,"None"
"Bittsanszky A, 2016, P 28 INT PLANT PROT","Bittsanszky A, 2016, P 28 INT PLANT PROT",False,1,"None"
"Bulc G T, 2012, P BALWOIS 2012 OHR R","Bulc G T, 2012, P BALWOIS 2012 OHR R",False,1,"None"
"Graber A, 2016, COMMUNICATION","Graber A, 2016, COMMUNICATION",False,1,"None"
"Hart Er, 2013, SCI ED INT","Hart Er, 2013, SCI ED INT, V24, P460",False,2,"None"
"Junge R, 2014, 3 K CLASSR TOOL PROM","Junge R, 2014, 3 K CLASSR TOOL PROM",False,1,"None"
"Kiss G, 2015, PROCEDIA ENGINEER","Kiss G, 2015, PROCEDIA ENGINEER, V118, P326",False,1,"None"
"Leach M, 2012, ECOL SOC","Leach M, 2012, ECOL SOC, V17",False,2,"None"
"Maucieri C, 2017, J CLEAN PROD","Maucieri C, 2017, J CLEAN PROD",False,1,"None"
"Mcclintock N, 2013, LANDSCAPE URBAN PLAN","Mcclintock N, 2013, LANDSCAPE URBAN PLAN, V111, P46",False,1,"None"
"Melorose J, 2015, WORLD POP PROSP 2015","Melorose J, 2015, WORLD POP PROSP 2015, V1, P1",False,1,"None"
"Newman Ge, 2014, J CONSUM RES","Newman Ge, 2014, J CONSUM RES, V41, P823",False,1,"None"
"Pretty J, 2010, INT J AGR SUSTAIN","Pretty J, 2010, INT J AGR SUSTAIN, V8, P219",False,2,"None"
"Rakocy J E, 1981, PROCEEDINGS OF THE BIO-ENGINEERING SYMPOSIUM FOR FISH CULTURE","Rakocy J E, 1981, PROCEEDINGS OF THE BIO-ENGINEERING SYMPOSIUM FOR FISH CULTURE, ,",False,2,"None"
"Sanye-Mengual E, 2014, P 6 AESOP SUST FOOD","Sanye-Mengual E, 2014, P 6 AESOP SUST FOOD, P692",False,1,"None"
"Sébastien M, 2015, BIOL CONTROL","Sébastien M, 2015, BIOL CONTROL, V89, P98",False,1,"None"
"Sommerville C, 2014, SMALL SCALE AQUAPONI","Sommerville C, 2014, SMALL SCALE AQUAPONI",False,1,"None"
"Van Woensel L, 2015, 10 TECHNOLOGIES WHIC","Van Woensel L, 2015, 10 TECHNOLOGIES WHIC",False,1,"None"
"Zinzi M, 2012, ENERG BUILDINGS","Zinzi M, 2012, ENERG BUILDINGS, V55, P66",False,1,"None"
"Bindraban Ps, 2012, CURR OPIN ENV SUST","Bindraban Ps, 2012, CURR OPIN ENV SUST, V4, P478",False,2,"None"
"Cébron A, 2005, WATER RES","Cébron A, 2005, WATER RES, V39, P4979",False,2,"None"
"Clemens S, 2013, TRENDS PLANT SCI","Clemens S, 2013, TRENDS PLANT SCI, V18, P92",False,1,"None"
"Clement S, 1994, AQUACULTURE","Clement S, 1994, AQUACULTURE, V119, P299",False,1,"None"
"Dordas C, 2009, SUSTAINABLE AGRICULTURE","Dordas C, 2009, SUSTAINABLE AGRICULTURE, P443",False,1,"None"
"Graham Dw, 2007, ISME J","Graham Dw, 2007, ISME J, V1, P385",False,2,"None"
"Kindaichi T, 2006, BIOTECHNOL BIOENG","Kindaichi T, 2006, BIOTECHNOL BIOENG, V94, P1111",False,2,"None"
"Le Corre Ks, 2005, J CRYST GROWTH","Le Corre Ks, 2005, J CRYST GROWTH, V283, P514",False,1,"None"
"Lee Si, 2003, CHEMOSPHERE","Lee Si, 2003, CHEMOSPHERE, V51, P265",False,1,"None"
"Radniecki Ts, 2009, BIOTECHNOL BIOENG","Radniecki Ts, 2009, BIOTECHNOL BIOENG, V104, P1004",False,2,"None"
"Shilta Mt, 2016, AQUACULT INT","Shilta Mt, 2016, AQUACULT INT, V24, P661",False,1,"None"
"Megda Mxv, 2014, SOIL BIOL BIOCHEM","Megda Mxv, 2014, SOIL BIOL BIOCHEM, V72, P84",False,1,"None"
"Wang Yb, 2006, FISH PHYSIOL BIOCHEM","Wang Yb, 2006, FISH PHYSIOL BIOCHEM, V32, P49",False,1,"None"
"*Apha, 1995, STAND METH EX WAT WA","*Apha, 1995, STAND METH EX WAT WA",False,1,"None"
"Bradley P, 2001, ACTA HORTIC","Bradley P, 2001, ACTA HORTIC, V554, P289",False,1,"None"
"Rakocy J E, 1988, ISLAND PERSPECTIVES","Rakocy J E, 1988, ISLAND PERSPECTIVES, V3, P4",False,1,"None"
"Rakocy J E, 2002, RECIRCULATING AQUACU","Rakocy J E, 2002, RECIRCULATING AQUACU, P631",False,1,"None"
"Adler P R, 1998, AQUAPONICS J","Adler P R, 1998, AQUAPONICS J, V4, P1",False,1,"None"
"Aubin J, 2009, J CLEAN PROD","Aubin J, 2009, J CLEAN PROD, V17, P354",False,1,"None"
"Avadí A, 2015, AQUACULTURE","Avadí A, 2015, AQUACULTURE, V435, P52",False,1,"None"
"Ayer N W, 2008, J CLEAN PROD","Ayer N W, 2008, J CLEAN PROD, P362",False,1,"None"
"Bilen S, 2015, IRAN J FISH SCI","Bilen S, 2015, IRAN J FISH SCI, V14, P538",False,1,"None"
"Brault D, 2002, HORTSCIENCE","Brault D, 2002, HORTSCIENCE, V37, P92",False,1,"None"
"Brigolin D, 2014, AQUACULT ENV INTERAC","Brigolin D, 2014, AQUACULT ENV INTERAC, V5, P71",False,1,"None"
"Davidson J W, 2014, JOURNAL OF AQUACULTURE RESEARCH AND DEVELOPMENT","Davidson J W, 2014, JOURNAL OF AQUACULTURE RESEARCH AND DEVELOPMENT, V5, P238",False,1,"None"
"Fornshell G, 2008, ENV BEST MANAGEMENT","Fornshell G, 2008, ENV BEST MANAGEMENT, P331",False,1,"None"
"Foteinis S, 2016, J CLEAN PROD","Foteinis S, 2016, J CLEAN PROD, V112, P2462",False,1,"None"
"Frischknecht R, 2007, 3 SWISS CTR LCI DUEB","Frischknecht R, 2007, 3 SWISS CTR LCI DUEB",False,1,"None"
"Fusi A, 2016, INT J LIFE CYCLE ASS","Fusi A, 2016, INT J LIFE CYCLE ASS, V21, P162",False,1,"None"
"Hamilton Ha, 1975, CAN J PLANT SCI","Hamilton Ha, 1975, CAN J PLANT SCI, V55, P453",False,1,"None"
"Hendrickx Tlg, 2009, BIORESOURCE TECHNOL","Hendrickx Tlg, 2009, BIORESOURCE TECHNOL, V100, P4642",False,1,"None"
"Hospido A, 2009, INT J LIFE CYCLE ASS","Hospido A, 2009, INT J LIFE CYCLE ASS, V14, P381",False,1,"None"
"Kheyrabadi Ep, 2014, IRAN J FISH SCI","Kheyrabadi Ep, 2014, IRAN J FISH SCI, V13, P503",False,1,"None"
"Koçer Mat, 2013, AQUACULT ENV INTERAC","Koçer Mat, 2013, AQUACULT ENV INTERAC, V3, P187",False,1,"None"
"Lastiri Dr, 2016, WATER SCI TECHNOL","Lastiri Dr, 2016, WATER SCI TECHNOL, V74, P30",False,1,"None"
"Lennard W A, 2006, THESIS","Lennard W A, 2006, THESIS",False,1,"None"
"Lourguioui H, 2017, INT J LIFE IN PRESS","Lourguioui H, 2017, INT J LIFE IN PRESS",False,1,"None"
"Santos Aao, 2015, AQUACULTURE","Santos Aao, 2015, AQUACULTURE, V444, P151",False,1,"None"
"Petrea S M, 2014, SCIENTIFIC PAPERS: ANIMAL SCIENCE AND BIOTECHNOLOGIES","Petrea S M, 2014, SCIENTIFIC PAPERS: ANIMAL SCIENCE AND BIOTECHNOLOGIES, V47, P196",False,1,"None"
"Pre, 2014, SIMAPRO 8 SOFTW","Pre, 2014, SIMAPRO 8 SOFTW",False,1,"None"
"Ravindran B, 2008, APPL BIOCHEM BIOTECH","Ravindran B, 2008, APPL BIOCHEM BIOTECH, V151, P480",False,1,"None"
"Rebole A, 2015, FOOD CHEM","Rebole A, 2015, FOOD CHEM, V174, P614",False,1,"None"
"Romero-Gámez M, 2014, J CLEAN PROD","Romero-Gámez M, 2014, J CLEAN PROD, V73, P193",False,1,"None"
"Sace C F, 2013, ACADEMIA JOURNAL OF AGRICULTURAL RESEARCH","Sace C F, 2013, ACADEMIA JOURNAL OF AGRICULTURAL RESEARCH, V1, P236",False,1,"None"
"Samuel-Fitwi B, 2013, AQUACULT ENG","Samuel-Fitwi B, 2013, AQUACULT ENG, V54, P85",False,1,"None"
"Tacon Agj, 2008, AQUACULTURE","Tacon Agj, 2008, AQUACULTURE, V285, P146",False,2,"None"
"Woynarovich A, 2011, SMALL SCALE RAINBOW","Woynarovich A, 2011, SMALL SCALE RAINBOW",False,1,"None"
"Xie K, 2015, C P PRESENTATIONS 7","Xie K, 2015, C P PRESENTATIONS 7",False,1,"None"
"Yarahmadi P, 2016, AQUACULT NUTR","Yarahmadi P, 2016, AQUACULT NUTR, V22, P1134",False,1,"None"
"Downing Al, 1964, J I SEWER PURIF","Downing Al, 1964, J I SEWER PURIF, P130",False,1,"None"
"Goldman Jc, 1974, WATER RES","Goldman Jc, 1974, WATER RES, V8, P45",False,1,"None"
"Johnson Wk, 1964, J WATER POLLUT CON F","Johnson Wk, 1964, J WATER POLLUT CON F, V36, P1015",False,1,"None"
"Kinne O, 1976, MARINE ECOL","Kinne O, 1976, MARINE ECOL, V3, P19",False,1,"None"
"Liao Pb, 1974, AQUACULTURE","Liao Pb, 1974, AQUACULTURE, V3, P61",False,1,"None"
"Loyacano Ha, 1973, P ANNU C SE ASS GAM","Loyacano Ha, 1973, P ANNU C SE ASS GAM, V27, P471",False,1,"None"
"Meade Tl, 1974, NOAA30 SEA GRANT U R","Meade Tl, 1974, NOAA30 SEA GRANT U R",False,1,"None"
"Meske C, 1973, AQUAKULTUR WARMWASSE","Meske C, 1973, AQUAKULTUR WARMWASSE",False,1,"None"
"Mulbarger Mc, 1971, J WATER POLLUT CON F","Mulbarger Mc, 1971, J WATER POLLUT CON F, V43, P2059",False,1,"None"
"Nagel L, 1976, ARCH FISCHEREIWISS","Nagel L, 1976, ARCH FISCHEREIWISS, V27, P9",False,1,"None"
"Scherb K, 1971, WASSER ABWASSERFORSC","Scherb K, 1971, WASSER ABWASSERFORSC, V4, P118",False,1,"None"
"Soeder Cj, 1972, WASSER ABWASSER","Soeder Cj, 1972, WASSER ABWASSER, V113, P583",False,1,"None"
"Spotte Sh, 1970, FISH INVERTEBRATE CU","Spotte Sh, 1970, FISH INVERTEBRATE CU",False,1,"None"
"Vonsengbusch R, 1965, EXPERIENTIA","Vonsengbusch R, 1965, EXPERIENTIA, V21, P614",False,1,"None"
"1973, 1972 1973 AR LANDS R","1973, 1972 1973 AR LANDS R",False,1,"None"
"Falah M A F, 2013, INTERNATIONAL JOURNAL OF AGRICULTURAL TECHNOLOGY","Falah M A F, 2013, INTERNATIONAL JOURNAL OF AGRICULTURAL TECHNOLOGY, V9, P769",False,1,"None"
"Florida Fish And Wildlife Conservation Commission, 2014, AQ LIC PERM","Florida Fish And Wildlife Conservation Commission, 2014, AQ LIC PERM",False,1,"None"
"Gericke Wf, 1940, COMPLETE GUIDE SOILL","Gericke Wf, 1940, COMPLETE GUIDE SOILL",False,1,"None"
"Goodman Er, 2011, AQUAPONICS COMMUNITY","Goodman Er, 2011, AQUAPONICS COMMUNITY",False,2,"None"
"Hardy Rw, 2002, RESPONSIBLE MARINE AQUACULTURE","Hardy Rw, 2002, RESPONSIBLE MARINE AQUACULTURE, P311",False,1,"None"
"Licamele J D, 2009, BIOMASS PRODUCTION N","Licamele J D, 2009, BIOMASS PRODUCTION N",False,1,"None"
"Mcmurtry M, 1992, THESIS N CAROLINA ST","Mcmurtry M, 1992, THESIS N CAROLINA ST",False,1,"None"
"Metcalf Ss, 2011, APPL GEOGR","Metcalf Ss, 2011, APPL GEOGR, V31, P1242",False,1,"None"
"Mollison Bill, 1981, PERMACULTURE ONE PER","Mollison Bill, 1981, PERMACULTURE ONE PER",False,1,"None"
"Naylor R, 2005, ANNU REV ENV RESOUR","Naylor R, 2005, ANNU REV ENV RESOUR, V30, P185",False,1,"None"
"Naylor Rl, 2009, P NATL ACAD SCI USA","Naylor Rl, 2009, P NATL ACAD SCI USA, V106, P15103",False,1,"None"
"New South Wales Department Of Primary Industries, 2014, TIL","New South Wales Department Of Primary Industries, 2014, TIL",False,1,"None"
"Popma T J, 1995, WORLDWIDE PROSPECTS","Popma T J, 1995, WORLDWIDE PROSPECTS, P7",False,1,"None"
"Rakocy Je, 1984, RECIRCULATING SYSTEM","Rakocy Je, 1984, RECIRCULATING SYSTEM, P103",False,2,"None"
"Shultz Rc, 2014, EVOLUTION AQUAPONICS","Shultz Rc, 2014, EVOLUTION AQUAPONICS",False,1,"None"
"Timmons Mb, 2010, RECIRCULATING AQUACU","Timmons Mb, 2010, RECIRCULATING AQUACU",False,1,"None"
"Todd J, 1980, J NEW ALCHEMISTS","Todd J, 1980, J NEW ALCHEMISTS, V6, P108",False,1,"None"
"Tortorello M, 2010, SPOTLESS GARDEN","Tortorello M, 2010, SPOTLESS GARDEN",False,1,"None"
"Us Department Of Agriculture (Usda), 2007, CENS AGR FARM AG","Us Department Of Agriculture (Usda), 2007, CENS AGR FARM AG",False,1,"None"
"*Usda, 2006, CENS AQ 2005","*Usda, 2006, CENS AQ 2005, V3",False,1,"None"
"Wardlow George W, 2002, JOURNAL OF NATURAL RESOURCES AND LIFE SCIENCES EDUCATION","Wardlow George W, 2002, JOURNAL OF NATURAL RESOURCES AND LIFE SCIENCES EDUCATION, V31, P55",False,1,"None"
"Zweig Rd, 1986, AQUAC MAG","Zweig Rd, 1986, AQUAC MAG, V12, P34",False,1,"None"
"Alam Mk, 1995, J ENVIRON SCI HEAL A","Alam Mk, 1995, J ENVIRON SCI HEAL A, V30, P1807",False,1,"None"
"Barnhoorn Iej, 2004, ECOTOX ENVIRON SAFE","Barnhoorn Iej, 2004, ECOTOX ENVIRON SAFE, V59, P180",False,1,"None"
"Das Kk, 1980, HYDROBIOLOGIA","Das Kk, 1980, HYDROBIOLOGIA, V75, P117",False,1,"None"
"Doudoroff P, 1953, SEWAGE IND WASTES","Doudoroff P, 1953, SEWAGE IND WASTES, V25, P802",False,1,"None"
"Giguère A, 2004, CAN J FISH AQUAT SCI","Giguère A, 2004, CAN J FISH AQUAT SCI, V61, P1702",False,1,"None"
"Havas M, 1982, CAN J FISH AQUAT SCI","Havas M, 1982, CAN J FISH AQUAT SCI, V39, P890",False,1,"None"
"James R, 1996, ASIAN FISHERIES SCIENCE","James R, 1996, ASIAN FISHERIES SCIENCE, V9, P87",False,1,"None"
"Mcgeer Jc, 2000, AQUAT TOXICOL","Mcgeer Jc, 2000, AQUAT TOXICOL, V50, P231",False,1,"None"
"Nussey G, 1996, S AFR J WILDL RES","Nussey G, 1996, S AFR J WILDL RES, V26, P47",False,1,"None"
"Okonkwo Jo, 2005, J HYDROL","Okonkwo Jo, 2005, J HYDROL, V308, P122",False,1,"None"
"Olaifa Fe, 2003, AFRICAN J BIOMEDICAL","Olaifa Fe, 2003, AFRICAN J BIOMEDICAL, V6, P101",False,1,"None"
"Peuranen S, 1994, ANN ZOOL FENN","Peuranen S, 1994, ANN ZOOL FENN, V31, P389",False,1,"None"
"Posthuma L, 2002, ENVIRON ECOL RISK AS","Posthuma L, 2002, ENVIRON ECOL RISK AS, P3",False,1,"None"
"Pyatt Fb, 2003, ENVIRON TOXICOL CHEM","Pyatt Fb, 2003, ENVIRON TOXICOL CHEM, V22, P561",False,1,"None"
"Roux Dj, 1994, WATER SA","Roux Dj, 1994, WATER SA, V20, P333",False,1,"None"
"Sard Abdullah, 2007, INTERNATIONAL JOURNAL OF AGRICULTURE AND BIOLOGY","Sard Abdullah, 2007, INTERNATIONAL JOURNAL OF AGRICULTURE AND BIOLOGY, V9, P333",False,1,"None"
"Sindhu Nv, 2002, JOURNAL OF ECOTOXICOLOGY & ENVIRONMENTAL MONITORING","Sindhu Nv, 2002, JOURNAL OF ECOTOXICOLOGY & ENVIRONMENTAL MONITORING, V12, P167",False,1,"None"
"Stouthart Xjhx, 1996, ENVIRON TOXICOL CHEM","Stouthart Xjhx, 1996, ENVIRON TOXICOL CHEM, V15, P376",False,1,"None"
"Weber Ci, 1993, METHODS MEASURING AC","Weber Ci, 1993, METHODS MEASURING AC, P75",False,1,"None"
"Wepener V, 2001, WATER SA","Wepener V, 2001, WATER SA, V27, P99",False,1,"None"
"Alt D, 1980, INTERNATIONAL SOCIETY FOR SOILLESS CULTURE: PROCEEDINGS","Alt D, 1980, INTERNATIONAL SOCIETY FOR SOILLESS CULTURE: PROCEEDINGS, ,",False,1,"None"
"Bedasie S, 1984, 6 INT C SOILL CULT P","Bedasie S, 1984, 6 INT C SOILL CULT P, P139",False,1,"None"
"Burgoon Ps, 1984, 6 INT C SOILL CULT P","Burgoon Ps, 1984, 6 INT C SOILL CULT P, P151",False,1,"None"
"Clarkson R, 1991, AQUACULTURE AND FISHERIES MANAGEMENT","Clarkson R, 1991, AQUACULTURE AND FISHERIES MANAGEMENT, V22, P37",False,1,"None"
"Fischer P, 1984, 6 INT C SOILL CULT P","Fischer P, 1984, 6 INT C SOILL CULT P, P225",False,1,"None"
"Fitzsimmons K, 1985, UNPUB FISH PLANT INT","Fitzsimmons K, 1985, UNPUB FISH PLANT INT, P1",False,1,"None"
"Gerber J M, 1985, HYDROPONICS WORLDWID","Gerber J M, 1985, HYDROPONICS WORLDWID, P58",False,1,"None"
"Maynard Dn, 1971, SOIL SCI PLANT ANAL","Maynard Dn, 1971, SOIL SCI PLANT ANAL, V2, P461",False,1,"None"
"Mohyuddin M, 1985, HYDROPONICS WORLDWID","Mohyuddin M, 1985, HYDROPONICS WORLDWID, P42",False,1,"None"
"Mongeau R, 1984, PROCEEDINGS","Mongeau R, 1984, PROCEEDINGS, ,",False,1,"None"
"Nair A, 1985, 2 INT C WARM WAT AQ","Nair A, 1985, 2 INT C WARM WAT AQ, P223",False,1,"None"
"Parker D, 1990, 9034 ERL","Parker D, 1990, 9034 ERL",False,1,"None"
"Prince Rp, 1984, 6 INT C SOILL CULT P","Prince Rp, 1984, 6 INT C SOILL CULT P, P533",False,1,"None"
"Rakocy Je, 1989, J WORLD AQUACULT SOC","Rakocy Je, 1989, J WORLD AQUACULT SOC, V20, PA64",False,1,"None"
"Rakocy Je, 1989, VIRGIN ISLANDS AGR E","Rakocy Je, 1989, VIRGIN ISLANDS AGR E, V3, P4",False,1,"None"
"Rakocy Je, 1987, AGR RES NOTES","Rakocy Je, 1987, AGR RES NOTES, V2, P19",False,1,"None"
"Resh Hm, 1991, HYDROPONIC FOOD PROD","Resh Hm, 1991, HYDROPONIC FOOD PROD",False,1,"None"
"Seawright De, 1993, ASAE PUBL","Seawright De, 1993, ASAE PUBL, V93, P137",False,1,"None"
"Vantoever W, 1981, AQUACULTURE HEATED E","Vantoever W, 1981, AQUACULTURE HEATED E, V2, P403",False,1,"None"
"Winsor G, 1987, GLASSHOUSE CROPS","Winsor G, 1987, GLASSHOUSE CROPS, VB",False,1,"None"
"Wren Sw, 1984, THESIS TEXAS A M U C","Wren Sw, 1984, THESIS TEXAS A M U C",False,1,"None"
"Zweig Rd, 1986, AQUACULT MAG     MAY","Zweig Rd, 1986, AQUACULT MAG     MAY, P34",False,1,"None"
"Adler Pr, 1988, AQUACULTURE","Adler Pr, 1988, AQUACULTURE, V4, P10",False,1,"None"
"Al-Ghawas Sa, 2004, ACTA HORTIC","Al-Ghawas Sa, 2004, ACTA HORTIC, P485",False,1,"None"
"*Apha Awwa, 1992, STAND METH EX WAT WA","*Apha Awwa, 1992, STAND METH EX WAT WA",False,1,"None"
"Areerat S, 1987, AQUACULTURE","Areerat S, 1987, AQUACULTURE, V63, P355",False,1,"None"
"Baum C, 1981, NEW ALCHEMY Q","Baum C, 1981, NEW ALCHEMY Q, V5, P3",False,1,"None"
"Benetti Dd, 1995, FISH B-NOAA","Benetti Dd, 1995, FISH B-NOAA, V93, P152",False,1,"None"
"Casiano Vl, 1988, APPL COURSE MEDIA SL","Casiano Vl, 1988, APPL COURSE MEDIA SL",False,1,"None"
"Cathcart Tp, 1999, AQUACULT ENG","Cathcart Tp, 1999, AQUACULT ENG, V20, P163",False,1,"None"
"Chaves Pa, 2000, WATER SCI TECHNOL","Chaves Pa, 2000, WATER SCI TECHNOL, V42, P43",False,1,"None"
"Choi Ky, 2001, ACTA HORTIC","Choi Ky, 2001, ACTA HORTIC, P575",False,1,"None"
"Chughtai Ma, 1995, THESIS ASIAN I TECHN","Chughtai Ma, 1995, THESIS ASIAN I TECHN",False,1,"None"
"Chun Changhoo, 1994, ENVIRONMENT CONTROL IN BIOLOGY","Chun Changhoo, 1994, ENVIRONMENT CONTROL IN BIOLOGY, V32, P125",False,1,"None"
"*Fao, 2001, SEL IND FOOD AGR DEV","*Fao, 2001, SEL IND FOOD AGR DEV",False,1,"None"
"Funge-Smith Sj, 1998, AQUACULTURE","Funge-Smith Sj, 1998, AQUACULTURE, V164, P117",False,1,"None"
"Gomez K A, 1984, STAT PROCEDURES AGR","Gomez K A, 1984, STAT PROCEDURES AGR, P680",False,1,"None"
"Gonnella M, 2004, ACTA HORTIC","Gonnella M, 2004, ACTA HORTIC, P61",False,1,"None"
"Hanlon Ea, 1998, HANDBOOK OF REFERENCE METHODS FOR PLANT ANALYSIS","Hanlon Ea, 1998, HANDBOOK OF REFERENCE METHODS FOR PLANT ANALYSIS, P157",False,1,"None"
"Hargreaves Ja, 2003, AQUACULT ENG","Hargreaves Ja, 2003, AQUACULT ENG, V28, P47",False,1,"None"
"Hargreaves Ja, 1999, J WORLD AQUACULT SOC","Hargreaves Ja, 1999, J WORLD AQUACULT SOC, V30, P410",False,1,"None"
"Harris D, 1978, HYDROPONICS GROWING","Harris D, 1978, HYDROPONICS GROWING",False,1,"None"
"Hochmuth G, 2003, FERTILIZATION RECOMM","Hochmuth G, 2003, FERTILIZATION RECOMM",False,1,"None"
"Huisman Ea, 1986, PRACTICAL MANUAL CUL","Huisman Ea, 1986, PRACTICAL MANUAL CUL",False,1,"None"
"Jantrarotai W, 1993, FARM MADE AQUAFEEDS","Jantrarotai W, 1993, FARM MADE AQUAFEEDS, P101",False,1,"None"
"Jeyakumar K, 2006, THESIS ASIAN I TECHN","Jeyakumar K, 2006, THESIS ASIAN I TECHN",False,1,"None"
"Jones Jb, 1997, HYDROPONICS PRACTICA","Jones Jb, 1997, HYDROPONICS PRACTICA",False,1,"None"
"Karam F, 2002, JOURNAL OF APPLIED HORTICULTURE (LUCKNOW)","Karam F, 2002, JOURNAL OF APPLIED HORTICULTURE (LUCKNOW), V4, P70",False,1,"None"
"Karimaei Ms, 2004, ACTA HORTIC","Karimaei Ms, 2004, ACTA HORTIC, P69",False,1,"None"
"Knight Sl, 1983, J AM SOC HORTIC SCI","Knight Sl, 1983, J AM SOC HORTIC SCI, V108, P750",False,1,"None"
"Kouka Pj, 1996, AQUACULT ENG","Kouka Pj, 1996, AQUACULT ENG, V15, P273",False,1,"None"
"Lan Ml, 1999, THESIS ASIAN I TECHN","Lan Ml, 1999, THESIS ASIAN I TECHN",False,1,"None"
"Landesman L, 1977, ESSAYS FOOD ENERGY","Landesman L, 1977, ESSAYS FOOD ENERGY, P121",False,1,"None"
"Laohavisuti N, 2000, USES AQUATIC MACROPH","Laohavisuti N, 2000, USES AQUATIC MACROPH",False,1,"None"
"Lin Ck, 2003, AQUACULTURE","Lin Ck, 2003, AQUACULTURE, V226, P57",False,1,"None"
"Little Dc, 1994, NAGA ICLARM Q","Little Dc, 1994, NAGA ICLARM Q, V17, P25",False,1,"None"
"Lock Maurice A, 1993, P113","Lock Maurice A, 1993, P113",False,1,"None"
"Lopes Sj, 2004, SCI AGR","Lopes Sj, 2004, SCI AGR, V61, P392",False,1,"None"
"Maruo T, 2004, ACTA HORTIC","Maruo T, 2004, ACTA HORTIC, P493",False,1,"None"
"Mires D, 1990, ISR J AQUACULT-BAMID","Mires D, 1990, ISR J AQUACULT-BAMID, V42, P110",False,2,"None"
"Ni Y, 2003, AQUACULTURE","Ni Y, 2003, AQUACULTURE, V217, P395",False,1,"None"
"Pierce B A, 1980, PROCEEDINGS OF THE 11TH ANNUAL MEETING OF THE WORLD MARICULTURE SOCIETY","Pierce B A, 1980, PROCEEDINGS OF THE 11TH ANNUAL MEETING OF THE WORLD MARICULTURE SOCIETY, ,",False,1,"None"
"Porrello S, 2005, AQUACULT INT","Porrello S, 2005, AQUACULT INT, V13, P97",False,1,"None"
"Prakash B, 2003, CURR SCI INDIA","Prakash B, 2003, CURR SCI INDIA, V85, P1299",False,1,"None"
"Rakocy Je, 1987, VIRGIN ISLANDS PERSP","Rakocy Je, 1987, VIRGIN ISLANDS PERSP, V1, P19",False,1,"None"
"Rakocy Je, 1992, SRAC PUBL","Rakocy Je, 1992, SRAC PUBL, V454",False,1,"None"
"Resh Hm, 1989, HYDROPONIC FOOD PROD","Resh Hm, 1989, HYDROPONIC FOOD PROD, P462",False,1,"None"
"Schwartz Mf, 1994, PROGRESSIVE FIS HCUL","Schwartz Mf, 1994, PROGRESSIVE FIS HCUL, V57, P225",False,1,"None"
"Seginer I, 2004, ANN BOT-LONDON","Seginer I, 2004, ANN BOT-LONDON, V94, P393",False,1,"None"
"Silber A, 2003, PLANT SOIL","Silber A, 2003, PLANT SOIL, V253, P467",False,1,"None"
"Simonne E, 2001, J PLANT NUTR","Simonne E, 2001, J PLANT NUTR, V24, P743",False,1,"None"
"Singh P, 1999, SOIL PHYS CHEM","Singh P, 1999, SOIL PHYS CHEM, P1",False,1,"None"
"Soundy P, 2005, HORTSCIENCE","Soundy P, 2005, HORTSCIENCE, V40, P607",False,1,"None"
"Thippayarugs S, 2001, JIRCAS J","Thippayarugs S, 2001, JIRCAS J, V9, P33",False,1,"None"
"Tindall H D, 1983, VEGETABLES IN THE TROPICS.","Tindall H D, 1983, VEGETABLES IN THE TROPICS.",False,1,"None"
"Wheaton Fw, 1994, AQUACULTURAL ENG","Wheaton Fw, 1994, AQUACULTURAL ENG",False,1,"None"
"Wood Cw, 2001, AQUANEWS","Wood Cw, 2001, AQUANEWS, V16, P13",False,1,"None"
"Yoshida S, 1997, BIOTRONICS","Yoshida S, 1997, BIOTRONICS, V26, P39",False,1,"None"
"Yoshida S, 1976, LAB MANUAL PHYSL LOG","Yoshida S, 1976, LAB MANUAL PHYSL LOG",False,1,"None"
"Akiyama K, 2005, NATURE","WOS:000229638700052, Akiyama K, Plant sesquiterpenes induce hyphal branching in arbuscular mycorrhizal fungi, NATURE, 435, 824",True,1,"WOS:000229638700052"
"Andrews Sc, 2003, FEMS MICROBIOL REV","Andrews Sc, 2003, FEMS MICROBIOL REV, V27, P215",False,1,"None"
"Baldwin I T, 2013, PIRIFORMOSPORA INDIC","Baldwin I T, 2013, PIRIFORMOSPORA INDIC, V33, P251",False,1,"None"
"Barton Ll, 1996, J PLANT NUTR","Barton Ll, 1996, J PLANT NUTR, V19, P1201",False,1,"None"
"Beijerinck Mw, 1888, BOT ZTG","Beijerinck Mw, 1888, BOT ZTG, V46, P725",False,1,"None"
"Biernbaum J, 2016, NATL ORGANIC STANDAR","Biernbaum J, 2016, NATL ORGANIC STANDAR",False,1,"None"
"Boiteau Rm, 2016, P NATL ACAD SCI USA","Boiteau Rm, 2016, P NATL ACAD SCI USA, V113, P14237",False,1,"None"
"Brear Em, 2013, FRONT PLANT SCI","Brear Em, 2013, FRONT PLANT SCI, V4",False,1,"None"
"Carini P, 2017, NAT MICROBIOL","Carini P, 2017, NAT MICROBIOL, V2",False,1,"None"
"Coleman-Derr D, 2014, FRONT MICROBIOL","Coleman-Derr D, 2014, FRONT MICROBIOL, V5",False,1,"None"
"Dessaux Y, 2016, TRENDS PLANT SCI","Dessaux Y, 2016, TRENDS PLANT SCI, V21, P266",False,1,"None"
"Dias T, 2015, J SCI FOOD AGR","Dias T, 2015, J SCI FOOD AGR, V95, P447",False,1,"None"
"Engle Cr, 2015, SRAC PUBLICATION","Engle Cr, 2015, SRAC PUBLICATION, V5006, P1",False,1,"None"
"Ettwig Kf, 2016, P NATL ACAD SCI USA","Ettwig Kf, 2016, P NATL ACAD SCI USA, V113, P12792",False,1,"None"
"Frederick Ja, 2015, EUR J HEAL BIOL ED","Frederick Ja, 2015, EUR J HEAL BIOL ED, V4, P9",False,1,"None"
"Glass J, 2015, MICROBE MAG","Glass J, 2015, MICROBE MAG, V10, P197",False,1,"None"
"Glass Jb, 2015, FRONT MICROBIOL","Glass Jb, 2015, FRONT MICROBIOL, V6",False,1,"None"
"Glass Jb, 2012, FRONT MICROBIOL","Glass Jb, 2012, FRONT MICROBIOL, V3",False,1,"None"
"Govindasamy V, 2010, MICROBIOL MONOGR","Govindasamy V, 2010, MICROBIOL MONOGR, V18, P333",False,1,"None"
"Hacquard S, 2015, CELL HOST MICROBE","Hacquard S, 2015, CELL HOST MICROBE, V17, P603",False,1,"None"
"Hart Er, 2014, FISHERIES","Hart Er, 2014, FISHERIES, V39, P525",False,1,"None"
"Hoflich G, 1995, MICROBIOL RES","Hoflich G, 1995, MICROBIOL RES, V150, P139",False,1,"None"
"Ji Sh, 2014, MICROBIOL RES","Ji Sh, 2014, MICROBIOL RES, V169, P83",False,1,"None"
"Khalifa Ayz, 2016, SAUDI J BIOL SCI","Khalifa Ayz, 2016, SAUDI J BIOL SCI, V23, P79",False,1,"None"
"Kloepper Jw, 1980, NATURE","Kloepper Jw, 1980, NATURE, V286, P885",False,1,"None"
"Klotz Mg, 2008, FEMS MICROBIOL LETT","Klotz Mg, 2008, FEMS MICROBIOL LETT, V278, P146",False,2,"None"
"Krsek M, 1999, J MICROBIOL METH","Krsek M, 1999, J MICROBIOL METH, V39, P1",False,1,"None"
"Lee S, 2015, OXIDATIVE MED CELLUL","Lee S, 2015, OXIDATIVE MED CELLUL, V2015, P9",False,1,"None"
"Loper Je, 1997, APPL ENVIRON MICROB","Loper Je, 1997, APPL ENVIRON MICROB, V63, P99",False,1,"None"
"Loper Je, 1999, APPL ENVIRON MICROB","Loper Je, 1999, APPL ENVIRON MICROB, V65, P5357",False,1,"None"
"Loper Je, 1991, MOL PLANT MICROBE IN","Loper Je, 1991, MOL PLANT MICROBE IN, V4, P5",False,1,"None"
"Loper Je, 2012, PLOS GENET","Loper Je, 2012, PLOS GENET, V8",False,1,"None"
"Low T, 2012, COLL TROPICAL AGR HU","Low T, 2012, COLL TROPICAL AGR HU",False,1,"None"
"Majeed A, 2015, FRONT MICROBIOL","Majeed A, 2015, FRONT MICROBIOL, V6",False,1,"None"
"Malusá E, 2012, SCI WORLD J","Malusá E, 2012, SCI WORLD J",False,1,"None"
"Marasco R, 2012, PLOS ONE","Marasco R, 2012, PLOS ONE, V7",False,1,"None"
"Martin-Laurent F, 2001, APPL ENVIRON MICROB","Martin-Laurent F, 2001, APPL ENVIRON MICROB, V67, P2354",False,1,"None"
"Mendes R, 2011, SCIENCE","Mendes R, 2011, SCIENCE, V332, P1097",False,1,"None"
"Mill H A, 1996, PLANT ANAL HDB","Mill H A, 1996, PLANT ANAL HDB",False,1,"None"
"Mueller Ug, 2015, TRENDS MICROBIOL","Mueller Ug, 2015, TRENDS MICROBIOL, V23, P606",False,1,"None"
