"ID","info","inCore","count","MK-ID"
"Harris D, 1992, HYDROPONICS COMPLETE","Harris D, 1992, HYDROPONICS COMPLETE",False,1,"None"
"Hopkins Js, 1999, J WORLD AQUACULT SOC","Hopkins Js, 1999, J WORLD AQUACULT SOC, V24, P304",False,1,"None"
"Konnerup D, 2009, ECOL ENG","Konnerup D, 2009, ECOL ENG, V35, P248",False,1,"None"
"Long Dn, 2006, SCI J CANTHO U","Long Dn, 2006, SCI J CANTHO U, V2, P93",False,1,"None"
"Losordo Tm, 2000, AQUACULT ENG","Losordo Tm, 2000, AQUACULT ENG, V22, P3",False,1,"None"
"Mcmurtry Mr, 1993, J PLANT NUTR","Mcmurtry Mr, 1993, J PLANT NUTR, V16, P407",False,1,"None"
"Mcmurtry Mr, 1997, J WORLD AQUACULT SOC","WOS:000071073600013, McMurtry MR, Efficiency of water use of an integrated fish/vegetable co-culture system, JOURNAL OF THE WORLD AQUACULTURE SOCIETY, 28, 420",True,8,"WOS:000071073600013"
"Trang Ntd, 2014, AQUAC RES","Trang Ntd, 2014, AQUAC RES, V45, P460",False,2,"None"
"Nhan Dk, 2008, AQUAC RES","Nhan Dk, 2008, AQUAC RES, V39, P1216",False,1,"None"
"Piedras Srn, 2006, SCI AGR","Piedras Srn, 2006, SCI AGR, V63, P184",False,1,"None"
"Popma T, 1999, SRAC PUBLICATION","Popma T, 1999, SRAC PUBLICATION, V283",False,1,"None"
"Rakocy Je, 2006, SRAC PUBLICATION","Rakocy Je, 2006, SRAC PUBLICATION, P2006",False,8,"None"
"Spencer Df, 2006, AQUAT BOT","Spencer Df, 2006, AQUAT BOT, V84, P272",False,1,"None"
"Suresh Av, 1992, AQUACULT ENG","Suresh Av, 1992, AQUACULT ENG, V11, P1",False,1,"None"
"Thien Cp, 2009, AQUACULTURE","Thien Cp, 2009, AQUACULTURE, V295, P1",False,1,"None"
"Adler Pr, 1998, AQUAPONICS J","Adler Pr, 1998, AQUAPONICS J, V4, P10",False,1,"None"
"Anderson Je, 1989, TROPICAL SOIL BIOL F","Anderson Je, 1989, TROPICAL SOIL BIOL F, P171",False,1,"None"
"Cataldo Da, 1975, COMMUN SOIL SCI PLAN","Cataldo Da, 1975, COMMUN SOIL SCI PLAN, V6, P71",False,1,"None"
"European Commission, 2002, OFFICIAL J EUROPEAN","European Commission, 2002, OFFICIAL J EUROPEAN, VL86, P5",False,1,"None"
"Lennard Wa, 2004, AQUAPONICS THEORY IN","Lennard Wa, 2004, AQUAPONICS THEORY IN",False,2,"None"
"Lennard Wa, 2004, AQUACULT INT","Lennard Wa, 2004, AQUACULT INT, V12, P539",False,7,"None"
"Lennard Wa, 2006, AQUACULT INT","WOS:000241789800002, Lennard Wilson A., A comparison of three different hydroponic sub-systems (gravel bed floating and nutrient film technique) in an Aquaponic test system, AQUACULTURE INTERNATIONAL, 14, 539",True,12,"WOS:000241789800002"
"Licamele J, 2009, THESIS U ARIZONA","Licamele J, 2009, THESIS U ARIZONA",False,1,"None"
"Masser M P, 1992, SRAC PUBLICATION","Masser M P, 1992, SRAC PUBLICATION",False,2,"None"
"Rakocy Je, 2004, UPDATE TILAPIA VEGET","Rakocy Je, 2004, UPDATE TILAPIA VEGET",False,2,"None"
"Rico-Garcia E, 2009, TRENDS IN AGRICULTURAL ECONOMICS","Rico-Garcia E, 2009, TRENDS IN AGRICULTURAL ECONOMICS, V2, P1",False,1,"None"
"Savidov N, 2005, EVALUATION DEV AQUAP","Savidov N, 2005, EVALUATION DEV AQUAP",False,2,"None"
"Seawright De, 1998, AQUACULTURE","WOS:000073586200003, Seawright DE, Nutrient dynamics in integrated aquaculture-hydroponics systems, AQUACULTURE, 160, 215",True,18,"WOS:000073586200003"
"Tyson R V, 2004, PROCEEDINGS OF THE FLORIDA STATE HORTICULTURAL SOCIETY","Tyson R V, 2004, PROCEEDINGS OF THE FLORIDA STATE HORTICULTURAL SOCIETY, V117, P79",False,2,"None"
"Arimoro Fo, 2006, AFR J BIOTECHNOL","Arimoro Fo, 2006, AFR J BIOTECHNOL, V5, P536",False,1,"None"
"Cébron A, 2004, APPL ENVIRON MICROB","Cébron A, 2004, APPL ENVIRON MICROB, V70, P6726",False,1,"None"
"Crab R, 2007, AQUACULTURE","Crab R, 2007, AQUACULTURE, V270, P1",False,1,"None"
"Cuhel J, 2010, APPL ENVIRON MICROB","Cuhel J, 2010, APPL ENVIRON MICROB, V76, P1870",False,1,"None"
"Daum D, 1996, PLANT SOIL","Daum D, 1996, PLANT SOIL, V183, P69",False,1,"None"
"Fao F, 2012, STATE WORLD FISHERIE","Fao F, 2012, STATE WORLD FISHERIE",False,3,"None"
"Fujita K, 2007, INORG CHEM","Fujita K, 2007, INORG CHEM, V46, P613",False,1,"None"
"Heydarnejad Ms, 2012, TURK J VET ANIM SCI","Heydarnejad Ms, 2012, TURK J VET ANIM SCI, V36, P245",False,1,"None"
"Hu Z, 2013, BIORESOURCE TECHNOL","Hu Z, 2013, BIORESOURCE TECHNOL, V130, P314",False,3,"None"
"Kampschreur Mj, 2009, WATER RES","Kampschreur Mj, 2009, WATER RES, V43, P4093",False,2,"None"
"Kim Ym, 2007, J HAZARD MATER","Kim Ym, 2007, J HAZARD MATER, V141, P27",False,1,"None"
"Lemarié G, 2004, AQUACULTURE","Lemarié G, 2004, AQUACULTURE, V229, P479",False,1,"None"
"Liao Cs, 2006, CHEMOSPHERE","Liao Cs, 2006, CHEMOSPHERE, V65, P1715",False,1,"None"
"Nelson Rl, 2007, AQUAPONICS J","Nelson Rl, 2007, AQUAPONICS J, V4, P30",False,1,"None"
"Rajagopal R, 2013, BIORESOURCE TECHNOL","Rajagopal R, 2013, BIORESOURCE TECHNOL, V143, P632",False,3,"None"
"Silva Cr, 2007, AQUACULTURE","Silva Cr, 2007, AQUACULTURE, V264, P135",False,1,"None"
"Soetan K O, 2010, AFRICAN JOURNAL OF FOOD SCIENCE","Soetan K O, 2010, AFRICAN JOURNAL OF FOOD SCIENCE, V4, P200",False,1,"None"
"Somerville Christopher, 2014, FAO FISHERIES AND AQUACULTURE TECHNICAL PAPER","Somerville Christopher, 2014, FAO FISHERIES AND AQUACULTURE TECHNICAL PAPER, V589, P1",False,3,"None"
"Sun Sc, 2013, INT BIODETER BIODEGR","Sun Sc, 2013, INT BIODETER BIODEGR, V85, P545",False,1,"None"
"Tang Hl, 2015, BIORESOURCE TECHNOL","Tang Hl, 2015, BIORESOURCE TECHNOL, V190, P76",False,1,"None"
"Tyson Rv, 2008, J PLANT NUTR","Tyson Rv, 2008, J PLANT NUTR, V31, P2018",False,3,"None"
"Wang Q, 2015, ENVIRON SCI POLLUT R","Wang Q, 2015, ENVIRON SCI POLLUT R, V22, P7476",False,2,"None"
"Wunderlin P, 2012, WATER RES","Wunderlin P, 2012, WATER RES, V46, P1027",False,2,"None"
"Xia Yq, 2013, CHEMOSPHERE","Xia Yq, 2013, CHEMOSPHERE, V92, P421",False,2,"None"
"Yoshihara Toshihiro, 2014, ENVIRONMENTAL CONTROL IN BIOLOGY","Yoshihara Toshihiro, 2014, ENVIRONMENTAL CONTROL IN BIOLOGY, V52, P137",False,1,"None"
"Zhi W, 2014, WATER RES","Zhi W, 2014, WATER RES, V64, P32",False,3,"None"
"Zhu J, 2013, BIOGEOCHEMISTRY","Zhu J, 2013, BIOGEOCHEMISTRY, V116, P103",False,1,"None"
"Abell Gcj, 2012, PLOS ONE","Abell Gcj, 2012, PLOS ONE, V7",False,1,"None"
"Auffret M, 2013, FEMS MICROBIOL ECOL","Auffret M, 2013, FEMS MICROBIOL ECOL, V84, P235",False,2,"None"
"Ayres Dl, 2012, SYST BIOL","Ayres Dl, 2012, SYST BIOL, V61, P170",False,1,"None"
"Badiola M, 2012, AQUACULT ENG","Badiola M, 2012, AQUACULT ENG, V51, P26",False,1,"None"
"Bagchi S, 2014, PLOS ONE","Bagchi S, 2014, PLOS ONE, V9",False,1,"None"
"Barange M, 2014, NAT CLIM CHANGE","Barange M, 2014, NAT CLIM CHANGE, V4, P211",False,1,"None"
"Chen Sl, 2006, AQUACULT ENG","Chen Sl, 2006, AQUACULT ENG, V34, P179",False,3,"None"
"Christman Gd, 2011, APPL ENVIRON MICROB","Christman Gd, 2011, APPL ENVIRON MICROB, V77, P2026",False,1,"None"
"Costa E, 2006, TRENDS MICROBIOL","Costa E, 2006, TRENDS MICROBIOL, V14, P213",False,2,"None"
"Daims H, 2016, TRENDS MICROBIOL","Daims H, 2016, TRENDS MICROBIOL, V24, P699",False,1,"None"
"Daims H, 2015, NATURE","WOS:000366991900042, Daims Holger, Complete nitrification by <i>Nitrospira</i> bacteria, NATURE, 528, 504",True,2,"WOS:000366991900042"
"De Schryver P, 2014, ISME J","De Schryver P, 2014, ISME J, V8, P2360",False,1,"None"
"Edgar Rc, 2004, NUCLEIC ACIDS RES","Edgar Rc, 2004, NUCLEIC ACIDS RES, V32, P1792",False,2,"None"
"Eren Am, 2015, ISME J","Eren Am, 2015, ISME J, V9, P968",False,1,"None"
"Eren Am, 2013, PLOS ONE","Eren Am, 2013, PLOS ONE, V8",False,1,"None"
"Fisher Jc, 2015, ELEMENTA-SCI ANTHROP","Fisher Jc, 2015, ELEMENTA-SCI ANTHROP, V3",False,1,"None"
"Harrell Jr Fe, 2016, HMISC HARRELL MISCEL","Harrell Jr Fe, 2016, HMISC HARRELL MISCEL",False,1,"None"
"Hatzenpichler R, 2012, APPL ENVIRON MICROB","Hatzenpichler R, 2012, APPL ENVIRON MICROB, V78, P7501",False,1,"None"
"Hovanec Ta, 1996, APPL ENVIRON MICROB","Hovanec Ta, 1996, APPL ENVIRON MICROB, V62, P2888",False,1,"None"
"Hovanec Ta, 1998, APPL ENVIRON MICROB","Hovanec Ta, 1998, APPL ENVIRON MICROB, V64, P258",False,2,"None"
"Hüpeden J, 2016, APPL ENVIRON MICROB","Hüpeden J, 2016, APPL ENVIRON MICROB, V82, P1838",False,2,"None"
"Huse Sm, 2014, MICROBIOME","Huse Sm, 2014, MICROBIOME, V2",False,1,"None"
"Huse Sm, 2014, BMC BIOINFORMATICS","Huse Sm, 2014, BMC BIOINFORMATICS, V15",False,1,"None"
"Huse Sm, 2008, PLOS GENET","Huse Sm, 2008, PLOS GENET, V4",False,1,"None"
"Kindaichi T, 2004, APPL ENVIRON MICROB","Kindaichi T, 2004, APPL ENVIRON MICROB, V70, P1641",False,1,"None"
"Klinger D, 2012, ANNU REV ENV RESOUR","Klinger D, 2012, ANNU REV ENV RESOUR, V37, P247",False,3,"None"
"Könneke M, 2005, NATURE","Könneke M, 2005, NATURE, V437, P543",False,2,"None"
"Kruse Myriam, 2013, PLOS ONE","Kruse Myriam, 2013, PLOS ONE, V8, PE64737",False,1,"None"
"Kuhn Dd, 2010, AQUACULT ENG","Kuhn Dd, 2010, AQUACULT ENG, V43, P78",False,2,"None"
"Lee De, 2016, J MICROBIOL","Lee De, 2016, J MICROBIOL, V54, P296",False,1,"None"
"Lehtovirta-Morley Le, 2016, FEMS MICROBIOL ECOL","Lehtovirta-Morley Le, 2016, FEMS MICROBIOL ECOL, V92",False,1,"None"
"Ludwig W, 2004, NUCLEIC ACIDS RES","Ludwig W, 2004, NUCLEIC ACIDS RES, V32, P1363",False,2,"None"
"Luesken Fa, 2011, APPL MICROBIOL BIOT","Luesken Fa, 2011, APPL MICROBIOL BIOT, V92, P845",False,1,"None"
"Martin M, 2011, EMBNET J","Martin M, 2011, EMBNET J, V17, P10",False,1,"None"
"Martins Cim, 2010, AQUACULT ENG","Martins Cim, 2010, AQUACULT ENG, V43, P83",False,6,"None"
"Meyer Jl, 2013, FRONT MICROBIOL","Meyer Jl, 2013, FRONT MICROBIOL, V4",False,1,"None"
"Michaud L, 2014, AQUACULT ENG","Michaud L, 2014, AQUACULT ENG, V58, P77",False,2,"None"
"Miller Ma, 2010, P GAT COMP ENV WORKS","Miller Ma, 2010, P GAT COMP ENV WORKS, P1",False,1,"None"
"Mussmann M, 2011, P NATL ACAD SCI USA","Mussmann M, 2011, P NATL ACAD SCI USA, V108, P16771",False,1,"None"
"Nelson Mc, 2014, PLOS ONE","Nelson Mc, 2014, PLOS ONE, V9",False,1,"None"
"Newton Rj, 2015, MBIO","Newton Rj, 2015, MBIO, V6",False,1,"None"
"Nowka B, 2015, APPL ENVIRON MICROB","Nowka B, 2015, APPL ENVIRON MICROB, V81, P745",False,2,"None"
"Okabe S, 1995, WATER SCI TECHNOL","Okabe S, 1995, WATER SCI TECHNOL, V32, P67",False,1,"None"
"Oksanen J, 2022, R PACKAGE VERSION 25","Oksanen J, 2022, R PACKAGE VERSION 25",False,1,"None"
"Pester M, 2014, ENVIRON MICROBIOL","Pester M, 2014, ENVIRON MICROBIOL, V16, P3055",False,2,"None"
"Pester M, 2012, ENVIRON MICROBIOL","Pester M, 2012, ENVIRON MICROBIOL, V14, P525",False,2,"None"
"Pester M, 2011, CURR OPIN MICROBIOL","Pester M, 2011, CURR OPIN MICROBIOL, V14, P300",False,1,"None"
"Piedrahita Rh, 2003, AQUACULTURE","Piedrahita Rh, 2003, AQUACULTURE, V226, P35",False,6,"None"
"Pinto Aj, 2016, MSPHERE","Pinto Aj, 2016, MSPHERE, V1",False,1,"None"
"Poly F, 2008, FEMS MICROBIOL ECOL","Poly F, 2008, FEMS MICROBIOL ECOL, V63, P132",False,1,"None"
"R Core Team, 2013, R LANG ENV STAT COMP","R Core Team, 2013, R LANG ENV STAT COMP",False,2,"None"
"Randall D J, 2002, MARINE POLLUTION BULLETIN","Randall D J, 2002, MARINE POLLUTION BULLETIN, V45, P17",False,3,"None"
"Rice P, 2000, TRENDS GENET","Rice P, 2000, TRENDS GENET, V16, P276",False,1,"None"
"Rotthauwe Jh, 1997, APPL ENVIRON MICROB","Rotthauwe Jh, 1997, APPL ENVIRON MICROB, V63, P4704",False,4,"None"
"Sakami T, 2012, MAR GENOM","Sakami T, 2012, MAR GENOM, V7, P27",False,2,"None"
"Sauder La, 2011, PLOS ONE","Sauder La, 2011, PLOS ONE, V6",False,1,"None"
"Schreier Hj, 2010, CURR OPIN BIOTECH","Schreier Hj, 2010, CURR OPIN BIOTECH, V21, P318",False,3,"None"
"Sedlacek Cj, 2016, APPL ENVIRON MICROB","Sedlacek Cj, 2016, APPL ENVIRON MICROB, V82, P4776",False,1,"None"
"Stamatakis A, 2014, BIOINFORMATICS","Stamatakis A, 2014, BIOINFORMATICS, V30, P1312",False,2,"None"
"Sugita H, 2005, AQUACULTURE","Sugita H, 2005, AQUACULTURE, V243, P403",False,2,"None"
"Tourna M, 2008, ENVIRON MICROBIOL","Tourna M, 2008, ENVIRON MICROBIOL, V10, P1357",False,2,"None"
"Untergasser A, 2012, NUCLEIC ACIDS RES","Untergasser A, 2012, NUCLEIC ACIDS RES, V40",False,1,"None"
"Urakawa H, 2008, APPL ENVIRON MICROB","Urakawa H, 2008, APPL ENVIRON MICROB, V74, P894",False,1,"None"
"Van Kessel Mahj, 2016, ENV MICROBIOL REP","Van Kessel Mahj, 2016, ENV MICROBIOL REP, V8, P590",False,1,"None"
"Van Kessel Mahj, 2015, NATURE","Van Kessel Mahj, 2015, NATURE, V528, P555",False,1,"None"
"Van Kessel Mahj, 2010, AQUACULTURE","Van Kessel Mahj, 2010, AQUACULTURE, V306, P177",False,3,"None"
"Verdegem Mcj, 2006, INT J WATER RESOUR D","Verdegem Mcj, 2006, INT J WATER RESOUR D, V22, P101",False,1,"None"
"Wertz S, 2008, FEMS MICROBIOL ECOL","Wertz S, 2008, FEMS MICROBIOL ECOL, V63, P261",False,1,"None"
"Adams P, 1993, PLANT SOIL","Adams P, 1993, PLANT SOIL, V154, P127",False,1,"None"
"Adams P, 1986, ACTA HORTIC","Adams P, 1986, ACTA HORTIC, V190, P253",False,1,"None"
"Bakker S, 1989, GLASSHOUSE CROPS RES","Bakker S, 1989, GLASSHOUSE CROPS RES, P42",False,1,"None"
"Barker A V, 1980, HORTICULTURAL REVIEWS","Barker A V, 1980, HORTICULTURAL REVIEWS, V2, P395",False,1,"None"
"Boertje Ga, 1982, TUINDERIJ","Boertje Ga, 1982, TUINDERIJ, V62, P46",False,1,"None"
"Bromfield Sm, 1978, PLANT SOIL","Bromfield Sm, 1978, PLANT SOIL, V49, P23",False,1,"None"
"Clement Cr, 1978, J EXP BOT","Clement Cr, 1978, J EXP BOT, V29, P453",False,2,"None"
"Conover Ca, 1986, HORTSCIENCE","Conover Ca, 1986, HORTSCIENCE, V21, P1008",False,1,"None"
"De Kreij C, 1999, BEMESTINGSADVIESBASI","De Kreij C, 1999, BEMESTINGSADVIESBASI",False,1,"None"
"Dekreij C, 1992, J HORTIC SCI","Dekreij C, 1992, J HORTIC SCI, V67, P45",False,1,"None"
"Dekreij C, 1993, COMMUN SOIL SCI PLAN","Dekreij C, 1993, COMMUN SOIL SCI PLAN, V24, P227",False,1,"None"
"Dekreij C, 1996, J PLANT NUTR","Dekreij C, 1996, J PLANT NUTR, V19, P361",False,1,"None"
"Dekreij C, 1990, SCI HORTIC-AMSTERDAM","Dekreij C, 1990, SCI HORTIC-AMSTERDAM, V44, P293",False,1,"None"
"Dekreij C, 1997, 2 VG PROEFST TUINB O","Dekreij C, 1997, 2 VG PROEFST TUINB O, V2",False,1,"None"
"Feigin A, 1984, PROCEEDINGS","Feigin A, 1984, PROCEEDINGS, ,",False,1,"None"
"Feigin A, 1986, ACTA HORTICULTURAE","Feigin A, 1986, ACTA HORTICULTURAE, P127",False,1,"None"
"Garcia-Mina J, 2003, J PLANT NUTR","Garcia-Mina J, 2003, J PLANT NUTR, V26, P1943",False,1,"None"
"Graves C J, 1983, HORTICULTURAL REVIEWS","Graves C J, 1983, HORTICULTURAL REVIEWS, V5, P1",False,1,"None"
"Ho Lc, 1994, ANN BOT","Ho Lc, 1994, ANN BOT, P539",False,1,"None"
"Ho Lc, 1989, PLANTS TODAY","Ho Lc, 1989, PLANTS TODAY, V2, P202",False,1,"None"
"Howell W, 1961, CROP SCI","Howell W, 1961, CROP SCI, V1, P311",False,1,"None"
"Ikeda H, 1980, J JPN SOC HORTIC SCI","Ikeda H, 1980, J JPN SOC HORTIC SCI, V48, P435",False,1,"None"
"Ikeda H, 1983, J JPN SOC HORTIC SCI","Ikeda H, 1983, J JPN SOC HORTIC SCI, V52, P159",False,1,"None"
"Ingestad T, 1970, PHYSIOLOGIA PLANTARUM","Ingestad T, 1970, PHYSIOLOGIA PLANTARUM, V23, P1127",False,1,"None"
"Ingestad T, 1973, PLANT PHYSIOL","Ingestad T, 1973, PLANT PHYSIOL, V52, P332",False,1,"None"
"Jensen M H, 1985, HORTICULTURAL REVIEWS","Jensen M H, 1985, HORTICULTURAL REVIEWS, V7, P483",False,1,"None"
"Lindsay W L, 1967, INT SOC SOIL SCI SCO","Lindsay W L, 1967, INT SOC SOIL SCI SCO, V4, P305",False,1,"None"
"Lindsay Wl, 1969, SOIL SCI SOC AM PRO","Lindsay Wl, 1969, SOIL SCI SOC AM PRO, V33, P62",False,1,"None"
"Lindsay Wl, 1967, INT SOC SOIL SCI T C","Lindsay Wl, 1967, INT SOC SOIL SCI T C, V2, P305",False,1,"None"
"Maloupa E, 2002, HYDROPONIC PRODUCTIO","Maloupa E, 2002, HYDROPONIC PRODUCTIO",False,1,"None"
"Marti Hr, 1991, J PLANT NUTR","Marti Hr, 1991, J PLANT NUTR, V14, P1165",False,1,"None"
"Massey D, 1980, ACTA HORTICULTURAE (WAGENINGEN)","Massey D, 1980, ACTA HORTICULTURAE (WAGENINGEN), P127",False,1,"None"
"Masui M, 1982, J JPN SOC HORTIC SCI","Masui M, 1982, J JPN SOC HORTIC SCI, V50, P475",False,1,"None"
"Mcneal Bl, 1970, SOIL SCI","Mcneal Bl, 1970, SOIL SCI, V110, P405",False,1,"None"
"Mengel K, 1987, PRINCIPLES PLANT NUT","Mengel K, 1987, PRINCIPLES PLANT NUT",False,1,"None"
"Reichwein Am, 2007, MODEL CALCULATIONS M","Reichwein Am, 2007, MODEL CALCULATIONS M",False,1,"None"
"Robson A D, 1983, ENCYCLOPEDIA OF PLANT PHYSIOLOGY. NEW SERIES. VOLUME 15A. INORGANIC PLANT NUTRITION","Robson A D, 1983, ENCYCLOPEDIA OF PLANT PHYSIOLOGY. NEW SERIES. VOLUME 15A. INORGANIC PLANT NUTRITION, P147",False,1,"None"
"Roelofs T, 1992, VAKBLAD BLOEMISTERIJ","Roelofs T, 1992, VAKBLAD BLOEMISTERIJ, V47, P55",False,1,"None"
"Runia W T, 1995, ACTA HORTICULTURAE","Runia W T, 1995, ACTA HORTICULTURAE, P221",False,1,"None"
"Sakamoto Y, 2001, ACTA HORTIC","Sakamoto Y, 2001, ACTA HORTIC, P459",False,1,"None"
"Savvas D, 1994, ANGEW BOT","Savvas D, 1994, ANGEW BOT, V68, P32",False,1,"None"
"Savvas D, 2008, EUR J PLANT SCI BIOT","Savvas D, 2008, EUR J PLANT SCI BIOT, V2, P45",False,1,"None"
"Siddiqi My, 1998, J PLANT NUTR","Siddiqi My, 1998, J PLANT NUTR, V21, P1879",False,1,"None"
"Sonneveld C, 1995, J PLANT NUTR","Sonneveld C, 1995, J PLANT NUTR, V18, P501",False,1,"None"
"Sonneveld C, 2008, ACTA HORTIC","Sonneveld C, 2008, ACTA HORTIC, P313",False,1,"None"
"Sonneveld C, 1997, ACTA HORTIC","Sonneveld C, 1997, ACTA HORTIC, P139",False,1,"None"
"Sonneveld C, 1986, SOILLESS CULTURE","Sonneveld C, 1986, SOILLESS CULTURE, V2, P49",False,1,"None"
"Sonneveld C, 2004, J PLANT NUTR","Sonneveld C, 2004, J PLANT NUTR, V27, P1931",False,1,"None"
"Sonneveld C, 1991, NETH J AGR SCI","Sonneveld C, 1991, NETH J AGR SCI, V39, P115",False,1,"None"
"Sonneveld C, 1985, J PLANT NUTR","Sonneveld C, 1985, J PLANT NUTR, V8, P585",False,1,"None"
"Sonneveld C, 2009, ACTA HORTIC","Sonneveld C, 2009, ACTA HORTIC, V819, P87",False,1,"None"
"Sonneveld C, 1991, HIGH-TECH AND MICROPROPAGATION 1","Sonneveld C, 1991, HIGH-TECH AND MICROPROPAGATION 1, P285",False,1,"None"
"Sonneveld C, 1984, COMMUN SOIL SCI PLAN","Sonneveld C, 1984, COMMUN SOIL SCI PLAN, V15, P519",False,1,"None"
"Sonneveld C, 1994, COMMUN SOIL SCI PLAN","Sonneveld C, 1994, COMMUN SOIL SCI PLAN, V25, P3199",False,1,"None"
"Sonneveld C, 2001, ACTA HORTIC","Sonneveld C, 2001, ACTA HORTIC, P247",False,1,"None"
"Sonneveld C, 1999, PLANT SOIL","Sonneveld C, 1999, PLANT SOIL, V209, P47",False,1,"None"
"Sonneveld C, 1999, J PLANT NUTR","Sonneveld C, 1999, J PLANT NUTR, V22, P1033",False,1,"None"
"Sonneveld C, 2004, 1 C INT HORT INT 2 3","Sonneveld C, 2004, 1 C INT HORT INT 2 3, P82",False,1,"None"
"Sonneveld C, 2002, HYDROPONIC PRODUCTIO","Sonneveld C, 2002, HYDROPONIC PRODUCTIO, P179",False,2,"None"
"Sonneveld C, 1980, ACTA HORTIC","Sonneveld C, 1980, ACTA HORTIC, V98, P171",False,1,"None"
"Sonneveld C, 1988, 18 PROEFST TUINB OND","Sonneveld C, 1988, 18 PROEFST TUINB OND",False,1,"None"
"Sonneveld C, 2005, ACTA HORTIC","Sonneveld C, 2005, ACTA HORTIC, V697, P377",False,1,"None"
"Sonneveld C, 1994, VOEDINGSOPLOSSINGEN","Sonneveld C, 1994, VOEDINGSOPLOSSINGEN, V8, P4",False,1,"None"
"Sonneveld C, 1994, P SIN INT COLL SOILL","Sonneveld C, 1994, P SIN INT COLL SOILL, P88",False,1,"None"
"Sonneveld C, 1991, FERTIGATION CHEMIGAT","Sonneveld C, 1991, FERTIGATION CHEMIGAT, P186",False,1,"None"
"Sonneveld C, 1993, HYDROPONICS ENV","Sonneveld C, 1993, HYDROPONICS ENV, P21",False,1,"None"
"Van Os Ea, 2002, HYDROPONIC PRODUCTIO","Van Os Ea, 2002, HYDROPONIC PRODUCTIO, P103",False,1,"None"
"Vandenbos Al, 1995, EC RELATIE TYPE SUBS","Vandenbos Al, 1995, EC RELATIE TYPE SUBS",False,1,"None"
"Vandrenth Bb, 1997, EUR J GEN PRACT","Vandrenth Bb, 1997, EUR J GEN PRACT, V3, P90",False,1,"None"
"Vanos Pc, 1991, VAKBLAD BLOEMISTERIJ","Vanos Pc, 1991, VAKBLAD BLOEMISTERIJ, V46, P52",False,1,"None"
"Verhagen Jbg, 1992, ERVARINGEN MET TEELT","Verhagen Jbg, 1992, ERVARINGEN MET TEELT",False,1,"None"
"Verloo Mg, 1980, ACTA HORTIC","Verloo Mg, 1980, ACTA HORTIC, V99, P51",False,1,"None"
"Voogt W, 2004, ACTA HORTIC","Voogt W, 2004, ACTA HORTIC, P359",False,1,"None"
"Voogt W, 2009, ACTA HORTIC","Voogt W, 2009, ACTA HORTIC, V819, P411",False,1,"None"
"Voogt W, 1995, ACTA HORTICULTURAE","Voogt W, 1995, ACTA HORTICULTURAE, P327",False,1,"None"
"Voogt W, 1989, GROENTEN EN FRUIT","Voogt W, 1989, GROENTEN EN FRUIT, V44, P38",False,1,"None"
"Voogt W, 1994, VAKBLAD BLOEMISTERIJ","Voogt W, 1994, VAKBLAD BLOEMISTERIJ, V49, P32",False,1,"None"
"Voogt W, 1997, PLANT PRODUCTION CLO","Voogt W, 1997, PLANT PRODUCTION CLO, P83",False,1,"None"
"Voogt W, 1996, GROENTEN FRUIT GLASG","Voogt W, 1996, GROENTEN FRUIT GLASG, V6, P16",False,1,"None"
"Voogt W, 2006, 4161607 WAG UR GLAST","Voogt W, 2006, 4161607 WAG UR GLAST",False,1,"None"
"Voogt W, 1997, GROENTEN FRUIT VAKDE","Voogt W, 1997, GROENTEN FRUIT VAKDE, V7, P12",False,1,"None"
"Voogt W, 2002, POTASSIUM SUSTAINABL","Voogt W, 2002, POTASSIUM SUSTAINABL, P347",False,2,"None"
"Wild A, 1987, ADV AGRON","Wild A, 1987, ADV AGRON, V41, P171",False,1,"None"
"Zozorna P, 1987, J PLANT NUTR","Zozorna P, 1987, J PLANT NUTR, V10, P773",False,1,"None"
"Basha Mb, 2015, PROC ECON FINANC","Basha Mb, 2015, PROC ECON FINANC, V31, P444",False,1,"None"
"Bekker Ga, 2017, APPETITE","Bekker Ga, 2017, APPETITE, V108, P245",False,1,"None"
"Buehler D, 2016, SUSTAINABILITY-BASEL","Buehler D, 2016, SUSTAINABILITY-BASEL, V8",False,2,"None"
"Callieris R, 2016, NEW MEDIT","Callieris R, 2016, NEW MEDIT, V15, P53",False,1,"None"
"Dolnicar S, 2003, AUSTR J MARK RES","Dolnicar S, 2003, AUSTR J MARK RES, V11, P5",False,1,"None"
"Eigenbrod C, 2015, AGRON SUSTAIN DEV","Eigenbrod C, 2015, AGRON SUSTAIN DEV, V35, P483",False,1,"None"
"Falguera V, 2012, FOOD CONTROL","Falguera V, 2012, FOOD CONTROL, V26, P274",False,1,"None"
"Fornell C, 1996, J MARKETING","Fornell C, 1996, J MARKETING, V60, P7",False,1,"None"
"Gámbaro Adriana, 2012, BRAZ. J. FOOD TECHNOL.","Gámbaro Adriana, 2012, BRAZ. J. FOOD TECHNOL., V15, P307",False,1,"None"
"Gliem Ja, 2003, CALCULATING INTERPRE","Gliem Ja, 2003, CALCULATING INTERPRE",False,1,"None"
"Gómez-Limón Ja, 2013, IRRIG DRAIN","Gómez-Limón Ja, 2013, IRRIG DRAIN, V62, P322",False,1,"None"
"Hilverda F, 2017, FOOD QUAL PREFER","Hilverda F, 2017, FOOD QUAL PREFER, V56, P107",False,1,"None"
"Iraizoz B, 2007, AGR SYST","Iraizoz B, 2007, AGR SYST, V93, P143",False,1,"None"
"Johnson Md, 2001, J ECON PSYCHOL","Johnson Md, 2001, J ECON PSYCHOL, V22, P217",False,1,"None"
"Joly A, 2015, ECOCYCLES","Joly A, 2015, ECOCYCLES, V1, P3",False,3,"None"
"Kassarjian Hh, 1971, J MARKETING RES","Kassarjian Hh, 1971, J MARKETING RES, V8, P409",False,1,"None"
"Kulcsar E, 2010, MANAG MARK","Kulcsar E, 2010, MANAG MARK, V5, P151",False,1,"None"
"Love Dc, 2015, AQUACULTURE","WOS:000345229500008, Love David C., Commercial aquaponics production and profitability: Findings from an international survey, AQUACULTURE, 435, 67",True,11,"WOS:000345229500008"
"Mauracher C, 2013, APPETITE","Mauracher C, 2013, APPETITE, V63, P84",False,1,"None"
"Nikiforova A P, 2016, MEDITERRANEAN J SOCI","Nikiforova A P, 2016, MEDITERRANEAN J SOCI, V7, P118",False,1,"None"
"Orsini F, 2013, AGRON SUSTAIN DEV","Orsini F, 2013, AGRON SUSTAIN DEV, V33, P695",False,1,"None"
"Dos Santos Mjpl, 2016, URBAN FOR URBAN GREE","Dos Santos Mjpl, 2016, URBAN FOR URBAN GREE, V20, P402",False,1,"None"
"Dos Santos Mjpl, 2013, AGR ECON-CZECH","Dos Santos Mjpl, 2013, AGR ECON-CZECH, V59, P49",False,1,"None"
"Dos Santos Mjpl, 2010, AGR ECON-CZECH","Dos Santos Mjpl, 2010, AGR ECON-CZECH, V56, P460",False,1,"None"
"Richetin J, 2016, J ECON PSYCHOL","Richetin J, 2016, J ECON PSYCHOL, V55, P96",False,1,"None"
"Rohm Aj, 2004, J BUS RES","Rohm Aj, 2004, J BUS RES, V57, P748",False,1,"None"
"Savidov N, 2004, 679056201 CROP DIV C","Savidov N, 2004, 679056201 CROP DIV C",False,1,"None"
"Silva E, 2004, NEW MEDIT","Silva E, 2004, NEW MEDIT, V3, P39",False,1,"None"
"Silva E, 2013, EFFICIENCY MEASURES","Silva E, 2013, EFFICIENCY MEASURES, P83",False,1,"None"
"Somerville C, 2014, FAO FISH AQUAC TECH","Somerville C, 2014, FAO FISH AQUAC TECH",False,1,"None"
"Specht K, 2016, AGRON SUSTAIN DEV","Specht K, 2016, AGRON SUSTAIN DEV, V36",False,2,"None"
"Specht K, 2014, AGR HUM VALUES","Specht K, 2014, AGR HUM VALUES, V31, P33",False,2,"None"
"Tamin M, 2015, OSR J BUS MANAG","Tamin M, 2015, OSR J BUS MANAG, V17, P49",False,2,"None"
"Tokunaga K, 2015, J WORLD AQUACULT SOC","WOS:000350136100002, Tokunaga Kanae, Economics of Small-scale Commercial Aquaponics in Hawai'i, JOURNAL OF THE WORLD AQUACULTURE SOCIETY, 46, 20",True,4,"WOS:000350136100002"
"Trocchia Pj, 2003, J FOOD PROD MARK","Trocchia Pj, 2003, J FOOD PROD MARK, V9, P11",False,1,"None"
"Vigneau E, 2001, FOOD QUAL PREFER","Vigneau E, 2001, FOOD QUAL PREFER, V12, P359",False,1,"None"
"Zugravu Ga, 2016, P INT C RISK CONT EC","Zugravu Ga, 2016, P INT C RISK CONT EC, P1",False,1,"None"
"[No Title Captured]","[No Title Captured]",False,12,"None"
"Amaro Hm, 2011, FORMATEX MICROBIOLOG","Amaro Hm, 2011, FORMATEX MICROBIOLOG, V3, P1271",False,1,"None"
"Aoi Y, 2000, J BIOSCI BIOENG","Aoi Y, 2000, J BIOSCI BIOENG, V90, P234",False,1,"None"
"Attramadal Kjk, 2012, AQUACULTURE","Attramadal Kjk, 2012, AQUACULTURE, V330, P121",False,1,"None"
"Attramadal Kjk, 2012, AQUACULT ENG","Attramadal Kjk, 2012, AQUACULT ENG, V46, P27",False,1,"None"
"Auffret M, 2011, WATER RES","Auffret M, 2011, WATER RES, V45, P6753",False,1,"None"
"Balcázar Jl, 2006, VET MICROBIOL","Balcázar Jl, 2006, VET MICROBIOL, V114, P173",False,1,"None"
"Belser Lw, 1984, APPL ENVIRON MICROB","Belser Lw, 1984, APPL ENVIRON MICROB, V48, P1100",False,1,"None"
"Bergh O, 1994, CAN J FISH AQUAT SCI","Bergh O, 1994, CAN J FISH AQUAT SCI, V51, P1899",False,1,"None"
"Bergheim A, 2009, AQUACULT ENG","Bergheim A, 2009, AQUACULT ENG, V41, P46",False,1,"None"
"Bergheim A, 2011, AQ AM 2011 NEW ORL L","Bergheim A, 2011, AQ AM 2011 NEW ORL L",False,1,"None"
"Blancheton Jp, 1995, AQUACULTURE","Blancheton Jp, 1995, AQUACULTURE, V133, P215",False,1,"None"
"Brown Tm, 2012, J FOOD SCI","Brown Tm, 2012, J FOOD SCI, V77, PS377",False,1,"None"
"Burr Gs, 2012, AQUACULT ENG","Burr Gs, 2012, AQUACULT ENG, V50, P28",False,1,"None"
