"ID","info","inCore","count","MK-ID"
"Dalrymple Dg, 1973, CONTROLLED ENV AGR G","Dalrymple Dg, 1973, CONTROLLED ENV AGR G",False,2,"None"
"Harrison Ja, 2013, J FOOD PROTECT","Harrison Ja, 2013, J FOOD PROTECT, V76, P1989",False,1,"None"
"Jones J B, 2005, HYDROPONICS PRACTICA","Jones J B, 2005, HYDROPONICS PRACTICA",False,2,"None"
"Lewis Wm, 1978, T AM FISH SOC","Lewis Wm, 1978, T AM FISH SOC, V107, P92",False,12,"None"
"Love Dc, 2014, PLOS ONE","WOS:000341306600090, Love David C., An International Survey of Aquaponics Practitioners, PLOS ONE, 9",True,8,"WOS:000341306600090"
"Low S A, 2011, DIRECT INTERMEDIATED","Low S A, 2011, DIRECT INTERMEDIATED, P1",False,1,"None"
"Naegel Lca, 1977, AQUACULTURE","WOS:A1977CV88700002, NAEGEL LCA, COMBINED PRODUCTION OF FISH AND PLANTS IN RECIRCULATING WATER, AQUACULTURE, 10, 17",True,14,"WOS:A1977CV88700002"
"Nmfs, 2013, FISH US 2012","Nmfs, 2013, FISH US 2012",False,1,"None"
"Prusky D, 2011, FOOD SECUR","Prusky D, 2011, FOOD SECUR, V3, P463",False,1,"None"
"Rakocy J, 2006, RECIRCULATING AQUACU","Rakocy J, 2006, RECIRCULATING AQUACU",False,2,"None"
"Rakocy Je, 2012, AQUACULTURE PRODUCTI","Rakocy Je, 2012, AQUACULTURE PRODUCTI, P344",False,9,"None"
"Sneed K, 1975, AQUACULTURE FISH FAR","Sneed K, 1975, AQUACULTURE FISH FAR, V2, P18",False,5,"None"
"Tyson R, 2009, HYDROPONIC VEGETABLE","Tyson R, 2009, HYDROPONIC VEGETABLE, P1",False,1,"None"
"Usda, 2009, EXPL ALT FARM DEF","Usda, 2009, EXPL ALT FARM DEF",False,1,"None"
"Usda, 2006, USDA SPEC STUD","Usda, 2006, USDA SPEC STUD, V3",False,1,"None"
"Watten Bj, 1984, AQUACULTURE","Watten Bj, 1984, AQUACULTURE, V41, P271",False,13,"None"
"Anbar Ad, 2002, SCIENCE","Anbar Ad, 2002, SCIENCE, V297, P1137",False,1,"None"
"Anbar Ad, 2007, SCIENCE","Anbar Ad, 2007, SCIENCE, V317, P1903",False,1,"None"
"Batjes Nh, 1996, EUR J SOIL SCI","Batjes Nh, 1996, EUR J SOIL SCI, V47, P151",False,1,"None"
"Berner R A, 2004, PHANEROZOIC CARBON C","Berner R A, 2004, PHANEROZOIC CARBON C",False,1,"None"
"Berner Ra, 2006, GEOLOGY","Berner Ra, 2006, GEOLOGY, V34, P413",False,1,"None"
"Berner Ra, 2006, GEOCHIM COSMOCHIM AC","Berner Ra, 2006, GEOCHIM COSMOCHIM AC, V70, P5653",False,1,"None"
"Bouwman Af, 1990, SOILS AND THE GREENHOUSE EFFECT","Bouwman Af, 1990, SOILS AND THE GREENHOUSE EFFECT, P61",False,1,"None"
"Brandes Ja, 2008, ASTROBIOLOGY","Brandes Ja, 2008, ASTROBIOLOGY, V8, P1113",False,1,"None"
"Brocks Jj, 2005, NATURE","Brocks Jj, 2005, NATURE, V437, P866",False,1,"None"
"Canfield De, 2005, ADV MAR BIOL","Canfield De, 2005, ADV MAR BIOL, V48, P313",False,1,"None"
"Canfield De, 1998, NATURE","Canfield De, 1998, NATURE, V396, P450",False,1,"None"
"Canfield De, 2006, PHILOS T R SOC B","Canfield De, 2006, PHILOS T R SOC B, V361, P1819",False,1,"None"
"Canfield De, 2008, SCIENCE","Canfield De, 2008, SCIENCE, V321, P949",False,1,"None"
"Capone Dg, 2001, CURR OPIN MICROBIOL","Capone Dg, 2001, CURR OPIN MICROBIOL, V4, P341",False,1,"None"
"Chambers He, 1981, QUINQUEREME","Chambers He, 1981, QUINQUEREME, V4, P291",False,1,"None"
"Codispoti La, 2010, SCIENCE","Codispoti La, 2010, SCIENCE, V327, P1339",False,1,"None"
"Demaneche S, 2009, APPL ENVIRON MICROB","Demaneche S, 2009, APPL ENVIRON MICROB, V75, P534",False,1,"None"
"Diaz Rj, 2008, SCIENCE","Diaz Rj, 2008, SCIENCE, V321, P926",False,1,"None"
"Dore Je, 1998, NATURE","Dore Je, 1998, NATURE, V396, P63",False,1,"None"
"Duce Ra, 2008, SCIENCE","Duce Ra, 2008, SCIENCE, V320, P893",False,1,"None"
"Eady Rr, 1996, CHEM REV","Eady Rr, 1996, CHEM REV, V96, P3013",False,1,"None"
"Falkowski Pg, 2008, PHILOS T R SOC B","Falkowski Pg, 2008, PHILOS T R SOC B, V363, P2705",False,1,"None"
"Falkowski Pg, 2008, SCIENCE","Falkowski Pg, 2008, SCIENCE, V320, P1034",False,1,"None"
"Falkowski Pg, 1997, NATURE","Falkowski Pg, 1997, NATURE, V387, P272",False,1,"None"
"Farquhar J, 2000, SCIENCE","Farquhar J, 2000, SCIENCE, V289, P756",False,1,"None"
"Fennel K, 2005, AM J SCI","Fennel K, 2005, AM J SCI, V305, P526",False,1,"None"
"Field Cb, 1998, SCIENCE","Field Cb, 1998, SCIENCE, V281, P237",False,1,"None"
"Firestone Mk, 1989, LIFE SCI R","Firestone Mk, 1989, LIFE SCI R, V47, P7",False,1,"None"
"Fixen Pe, 2002, AMBIO","Fixen Pe, 2002, AMBIO, V31, P169",False,1,"None"
"Forster P, 2007, AR4 CLIMATE CHANGE 2007: THE PHYSICAL SCIENCE BASIS","Forster P, 2007, AR4 CLIMATE CHANGE 2007: THE PHYSICAL SCIENCE BASIS, P129",False,2,"None"
"Frei R, 2009, NATURE","Frei R, 2009, NATURE, V461, P250",False,1,"None"
"Galloway Jn, 2008, SCIENCE","Galloway Jn, 2008, SCIENCE, V320, P889",False,1,"None"
"Galloway Jn, 2004, BIOGEOCHEMISTRY","Galloway Jn, 2004, BIOGEOCHEMISTRY, V70, P153",False,1,"None"
"Godfrey Lv, 2009, NAT GEOSCI","Godfrey Lv, 2009, NAT GEOSCI, V2, P725",False,1,"None"
"Gruber N, 2008, NATURE","Gruber N, 2008, NATURE, V451, P293",False,1,"None"
"Holland Hd, 1984, CHEM EVOLUTION ATMOS","Holland Hd, 1984, CHEM EVOLUTION ATMOS",False,1,"None"
"Howard Jb, 2006, P NATL ACAD SCI USA","Howard Jb, 2006, P NATL ACAD SCI USA, V103, P17088",False,1,"None"
"Iniguez Al, 2004, MOL PLANT MICROBE IN","Iniguez Al, 2004, MOL PLANT MICROBE IN, V17, P1078",False,1,"None"
"Johnston Dt, 2009, P NATL ACAD SCI USA","Johnston Dt, 2009, P NATL ACAD SCI USA, V106, P16925",False,1,"None"
"Kasting Jf, 1990, ORIGINS LIFE EVOL B","Kasting Jf, 1990, ORIGINS LIFE EVOL B, V20, P199",False,1,"None"
"Kasting Jf, 1981, J GEOPHYS RES-OCEANS","Kasting Jf, 1981, J GEOPHYS RES-OCEANS, V86, P1147",False,1,"None"
"Kasting Jf, 1982, J GEOPHYS RES-OCEANS","Kasting Jf, 1982, J GEOPHYS RES-OCEANS, V87, P3091",False,1,"None"
"Likens Ge, 1981, SOME PERSPECTIVES MA","Likens Ge, 1981, SOME PERSPECTIVES MA, P93",False,1,"None"
"Mancinelli Rl, 1988, ORIGINS LIFE EVOL B","Mancinelli Rl, 1988, ORIGINS LIFE EVOL B, V18, P311",False,1,"None"
"Mosier Ar, 1998, CLIMATIC CHANGE","Mosier Ar, 1998, CLIMATIC CHANGE, V40, P7",False,1,"None"
"Peoples Mb, 2009, SYMBIOSIS","Peoples Mb, 2009, SYMBIOSIS, V48, P1",False,1,"None"
"Petersen Bt, 2007, AM GEOPH UN FALL M A","Petersen Bt, 2007, AM GEOPH UN FALL M A",False,1,"None"
"Piña-Ochoa E, 2010, P NATL ACAD SCI USA","Piña-Ochoa E, 2010, P NATL ACAD SCI USA, V107, P1148",False,1,"None"
"Quan Tm, 2009, GEOBIOLOGY","Quan Tm, 2009, GEOBIOLOGY, V7, P124",False,1,"None"
"Raun Wr, 2002, AGRON J","Raun Wr, 2002, AGRON J, V94, P815",False,1,"None"
"Ravishankara Ar, 2009, SCIENCE","Ravishankara Ar, 2009, SCIENCE, V326, P123",False,2,"None"
"Raymond J, 2004, MOL BIOL EVOL","Raymond J, 2004, MOL BIOL EVOL, V21, P541",False,1,"None"
"Rudnick R L, 2003, TREATISE GEOCHEMISTR","Rudnick R L, 2003, TREATISE GEOCHEMISTR, P1",False,1,"None"
"Schlesinger Wh, 2009, P NATL ACAD SCI USA","Schlesinger Wh, 2009, P NATL ACAD SCI USA, V106, P203",False,1,"None"
"Scott C, 2008, NATURE","Scott C, 2008, NATURE, V452, P456",False,1,"None"
"Seitzinger Sp, 2002, ESTUARIES","Seitzinger Sp, 2002, ESTUARIES, V25, P640",False,1,"None"
"Smirnov A, 2008, GEOCHEM T","Smirnov A, 2008, GEOCHEM T, V9",False,1,"None"
"Sterner R W, 2002, ECOLOGICAL STOICHIOM","Sterner R W, 2002, ECOLOGICAL STOICHIOM",False,1,"None"
"Strous M, 2006, NATURE","Strous M, 2006, NATURE, V440, P790",False,1,"None"
"Subbarao Gv, 2009, BREEDING SCI","Subbarao Gv, 2009, BREEDING SCI, V59, P529",False,1,"None"
"Summers Dp, 2007, ASTROBIOLOGY","Summers Dp, 2007, ASTROBIOLOGY, V7, P333",False,1,"None"
"Summers Dp, 1993, NATURE","Summers Dp, 1993, NATURE, V365, P630",False,1,"None"
"Tester M, 2010, SCIENCE","Tester M, 2010, SCIENCE, V327, P818",False,1,"None"
"Thamdrup Bo, 2008, MICROBIAL ECOLOGY OC","Thamdrup Bo, 2008, MICROBIAL ECOLOGY OC, P527",False,1,"None"
"Trenberth Ke, 1994, J GEOPHYS RES-ATMOS","Trenberth Ke, 1994, J GEOPHYS RES-ATMOS, V99, P23079",False,1,"None"
"Vitousek Pm, 1997, SCIENCE","Vitousek Pm, 1997, SCIENCE, V277, P494",False,1,"None"
"Yokochi R, 2009, GEOCHIM COSMOCHIM AC","Yokochi R, 2009, GEOCHIM COSMOCHIM AC, V73, P4843",False,1,"None"
"Brady N C, 1990, NATURE PROPERTIES SO","Brady N C, 1990, NATURE PROPERTIES SO",False,1,"None"
"Lewis Wm, 1981, P WORLD S AQ HEAT EF","Lewis Wm, 1981, P WORLD S AQ HEAT EF, V1, P121",False,1,"None"
"Lorenz Oa, 1980, KNOTTS HDB VEGETABLE","Lorenz Oa, 1980, KNOTTS HDB VEGETABLE",False,1,"None"
"Mcmurtry M R, 1997, JOURNAL OF APPLIED AQUACULTURE","Mcmurtry M R, 1997, JOURNAL OF APPLIED AQUACULTURE, V7, P33",False,4,"None"
"Mcmurtry Mr, 1993, J PROD AGRIC","Mcmurtry Mr, 1993, J PROD AGRIC, V6, P428",False,3,"None"
"Mickey S, 1989, ANN M NC GREENH VEG","Mickey S, 1989, ANN M NC GREENH VEG",False,1,"None"
"*Min Ar Rep Eg Us, 1982, STRAT ACC AGR DEV RE","*Min Ar Rep Eg Us, 1982, STRAT ACC AGR DEV RE",False,1,"None"
"Nair A, 1985, P 2 INT C WARM WAT A","Nair A, 1985, P 2 INT C WARM WAT A, P223",False,2,"None"
"Paller M H, 1982, AQUACULTURAL ENGINEERING","Paller M H, 1982, AQUACULTURAL ENGINEERING, V1, P139",False,1,"None"
"Phillips Mj, 1991, AQUACULTURE WATER QU","Phillips Mj, 1991, AQUACULTURE WATER QU, P568",False,1,"None"
"Rakocy Je, 1989, WORLD AQUAC","Rakocy Je, 1989, WORLD AQUAC, V20, P42",False,2,"None"
"Rakocy J E, 1993, P AQ ENG C 21 23 JUN","Rakocy J E, 1993, P AQ ENG C 21 23 JUN",False,1,"None"
"Rakocy Je, 1993, ASAE PUBL","Rakocy Je, 1993, ASAE PUBL, V93, P148",False,16,"None"
"Sanders Dc, 1989, J AM SOC HORTIC SCI","Sanders Dc, 1989, J AM SOC HORTIC SCI, V114, P904",False,1,"None"
"*Usda, 1975, USDA HDB","*Usda, 1975, USDA HDB, V8",False,1,"None"
"Winsor Gw, 1985, GROWERS B","Winsor Gw, 1985, GROWERS B, V5",False,1,"None"
"Bach Ac, 1982, AM J CLIN NUTR","Bach Ac, 1982, AM J CLIN NUTR, V36, P950",False,1,"None"
"Bradford Mm, 1976, ANAL BIOCHEM","Bradford Mm, 1976, ANAL BIOCHEM, V72, P248",False,2,"None"
"Camargo Ja, 2006, ENVIRON INT","Camargo Ja, 2006, ENVIRON INT, V32, P831",False,1,"None"
"Chaplin Ae, 1967, COMP BIOCHEM PHYSIOL","Chaplin Ae, 1967, COMP BIOCHEM PHYSIOL, V20, P195",False,1,"None"
"Cheng Sy, 1999, AQUAT TOXICOL","Cheng Sy, 1999, AQUAT TOXICOL, V45, P35",False,1,"None"
"Das Pc, 2004, COMP BIOCHEM PHYS C","Das Pc, 2004, COMP BIOCHEM PHYS C, V138, P3",False,1,"None"
"Diamantino Tc, 2001, CHEMOSPHERE","Diamantino Tc, 2001, CHEMOSPHERE, V45, P553",False,1,"None"
"Eddy Fb, 1987, CHEM ECOL","Eddy Fb, 1987, CHEM ECOL, V3, P1",False,1,"None"
"Hall Mr, 1998, J WORLD AQUACULT SOC","Hall Mr, 1998, J WORLD AQUACULT SOC, V29, P290",False,1,"None"
"Heckman Cw, 1997, B ENVIRON CONTAM TOX","Heckman Cw, 1997, B ENVIRON CONTAM TOX, V58, P8",False,1,"None"
"Hegazi Mm, 2010, AQUACULTURE","Hegazi Mm, 2010, AQUACULTURE, V299, P149",False,1,"None"
"Hong Ml, 2009, COMP BIOCHEM PHYS C","Hong Ml, 2009, COMP BIOCHEM PHYS C, V149, P419",False,1,"None"
"Jackson C, 2003, AQUACULTURE","Jackson C, 2003, AQUACULTURE, V218, P397",False,1,"None"
"Lewis Wm, 1986, T AM FISH SOC","Lewis Wm, 1986, T AM FISH SOC, V115, P183",False,2,"None"
"Lorenzon S, 2008, AQUACULTURE","Lorenzon S, 2008, AQUACULTURE, V278, P156",False,1,"None"
"Mashiko K, 1990, J CRUSTACEAN BIOL","Mashiko K, 1990, J CRUSTACEAN BIOL, V10, P306",False,1,"None"
"Mcewen Bs, 2003, HORM BEHAV","Mcewen Bs, 2003, HORM BEHAV, V43, P2",False,1,"None"
"Mercier L, 2006, AQUACULTURE","Mercier L, 2006, AQUACULTURE, V258, P633",False,1,"None"
"Mugnier C, 2004, J EXP MAR BIOL ECOL","Mugnier C, 2004, J EXP MAR BIOL ECOL, V309, P35",False,1,"None"
"Naylor Rl, 2000, NATURE","Naylor Rl, 2000, NATURE, V405, P1017",False,5,"None"
"Patterson L, 2007, MAR BIOL","Patterson L, 2007, MAR BIOL, V152, P265",False,1,"None"
"Qin Bq, 2007, HYDROBIOLOGIA","Qin Bq, 2007, HYDROBIOLOGIA, V581, P3",False,1,"None"
"Racotta Is, 2000, COMP BIOCHEM PHYS A","Racotta Is, 2000, COMP BIOCHEM PHYS A, V125, P437",False,1,"None"
"Romano N, 2009, ECOTOX ENVIRON SAFE","Romano N, 2009, ECOTOX ENVIRON SAFE, V72, P1287",False,1,"None"
"Sowers A, 2004, J WORLD AQUACULT SOC","Sowers A, 2004, J WORLD AQUACULT SOC, V35, P445",False,1,"None"
"Stentiford Gd, 2001, GEN COMP ENDOCR","Stentiford Gd, 2001, GEN COMP ENDOCR, V121, P13",False,1,"None"
"Tanzer Ml, 1959, J BIOL CHEM","Tanzer Ml, 1959, J BIOL CHEM, V234, P3201",False,1,"None"
"Tomasso J R, 1994, REV FISHERIES SCI","Tomasso J R, 1994, REV FISHERIES SCI, V2, P291",False,1,"None"
"Van Harreveld A, 1936, P SOC EXP BIOL MED","Van Harreveld A, 1936, P SOC EXP BIOL MED, V34, P428",False,1,"None"
"Wallimann T, 1992, BIOCHEM J","Wallimann T, 1992, BIOCHEM J, V281, P21",False,1,"None"
"Wang Wn, 2004, AQUACULTURE","Wang Wn, 2004, AQUACULTURE, V232, P679",False,1,"None"
"Xuan Rj, 2011, COMP BIOCHEM PHYS C","Xuan Rj, 2011, COMP BIOCHEM PHYS C, V154, P268",False,1,"None"
"Yildiz Hy, 2004, ECOTOX ENVIRON SAFE","Yildiz Hy, 2004, ECOTOX ENVIRON SAFE, V59, P370",False,1,"None"
"Acosta-Nassar Marco V, 1994, JOURNAL OF THE WORLD AQUACULTURE SOCIETY","Acosta-Nassar Marco V, 1994, JOURNAL OF THE WORLD AQUACULTURE SOCIETY, V25, P261",False,1,"None"
"Alabaster Js, 1982, EIFAC TECHNICAL PAPE","Alabaster Js, 1982, EIFAC TECHNICAL PAPE, V41, P5",False,1,"None"
"Andersen Jm, 1974, ARCH HYDROBIOL","Andersen Jm, 1974, ARCH HYDROBIOL, V74, P528",False,1,"None"
"Andersen Tk, 1984, MAR BIOL","Andersen Tk, 1984, MAR BIOL, V83, P171",False,1,"None"
"Avnimelech Y, 1979, BAMIDGEH","Avnimelech Y, 1979, BAMIDGEH, V31, P3",False,1,"None"
"Avnimelech Y, 1986, AQUACULTURE AND FISHERIES MANAGEMENT","Avnimelech Y, 1986, AQUACULTURE AND FISHERIES MANAGEMENT, V17, P231",False,1,"None"
"Avnimelech Y, 1989, ISR J AQUACULT-BAMID","Avnimelech Y, 1989, ISR J AQUACULT-BAMID, V41, P58",False,1,"None"
"Avnimelech Y, 1984, SPECIAL PUBLICATION","Avnimelech Y, 1984, SPECIAL PUBLICATION, V8, P41",False,1,"None"
"Ayub M, 1993, PROG FISH CULT","Ayub M, 1993, PROG FISH CULT, V55, P210",False,1,"None"
"Belser Lw, 1979, ANNU REV MICROBIOL","Belser Lw, 1979, ANNU REV MICROBIOL, V83, P171",False,1,"None"
"Beveridge Mcm, 1989, AQUACULTURE","Beveridge Mcm, 1989, AQUACULTURE, V81, P373",False,1,"None"
"Beveridge Mcm, 1994, PROG FISH CULT","Beveridge Mcm, 1994, PROG FISH CULT, V56, P282",False,1,"None"
"Billen G, 1978, ESTUAR COAST MAR SCI","Billen G, 1978, ESTUAR COAST MAR SCI, V7, P127",False,1,"None"
"Binnerup Sj, 1992, APPL ENVIRON MICROB","Binnerup Sj, 1992, APPL ENVIRON MICROB, V58, P303",False,1,"None"
"Blackburn Th, 1988, MAR ECOL PROG SER","Blackburn Th, 1988, MAR ECOL PROG SER, V44, P221",False,1,"None"
"Blackburn Th, 1983, LIMNOL OCEANOGR","Blackburn Th, 1983, LIMNOL OCEANOGR, V28, P477",False,1,"None"
"Blackburn Th, 1979, APPL ENVIRON MICROB","Blackburn Th, 1979, APPL ENVIRON MICROB, V37, P760",False,1,"None"
"Boyd C E, 1990, WATER QUALITY PONDS","Boyd C E, 1990, WATER QUALITY PONDS",False,2,"None"
"Boyd Ce, 1992, PROCEEDINGS OF THE SPECIAL SESSION ON SHRIMP FARMING","Boyd Ce, 1992, PROCEEDINGS OF THE SPECIAL SESSION ON SHRIMP FARMING, P166",False,1,"None"
"Boyd Ce, 1985, T AM FISH SOC","Boyd Ce, 1985, T AM FISH SOC, V114, P291",False,1,"None"
"Boyd Ce, 1984, PROG FISH CULT","Boyd Ce, 1984, PROG FISH CULT, V46, P37",False,1,"None"
"Boyd Ce, 1994, WORLD AQUACULTURE","Boyd Ce, 1994, WORLD AQUACULTURE, V25, P578",False,1,"None"
"Boyd Claude E, 1994, JOURNAL OF THE WORLD AQUACULTURE SOCIETY","Boyd Claude E, 1994, JOURNAL OF THE WORLD AQUACULTURE SOCIETY, V25, P517",False,1,"None"
"Boynton Wr, 1980, ESTUARINE PERSPECTIV","Boynton Wr, 1980, ESTUARINE PERSPECTIV, P93",False,1,"None"
"Breukelaar Aw, 1994, FRESHWATER BIOL","Breukelaar Aw, 1994, FRESHWATER BIOL, V32, P113",False,1,"None"
"Briggs M R P, 1996, AQUACULTURE RESEARCH","Briggs M R P, 1996, AQUACULTURE RESEARCH, V27, P301",False,1,"None"
"Briggs M R P, 1994, AQUACULTURE AND FISHERIES MANAGEMENT","Briggs M R P, 1994, AQUACULTURE AND FISHERIES MANAGEMENT, V25, P789",False,1,"None"
"Brown P B, 1989, JOURNAL OF THE WORLD AQUACULTURE SOCIETY","Brown P B, 1989, JOURNAL OF THE WORLD AQUACULTURE SOCIETY, V20, P245",False,1,"None"
"Caffrey Jm, 1995, ESTUARIES","Caffrey Jm, 1995, ESTUARIES, V18, P219",False,1,"None"
"Callender E, 1982, ESTUAR COAST SHELF S","Callender E, 1982, ESTUAR COAST SHELF S, V15, P395",False,1,"None"
"Carpenter Ke, 1986, P21","Carpenter Ke, 1986, P21",False,1,"None"
"Cerco Cf, 1989, HYDROBIOLOGIA","Cerco Cf, 1989, HYDROBIOLOGIA, V174, P185",False,1,"None"
"Chan Yk, 1980, CAN J FISH AQUAT SCI","Chan Yk, 1980, CAN J FISH AQUAT SCI, V37, P506",False,1,"None"
"Chan Yk, 1979, APPL ENVIRON MICROB","Chan Yk, 1979, APPL ENVIRON MICROB, V37, P1067",False,1,"None"
"Chatarpaul L, 1980, CAN J FISH AQUAT SCI","Chatarpaul L, 1980, CAN J FISH AQUAT SCI, V37, P656",False,1,"None"
"Chiayvareesajja S, 1993, AQUACULTURE","Chiayvareesajja S, 1993, AQUACULTURE, V116, P33",False,1,"None"
"Chiba K, 1986, 1 AS FISH FOR AS FIS","Chiba K, 1986, 1 AS FISH FOR AS FIS, P31",False,1,"None"
"Chien Yh, 1992, PROCEEDINGS OF THE SPECIAL SESSION ON SHRIMP FARMING","Chien Yh, 1992, PROCEEDINGS OF THE SPECIAL SESSION ON SHRIMP FARMING, P144",False,1,"None"
"Clifford Hc, 1992, PROCEEDINGS OF THE SPECIAL SESSION ON SHRIMP FARMING","Clifford Hc, 1992, PROCEEDINGS OF THE SPECIAL SESSION ON SHRIMP FARMING, P110",False,1,"None"
"Cline Jm, 1994, HYDROBIOLOGIA","Cline Jm, 1994, HYDROBIOLOGIA, V275, P301",False,1,"None"
"Cole Ba, 1986, PROG FISH CULT","Cole Ba, 1986, PROG FISH CULT, V48, P25",False,1,"None"
"Colt J, 1991, AQUACULT ENG","Colt J, 1991, AQUACULT ENG, V10, P1",False,1,"None"
"Colt J, 1978, AQUACULTURE","Colt J, 1978, AQUACULTURE, V15, P353",False,1,"None"
"Costa-Pierce Ba, 1989, AQUABYTE","Costa-Pierce Ba, 1989, AQUABYTE, V2, P5",False,1,"None"
"Dangelo Em, 1993, SOIL SCI SOC AM J","Dangelo Em, 1993, SOIL SCI SOC AM J, V57, P1156",False,1,"None"
"Daniels H V, 1989, JOURNAL OF THE WORLD AQUACULTURE SOCIETY","Daniels H V, 1989, JOURNAL OF THE WORLD AQUACULTURE SOCIETY, V20, P53",False,1,"None"
"Delaune R D, 1989, NORTHEAST GULF SCIENCE","Delaune R D, 1989, NORTHEAST GULF SCIENCE, V10, P163",False,1,"None"
"Delaune Rd, 1987, J ENVIRON QUAL","Delaune Rd, 1987, J ENVIRON QUAL, V16, P227",False,1,"None"
"Delaune Rd, 1991, J ENVIRON SCI HEAL A","Delaune Rd, 1991, J ENVIRON SCI HEAL A, V26, P1287",False,1,"None"
"Diab S, 1992, AQUACULTURE","Diab S, 1992, AQUACULTURE, V101, P33",False,2,"None"
"Diab S, 1986, BAMIDGEH","Diab S, 1986, BAMIDGEH, V38, P67",False,1,"None"
"Elsamra Mi, 1979, AQUACULTURE","Elsamra Mi, 1979, AQUACULTURE, V18, P367",False,1,"None"
"Eppley Rw, 1969, LIMNOL OCEANOGR","Eppley Rw, 1969, LIMNOL OCEANOGR, V14, P912",False,1,"None"
"Erickson Mj, IN PRESS LAKE RESERV","Erickson Mj, IN PRESS LAKE RESERV",False,1,"None"
"Fast Aw, 1992, MARINE SHRIMP CULTUR","Fast Aw, 1992, MARINE SHRIMP CULTUR, P457",False,1,"None"
"Fenchel T, 1979, BACTERIA MINERAL CYC","Fenchel T, 1979, BACTERIA MINERAL CYC",False,1,"None"
"Ferrara Ra, 1982, J WATER POLLUT CON F","Ferrara Ra, 1982, J WATER POLLUT CON F, V54, P361",False,1,"None"
"Fillos J, 1975, J WATER POLLUT CON F","Fillos J, 1975, J WATER POLLUT CON F, V47, P1032",False,1,"None"
"Focht D D, 1977, ADV MICROB ECOL","Focht D D, 1977, ADV MICROB ECOL, P135",False,1,"None"
"Folke C, 1989, AMBIO","Folke C, 1989, AMBIO, V18, P234",False,1,"None"
"Foree Eg, 1971, ADV WATER POLLUTION","Foree Eg, 1971, ADV WATER POLLUTION, V2",False,1,"None"
"Foy Rh, 1991, AQUACULTURE","Foy Rh, 1991, AQUACULTURE, V96, P31",False,3,"None"
"Freedman Pl, 1977, J ENV ENG DIV-ASCE","Freedman Pl, 1977, J ENV ENG DIV-ASCE, V103, P233",False,1,"None"
"Goldman Jc, 1979, WATER RES","Goldman Jc, 1979, WATER RES, V13, P119",False,1,"None"
"Gowen Rj, 1987, OCEANOGR MAR BIOL","Gowen Rj, 1987, OCEANOGR MAR BIOL, V25, P563",False,1,"None"
"Green Bartholomew W, 1995, JOURNAL OF THE WORLD AQUACULTURE SOCIETY","Green Bartholomew W, 1995, JOURNAL OF THE WORLD AQUACULTURE SOCIETY, V26, P284",False,1,"None"
"Green Bw, 1989, AQUACULTURE","Green Bw, 1989, AQUACULTURE, V76, P37",False,1,"None"
"Hall Poj, 1992, MAR ECOL PROG SER","Hall Poj, 1992, MAR ECOL PROG SER, V89, P81",False,4,"None"
"Hansen Ji, 1981, MICROBIAL ECOL","Hansen Ji, 1981, MICROBIAL ECOL, V7, P297",False,1,"None"
"Hargrave Bt, 1993, MAR ECOL PROG SER","Hargrave Bt, 1993, MAR ECOL PROG SER, V96, P249",False,1,"None"
"Hargreaves Ja, 1997, AQUACULT ENG","Hargreaves Ja, 1997, AQUACULT ENG, V16, P27",False,1,"None"
"Hargreaves Ja, 1996, J WORLD AQUACULT SOC","Hargreaves Ja, 1996, J WORLD AQUACULT SOC, V27, P21",False,1,"None"
"Hariyadi Sigid, 1994, JOURNAL OF THE WORLD AQUACULTURE SOCIETY","Hariyadi Sigid, 1994, JOURNAL OF THE WORLD AQUACULTURE SOCIETY, V25, P236",False,1,"None"
"Henriksen K, 1980, MICROBIAL ECOL","Henriksen K, 1980, MICROBIAL ECOL, V6, P329",False,1,"None"
"Henriksen K, 1981, MAR BIOL","Henriksen K, 1981, MAR BIOL, V61, P299",False,1,"None"
"Henriksen K, 1980, OPHELIA","Henriksen K, 1980, OPHELIA, P249",False,1,"None"
"Hesslien Rh, 1977, THESIS COLUMBIA U","Hesslien Rh, 1977, THESIS COLUMBIA U",False,1,"None"
"Hohener P, 1994, AQUAT SCI","Hohener P, 1994, AQUAT SCI, V56, P115",False,1,"None"
"Hollerman Wd, 1980, T AM FISH SOC","Hollerman Wd, 1980, T AM FISH SOC, V109, P446",False,1,"None"
"Hopkins Js, 1994, AQUACULT ENG","Hopkins Js, 1994, AQUACULT ENG, V13, P11",False,1,"None"
"Hopkins Js, 1993, J WORLD AQUACULT SOC","Hopkins Js, 1993, J WORLD AQUACULT SOC, V24, P304",False,1,"None"
"Hylleberg J, 1980, OPHELIA            S","Hylleberg J, 1980, OPHELIA            S, V1, P1",False,1,"None"
"Jana Bb, 1985, ARCH HYDROBIOL","Jana Bb, 1985, ARCH HYDROBIOL, V103, P291",False,1,"None"
"Jana Bb, 1985, AQUACULTURE","Jana Bb, 1985, AQUACULTURE, V44, P57",False,1,"None"
"Jellison R, 1993, LIMNOL OCEANOGR","Jellison R, 1993, LIMNOL OCEANOGR, V38, P1020",False,1,"None"
"Jenkins Mc, 1984, LIMNOL OCEANOGR","Jenkins Mc, 1984, LIMNOL OCEANOGR, V29, P609",False,1,"None"
"Jensen K, 1993, APPL ENVIRON MICROB","Jensen K, 1993, APPL ENVIRON MICROB, V59, P3287",False,1,"None"
"Jensen K, 1994, APPL ENVIRON MICROB","Jensen K, 1994, APPL ENVIRON MICROB, V60, P2094",False,1,"None"
"Jensen Mh, 1990, MAR ECOL PROG SER","Jensen Mh, 1990, MAR ECOL PROG SER, V61, P87",False,1,"None"
"Jorgensen Bb, 1977, MAR BIOL","Jorgensen Bb, 1977, MAR BIOL, V41, P7",False,1,"None"
"Jorgensen S E, 1991, HDB ECOLOGICAL PARAM","Jorgensen S E, 1991, HDB ECOLOGICAL PARAM",False,1,"None"
"Kappers Fi, 1980, DEV HYDROBIOL","Kappers Fi, 1980, DEV HYDROBIOL, V2, P237",False,1,"None"
"Kaspar Hf, 1982, APPL ENVIRON MICROB","Kaspar Hf, 1982, APPL ENVIRON MICROB, V43, P522",False,1,"None"
"Kelly Jr, 1984, MAR ECOL PROG SER","Kelly Jr, 1984, MAR ECOL PROG SER, V17, P157",False,1,"None"
"Klump Jv, 1981, GEOCHIM COSMOCHIM AC","Klump Jv, 1981, GEOCHIM COSMOCHIM AC, V45, P101",False,1,"None"
"Klump Jv, 1989, LIMNOL OCEANOGR","Klump Jv, 1989, LIMNOL OCEANOGR, V34, P559",False,1,"None"
"Knudhansen Cf, 1991, AQUACULTURE","Knudhansen Cf, 1991, AQUACULTURE, V94, P49",False,1,"None"
"Knudhansen Cf, 1991, VERH INT VEREIN LIMN","Knudhansen Cf, 1991, VERH INT VEREIN LIMN, V24, P2541",False,1,"None"
"Koike I, 1978, APPL ENVIRON MICROB","Koike I, 1978, APPL ENVIRON MICROB, V35, P853",False,1,"None"
"Krom Md, 1985, AQUACULTURE","Krom Md, 1985, AQUACULTURE, V51, P65",False,2,"None"
"Krom Md, 1989, AQUACULTURE","Krom Md, 1989, AQUACULTURE, V76, P237",False,3,"None"
"Lai-Fa Z, 1988, PROGRESSIVE FISH-CULTURIST","Lai-Fa Z, 1988, PROGRESSIVE FISH-CULTURIST, V50, P237",False,1,"None"
"Laws Ea, 1981, AQUACULTURE","Laws Ea, 1981, AQUACULTURE, V24, P91",False,1,"None"
"Li Menghe, 1992, JOURNAL OF THE WORLD AQUACULTURE SOCIETY","Li Menghe, 1992, JOURNAL OF THE WORLD AQUACULTURE SOCIETY, V23, P122",False,1,"None"
"Lin Ck, 1993, 9354 CRSP","Lin Ck, 1993, 9354 CRSP",False,1,"None"
"Lindau Cw, 1988, J WATER POLLUT CON F","Lindau Cw, 1988, J WATER POLLUT CON F, V60, P386",False,1,"None"
"Lindau Cw, 1990, PLANT SOIL","Lindau Cw, 1990, PLANT SOIL, V129, P269",False,1,"None"
"Lindau Cw, 1988, PLANT SOIL","Lindau Cw, 1988, PLANT SOIL, V111, P151",False,1,"None"
"Lorenzen K, 1997, AQUAC RES","Lorenzen K, 1997, AQUAC RES, V28, P493",False,1,"None"
"Macfarlane Gt, 1984, J GEN MICROBIOL","Macfarlane Gt, 1984, J GEN MICROBIOL, V130, P2301",False,1,"None"
"Mackin Je, 1989, J MAR RES","Mackin Je, 1989, J MAR RES, V47, P681",False,1,"None"
"Masuda Kiyoshi, 1994, JOURNAL OF THE WORLD AQUACULTURE SOCIETY","Masuda Kiyoshi, 1994, JOURNAL OF THE WORLD AQUACULTURE SOCIETY, V25, P396",False,1,"None"
"Mccarthy Jj, 1981, CAN B FISH AQUAT SCI","Mccarthy Jj, 1981, CAN B FISH AQUAT SCI, P211",False,1,"None"
"Mcgee Mv, 1983, T AM FISH SOC","Mcgee Mv, 1983, T AM FISH SOC, V112, P557",False,1,"None"
"Meade Jw, 1985, PROG FISH CULT","Meade Jw, 1985, PROG FISH CULT, V47, P135",False,2,"None"
"Messer J, 1983, WATER RES","Messer J, 1983, WATER RES, V17, P631",False,1,"None"
"Munsiri P, 1996, AQUACULT INT","Munsiri P, 1996, AQUACULT INT, V4, P157",False,1,"None"
"Murphy Tp, 1981, CAN J FISH AQUAT SCI","Murphy Tp, 1981, CAN J FISH AQUAT SCI, V38, P1035",False,1,"None"
"Neori A, 1991, NUTRITIONAL STRATEGIES & AQUACULTURE WASTE","Neori A, 1991, NUTRITIONAL STRATEGIES & AQUACULTURE WASTE, P223",False,2,"None"
"Nielsen Lp, 1992, FEMS MICROBIOL ECOL","Nielsen Lp, 1992, FEMS MICROBIOL ECOL, V86, P357",False,1,"None"
"Nishio T, 1982, APPL ENVIRON MICROB","Nishio T, 1982, APPL ENVIRON MICROB, V43, P648",False,1,"None"
"Nixo Sw, 1983, NITROGEN MARINE ENV","Nixo Sw, 1983, NITROGEN MARINE ENV, P598",False,1,"None"
"Noriegacurtis P, 1979, AQUACULTURE","Noriegacurtis P, 1979, AQUACULTURE, V17, P335",False,1,"None"
"Oren A, 1979, APPL ENVIRON MICROB","Oren A, 1979, APPL ENVIRON MICROB, V37, P174",False,1,"None"
"Overnell J, 1995, ESTUAR COAST SHELF S","Overnell J, 1995, ESTUAR COAST SHELF S, V41, P1",False,1,"None"
"Paerl Hw, 1984, B MAR SCI","Paerl Hw, 1984, B MAR SCI, V35, P393",False,1,"None"
"Paerl Hw, 1996, MICROB ECOL","Paerl Hw, 1996, MICROB ECOL, V31, P225",False,1,"None"
"Painter Ha, 1970, WATER RES","Painter Ha, 1970, WATER RES, V4, P393",False,1,"None"
