J,"Manoharan, H; Teekaraman, Y; Kshirsagar, PR; Sundaramurthy, S; Manoharan, A",,,,"Manoharan, Hariprasath; Teekaraman, Yuvaraja; Kshirsagar, Pravin R.; Sundaramurthy, Shanmugam; Manoharan, Abirami",,,Examining the effect of aquaculture using sensor-based technology with machine learning algorithm,AQUACULTURE RESEARCH,,,English,Article,,,,,,aquaculture; fish feed; Internet of Things (IoT); velocity; water quality,,"This article envisages a new flanged technique for monitoring the aquaculture. Since a new conservative method is needed for monitoring the feed of fish, this article introduces an Internet of Things (IoT)-based system with integration of improved decision machine learning algorithm (IDMLA). The advancement in system on chip technologies has been emerging as a platform for monitoring the important parameters like quality of water, range, velocity and flow of water pumps. All the parameters if monitored correctly will increase the lifetime of fish. Therefore, a sensor-based technology has been used for monitoring the necessary parameters which is easily connected in low cost. The IDMLA has been tested with the information in database system by using an online monitoring system, and the results are plotted using MATLAB where the efficiency of IDMLA is more efficient when compared with other techniques.","[Manoharan, Hariprasath] Audisankara Coll Engn & Technol, Dept Elect & Commun Engn, Gudur, Andhra Pradesh, India; [Teekaraman, Yuvaraja] South Ural State Univ, Fac Energy & Power Engn, Chelyabinsk, Russia; [Kshirsagar, Pravin R.] AVN Inst Engn & Technol, Dept Elect & Commun Engn, Hyderabad, India; [Sundaramurthy, Shanmugam] Kongunadu Coll Engn & Technol, Dept Comp Sci & Engn, Thottiam, Trichy, India; [Manoharan, Abirami] Govt Coll Engn, Dept Elect & Elect Engn, Srirangam, Trichy, India",South Ural State University; Kongunadu College of Engineering & Technology,"Manoharan, H (corresponding author), Audisankara Coll Engn & Technol, Dept Elect & Commun Engn, Gudur, Andhra Pradesh, India.",hari13prasath@gmail.com,"Kshirsagar, Pravin/AAF-9010-2022; Kshirsagar, Pravin/AAA-7008-2022; KSHIRSAGAR, PRAVIN RAMDAS/AFK-1655-2022; KSHIRSAGAR, DR. PRAVIN RAMDAS/GLN-5470-2022; S, Shanmugam/ABU-3954-2022; T, Yuvaraja/P-5978-2015; Manoharan, Hariprasath/C-5163-2019; T, Y/JFA-1263-2023","KSHIRSAGAR, PRAVIN RAMDAS/0000-0002-7381-6284; KSHIRSAGAR, DR. PRAVIN RAMDAS/0000-0002-7381-6284; S, Shanmugam/0000-0001-6935-4980; T, Yuvaraja/0000-0003-4297-3460; Manoharan, Hariprasath/0000-0001-5034-3034;",,,,,19,18,18,5,15,WILEY,HOBOKEN,"111 RIVER ST, HOBOKEN 07030-5774, NJ USA",1355-557X,1365-2109,,AQUAC RES,Aquac. Res.,NOV,2020,51,11,,,,,4748,4758,,10.1111/are.14821,http://dx.doi.org/10.1111/are.14821,,AUG 2020,11,Fisheries,Science Citation Index Expanded (SCI-EXPANDED),Fisheries,NY2JM,,gold,,,2023-11-26,WOS:000560700500001,View Full Record in Web of Science
C,"Kirankumar, P; Keertana, G; Sivarao, SUA; Vijaykumar, B; Shah, SC",,,IEEE,"Kirankumar, P.; Keertana, G.; Sivarao, S. U. Abhinash; Vijaykumar, B.; Shah, Sh Chetan",,,Smart Monitoring and Water Quality Management in Aquaculture using IOT and ML,"2021 IEEE INTERNATIONAL CONFERENCE ON INTELLIGENT SYSTEMS, SMART AND GREEN TECHNOLOGIES (ICISSGT 2021)",,,English,Proceedings Paper,"IEEE International Conference on Intelligent Systems, Smart and Green Technologies (ICISSGT)","NOV 13-14, 2021","Visakhapatnam, INDIA","IEEE,High Energy Batteries India Ltd,Apollo Microsystems,HBL Power Syst Ltd",,Temperature sensor; Water sensor network (WSN); PH sensor; Machine Learning; Regression algorithms,,"Aquaculture is also known as aquafarming, is the farming of fish, shrimps, and some other water plants and animals in water bodies. Water quality is a critical factor in cultivating aquaculture. The profitability of aquaculture was influenced by various regular water parameters like PH, temperature, dissolved oxygen, carbonates, nitrates, ammonia, etc. The sustainability and profitability of aquaculture were developed by implementing emerging technologies. The proposed framework, implemented using Arduino and Machine Learning. The Arduino Uno gathers information like PH, Temperature, Dissolved Oxygen, turbidity in water using sensors and parameters predicted in advance using machine learning techniques. If the desired range of the parameters was exceeded it will send an alert notification to the farmer in advance so that he will be able to do the required changes.","[Kirankumar, P.; Keertana, G.; Sivarao, S. U. Abhinash; Vijaykumar, B.; Shah, Sh Chetan] Sasi Inst Tech & Engn, Comp Sci & Engn, Tadepalligudem, AP, India",,"Kirankumar, P (corresponding author), Sasi Inst Tech & Engn, Comp Sci & Engn, Tadepalligudem, AP, India.",Kiran@sasi.ac.in; keertana5b6@sasi.ac.in; uma5d6@sasi.ac.in; vijay5b3@sasi.ac.in; chetan5d8@sasi.ac.in,"Pulamolu, Kiran/AGK-7431-2022","Pulamolu, Kiran/0000-0001-9531-8369",,,,,16,2,2,1,10,IEEE,NEW YORK,"345 E 47TH ST, NEW YORK, NY 10017 USA",,,978-1-6654-0416-7,,,,2021,,,,,,,32,36,,10.1109/ICISSGT52025.2021.00018,http://dx.doi.org/10.1109/ICISSGT52025.2021.00018,,,5,"Computer Science, Artificial Intelligence; Green & Sustainable Science & Technology",Conference Proceedings Citation Index - Science (CPCI-S),Computer Science; Science & Technology - Other Topics,BT2XK,,,,,2023-11-26,WOS:000814853600007,View Full Record in Web of Science
C,"Raju, KRSR; Varma, GHK",,"Sai, YP; Garg, D",,"Raju, K. Raghu Sita Rama; Varma, G. Harish Kumar",,,Knowledge Based Real Time Monitoring System for Aquaculture Using IoT,2017 7TH IEEE INTERNATIONAL ADVANCE COMPUTING CONFERENCE (IACC),IEEE International Advance Computing Conference,,English,Proceedings Paper,7th IEEE International Advance Computing Conference (IACC),"JAN 05-07, 2017","VNR Vignana Jyothi Insti Engn & Technol, Hyderabad, INDIA","IEEE,Indian Soc Tech Educ,ATL,Tata Consultancy Serv,Avantel,Synergy,Princeton Review",VNR Vignana Jyothi Insti Engn & Technol,pH; Ammonia; Dissolved Oxygen (DO)); Temperature; Nitrates; Salt; Carbonates; Bi-Carbonates; Raspberry-Pi; Sensors; Internet of Things (IoT); Wi-Fi Module,,"Internet of things is one of the rapidly growing fields for delivering social and economic benefits for emerging and developing economy. The field of IOT is expanding its wings in all the domains like medical, industrial, transportation, education, mining etc. Now-a-days with the advancement in integrated on chip computers like Arduino, Raspberry pi the technology is reaching the ground level with its application in agriculture and aquaculture. Water quality is a critical factor while culturing aquatic organisms. It mainly depends on several parameters like dissolved oxygen, ammonia, pH, temperature, salt, nitrates, carbonates etc. The quality of water is monitored continuously with the help of sensors to ensure growth and survival of aquatic life. The sensed data is transferred to the aqua farmer mobile through cloud. As a result preventive measures can be taken in time to minimize the losses and increase the productivity.","[Raju, K. Raghu Sita Rama] SRKR Engn Coll, Dept CSE, Bhimavaram, India; [Varma, G. Harish Kumar] SRKR Engn Coll, Dept EEE, Bhimavaram, India",SRKR Engineering College; SRKR Engineering College,"Raju, KRSR (corresponding author), SRKR Engn Coll, Dept CSE, Bhimavaram, India.",krsramaraju@gmail.com; gadiraju.harish@gmail.com,"Gadiraju, Harish Kumar Varma/Q-2613-2016","Gadiraju, Harish Kumar Varma/0000-0001-8834-4606",,,,,13,39,42,1,13,IEEE,NEW YORK,"345 E 47TH ST, NEW YORK, NY 10017 USA",2164-8263,,978-1-5090-1560-3,IEEE INT ADV COMPUT,,,2017,,,,,,,318,321,,10.1109/IACC.2017.67,http://dx.doi.org/10.1109/IACC.2017.67,,,4,"Computer Science, Theory & Methods",Conference Proceedings Citation Index - Science (CPCI-S),Computer Science,BJ6PC,,,,,2023-11-26,WOS:000426901900056,View Full Record in Web of Science
J,"Blancaflor, EB; Baccay, M",,,,"Blancaflor, Eric B.; Baccay, Melito",,,Assessment of an automated IoT-biofloc water quality management system in the Litopenaeus vannamei's mortality and growth rate,AUTOMATIKA,,,English,Article,,,,,,Water management; biofloc; internet of things; Litopenaeus vannamei; growth rate; survival rate,,"Climate change greatly influenced aquaculture in the Philippines and the deteriorating water quality; in effect, fish production reduced drastically. Thus, fish farmers and aquaculture researchers have been searching for innovative technologies to address these issues. One technology is the biofloc systems. This technology uses a zero-water exchange and accumulates microorganisms that serves as a food source. In the biofloc, water quality management is highly recommended. This study aimed to assess the technical and operational effect on the shrimp growth and survival of the developed automated water quality management internet of things (IoT) system in a biofloc system. The hardware prototype comes with a mobile application which has features namely: account management, fish/shrimp profile, water quality management, auto feeding and manual controls. This study conducts experimental research which assessed the impact of an indoor pond biofloc with the developed prototype on the Litopenaeus vannamei's growth and survival rates. Results were favorable to the biofloc system with the developed prototype, having a 10% higher survival rate and 3.2% higher growth rate, compared to the traditional recirculating aquaculture systems. Adapting the biofloc and the IoT prototype, a fish farmer may earn P78,300 pesos for each white leg shrimp (Litopenaeus vannamei) harvesting period.","[Blancaflor, Eric B.] Mapua Univ, Sch Informat Technol, Manila, Philippines; [Blancaflor, Eric B.; Baccay, Melito] Technol Univ Philippines, Coll Ind Educ, Manila, Philippines",Mapua University; Technological University of the Philippines,"Blancaflor, EB (corresponding author), Mapua Univ, Sch Informat Technol, Manila, Philippines.;Blancaflor, EB (corresponding author), Technol Univ Philippines, Coll Ind Educ, Manila, Philippines.",melbaccay@yahoo.com,"Baccay, Melito/AAE-5229-2022; Blanca, Eric/ABJ-1750-2022","Blancaflor, Eric/0000-0002-7189-3040",,,,,31,1,1,3,15,TAYLOR & FRANCIS LTD,ABINGDON,"2-4 PARK SQUARE, MILTON PARK, ABINGDON OR14 4RN, OXON, ENGLAND",0005-1144,1848-3380,,AUTOMATIKA-UK,Automatika,APR 3,2022,63,2,,,,,259,274,,10.1080/00051144.2022.2031540,http://dx.doi.org/10.1080/00051144.2022.2031540,,,16,"Automation & Control Systems; Engineering, Electrical & Electronic",Science Citation Index Expanded (SCI-EXPANDED),Automation & Control Systems; Engineering,YO7DY,,"gold, Green Published",,,2023-11-26,WOS:000748098500001,View Full Record in Web of Science
C,"Suciu, G; Istrate, CI; Ditu, MC",,,IEEE,"Suciu, George; Istrate, Cristiana-Ioana; Ditu, Maria-Cristina",,,Secure smart agriculture monitoring technique through isolation,2019 GLOBAL IOT SUMMIT (GIOTS),,,English,Proceedings Paper,3rd Global IoT Summit (GIoTS),"JUN 17-21, 2019","Aarhus, DENMARK","IEEE,IEEE Commun Soc,IEEE Commun Soc, Internet Things,IEEE, Internet Things",,smart agriculture; isolation; security; telemetry; IoT,INTERNET; IOT,"In recent years, agriculture has become increasingly data-driven and data-enabled due to the use of different technologies such as greenhouse and aquaculture technologies. With the development of agriculture, new technology is required, and the focus is facing towards the smartest technological investment. The increasing demand for the quality and the quantity in the food sector raised the need to intensify and industrialize the agriculture sector. The current work provides empirical measurement results from an Internet of Things (IoT) platform based on remote telemetry applications for agriculture. This paper aims to demonstrate how the processing of Big Data and the concept of decentralized cloud operation can answer the demands of IoT applications in agriculture and how smart farming will help farmers operate more efficiently and more secured. The architecture is based on ADCON Remote Telemetry Units (RTUs), Software as a Service (SaaS), a Platform as a Service (PaaS) represented by Grafana and influxDB database.","[Suciu, George; Istrate, Cristiana-Ioana; Ditu, Maria-Cristina] Beia Consult Int, R&D Dept, Bucharest, Romania",,"Suciu, G (corresponding author), Beia Consult Int, R&D Dept, Bucharest, Romania.",george@beia.ro; cristiana.istrate@beia.ro; maria.ditu@beia.ro,,,"UEFISCDI Romania; MCI through project ODSI; MCI through project CitiSiM; SmartAgro project (NETIO project) [8592/08.05.2018, P_40_270, 105976]; European Union's Horizon 2020 research and innovation program [777996, 787002]; PARFAIT","UEFISCDI Romania(Consiliul National al Cercetarii Stiintifice (CNCS)Unitatea Executiva pentru Finantarea Invatamantului Superior, a Cercetarii, Dezvoltarii si Inovarii (UEFISCDI)); MCI through project ODSI; MCI through project CitiSiM; SmartAgro project (NETIO project); European Union's Horizon 2020 research and innovation program(Horizon 2020); PARFAIT","This work has been supported in part by UEFISCDI Romania and MCI through projects ODSI, CitiSiM, SmartAgro project (subsidiary contract no. 8592/08.05.2018, from the NETIO project ID: P_40_270, MySmis Code: 105976), PARFAIT, funded in part by European Union's Horizon 2020 research and innovation program under grant agreement No. 777996 (SealedGRID project) and No. 787002 (SAFECARE project). The authors would like to thank Ioana Marcu for constructive criticism of the manuscript.",,11,9,9,1,5,IEEE,NEW YORK,"345 E 47TH ST, NEW YORK, NY 10017 USA",,,978-1-7281-2171-0,,,,2019,,,,,,,,,,10.1109/giots.2019.8766433,http://dx.doi.org/10.1109/giots.2019.8766433,,,5,"Computer Science, Interdisciplinary Applications; Computer Science, Theory & Methods",Conference Proceedings Citation Index - Science (CPCI-S),Computer Science,BO0MZ,,,,,2023-11-26,WOS:000492300300070,View Full Record in Web of Science
J,"Yanes, AR; Martinez, P; Ahmad, R",,,,"Yanes, A. Reyes; Martinez, P.; Ahmad, R.",,,"Towards automated aquaponics: A review on monitoring, IoT, and smart systems",JOURNAL OF CLEANER PRODUCTION,,,English,Review,,,,,,Aquaponics; Farming 4.0; IoT; Precision farming; Monitoring,WATER; CHALLENGES; AMMONIA; HYDROPONICS; NITROGEN; QUALITY; YIELD,"Aquaponics is a farming method that promises to be a good alternative against the food and environmental problem the world is facing. It is a combination between aquaculture (farming of fish) and hydroponics (growing plants without soil), being a technique to grow plants with the aquaculture effluent. This technique claims to have high water use efficiency, does not use pesticides and reduce the use of fertilizers, which make this technology green and sustainable. Since the interest in aquaponics is increasing, the major challenge is to do it feasible and reliable at commercial scale. The concept of precision farming usually applied in the traditional farming sense is now being introduced, leading to the need to adopt sensing, smart and IoT systems for monitoring and control of its automated processes. Lately, valuable contributions have been made towards the introduction of fully and semi-automated systems in small-scale aquaponics systems by automation and manufacturing experts. This paper aims to support research towards a viable commercial aquaponics solution by identifying, listing, and providing an in-depth explanation of each of the parameters sensed in aquaponics, and the smart systems and IoT technologies in the reviewed literature. Further, the proposed review highlights potential gaps in the research literature and future contributions to be made in regards of automated aquaponics solutions. (C) 2020 Elsevier Ltd. All rights reserved.","[Yanes, A. Reyes; Ahmad, R.] Univ Alberta, Dept Mech Engn, Lab Intelligent Mfg Design & Automat LIMDA, Edmonton, AB T6G 2G8, Canada; [Martinez, P.] Univ Alberta, Dept Civil & Environm Engn, Edmonton, AB T6G 2W2, Canada",University of Alberta; University of Alberta,"Ahmad, R (corresponding author), Univ Alberta, Dept Mech Engn, Lab Intelligent Mfg Design & Automat LIMDA, Edmonton, AB T6G 2G8, Canada.",rafiq.ahmad@ualberta.ca,"Martinez, Pablo/W-8248-2019","Martinez, Pablo/0000-0003-3397-9617; Ahmad, Rafiq/0000-0001-9353-3380","Council on Science and Technology (CONACYT) [2018-000039-01EXTF-00050]; NSERC [ALLRP 545537-19, RGPIN-2017-04516]; Transportes Pitic Scholarship",Council on Science and Technology (CONACYT); NSERC(Natural Sciences and Engineering Research Council of Canada (NSERC)); Transportes Pitic Scholarship,The authors acknowledge the support of this work by the Council on Science and Technology (CONACYT) through funding 2018-000039-01EXTF-00050 and Transportes Pitic Scholarship. The authors would like to acknowledge NSERC (Grant No. ALLRP 545537-19 and RGPIN-2017-04516) for funding this project.,,71,56,57,9,127,ELSEVIER SCI LTD,OXFORD,"THE BOULEVARD, LANGFORD LANE, KIDLINGTON, OXFORD OX5 1GB, OXON, ENGLAND",0959-6526,1879-1786,,J CLEAN PROD,J. Clean Prod.,AUG 1,2020,263,,,,,,,,121571,10.1016/j.jclepro.2020.121571,http://dx.doi.org/10.1016/j.jclepro.2020.121571,,,15,"Green & Sustainable Science & Technology; Engineering, Environmental; Environmental Sciences",Science Citation Index Expanded (SCI-EXPANDED),Science & Technology - Other Topics; Engineering; Environmental Sciences & Ecology,LT6ET,,,,,2023-11-26,WOS:000537162700004,View Full Record in Web of Science
J,"Sung, WT; Isa, IGT; Hsiao, SJ",,,,"Sung, Wen-Tsai; Isa, Indra Griha Tofik; Hsiao, Sung-Jung",,,Designing Aquaculture Monitoring System Based on Data Fusion through Deep Reinforcement Learning (DRL),ELECTRONICS,,,English,Article,,,,,,aquaculture monitoring system; data fusion; deep reinforcement learning; deep learning; Internet of Things (IoT),IOT,"The aquaculture production sector is one of the suppliers of global food consumption needs. Countries that have a large amount of water contribute to the needs of aquaculture production, especially the freshwater fisheries sector. Indonesia is a country that has a large number of large bodies of water and is the top-five producer of aquaculture production. Technology and engineering continue to be developed to improve the quality and quantity of aquaculture production. One aspect that can be observed is how the condition of fish pond water is healthy and supports fish growth. Various studies have been conducted related to the aquaculture monitoring system, but the problem is how effective it is in terms of accuracy of the resulting output, implementation, and costs. In this research, data fusion (DF) and deep reinforcement learning (DRL) were implemented in an aquaculture monitoring system with temperature, turbidity, and pH parameters to produce valid and accurate output. The stage begins with testing sensor accuracy as part of sensor quality validation, then integrating sensors with wireless sensor networks (WSNs) so they can be accessed in real time. The implemented DF is divided into three layers: first, the signal layer consists of WSNs and their components. Second, the feature layer consists of DRL combined with deep learning (DL). Third, the decision layer determines the output of the condition of the fish pond in normal or not normal conditions. The analysis and testing of this system look at several factors, i.e., (1) the accuracy of the performance of the sensors used; (2) the performance of the models implemented; (3) the comparison of DF-DRL-based systems with rule-based algorithm systems; and (4) the cost effectiveness compared to labor costs. Of these four factors, the DF-DRL-based aquaculture monitoring system has a higher percentage value and is a low-cost alternative for an accurate aquaculture monitoring system.","[Sung, Wen-Tsai; Isa, Indra Griha Tofik] Natl Chin Yi Univ Technol, Dept Elect Engn, Taichung 411030, Taiwan; [Hsiao, Sung-Jung] Takming Univ Sci & Technol, Dept Informat Technol, Taipei 11451, Taiwan",National Chin-Yi University of Technology; Takming University Science & Technology,"Hsiao, SJ (corresponding author), Takming Univ Sci & Technol, Dept Informat Technol, Taipei 11451, Taiwan.",sungjung@gs.takming.edu.tw,,"Isa, Indra Griha Tofik/0000-0002-7437-6751; Sung, Wen-Tsai/0000-0001-9045-9090; Hsiao, Sung-Jung/0000-0002-0723-1632",Department of Electronic Engineering at the National Chin-Yi University of Technology; National Chin-Yi University of Technology,Department of Electronic Engineering at the National Chin-Yi University of Technology; National Chin-Yi University of Technology,This research was supported by the Department of Electronic Engineering at the National Chin-Yi University of Technology. The authors would like to thank the National Chin-Yi University of Technology for supporting this research.,,43,0,0,5,5,MDPI,BASEL,"ST ALBAN-ANLAGE 66, CH-4052 BASEL, SWITZERLAND",,2079-9292,,ELECTRONICS-SWITZ,Electronics,APR 27,2023,12,9,,,,,,,2032,10.3390/electronics12092032,http://dx.doi.org/10.3390/electronics12092032,,,26,"Computer Science, Information Systems; Engineering, Electrical & Electronic; Physics, Applied",Science Citation Index Expanded (SCI-EXPANDED),Computer Science; Engineering; Physics,G1MH4,,gold,,,2023-11-26,WOS:000986876800001,View Full Record in Web of Science
J,"Den Ouden, CJ; Wills, PS; Lopes, L; Sanderson, J; Ouyang, B",,,,"Den Ouden, Casey J.; Wills, Paul S.; Lopes, Lucas; Sanderson, Joshua; Ouyang, Bing",,,Evolution of the Hybrid Aerial Underwater Robotic System (HAUCS) for Aquaculture: Sensor Payload and Extension Development,VEHICLES,,,English,Article,,,,,,field robotics; hybrid sensing platform; aquaculture; HAUCS; Internet of Things; origami; robotic extension; mobile agent; LoRa,TRIANGULATED CYLINDERS,"While robotics have been widely used in many agricultural practices such as harvesting, seeding, cattle monitoring, etc., aquaculture farming is an important, fast-growing sector of agriculture that has not seen significant adoption of advanced technologies such as robotics and the Internet of Things (IoT). In particular, dissolved oxygen (DO) monitoring, a practice in pond aquaculture essential to the health of the fish crops, remains labor-intensive and time-consuming. The Hybrid Aerial Underwater robotiCs System (HAUCS) is an IoT framework that aims to bring transformative changes to pond aquaculture. This paper focuses on the latest development in the HAUCS mobile sensing platform and field deployment. To address some shortcomings with the current implementation, the development of a novel rigid Kirigami-based robotic extension subsystem that can expand the functionality of the HAUCS platform is also being discussed.","[Den Ouden, Casey J.; Wills, Paul S.; Lopes, Lucas; Ouyang, Bing] Florida Atlantic Univ, Harbor Branch Ocean Inst, Syst & Imaging Lab SAIL, 5600 US 1 North, Ft Pierce, FL 34946 USA; [Sanderson, Joshua] Florida Atlantic Univ, Harriet L Wilkes Honors Coll John D MacArthur, 5353 Parkside Dr, Jupiter, FL 33458 USA",State University System of Florida; Florida Atlantic University; State University System of Florida; Florida Atlantic University,"Den Ouden, CJ (corresponding author), Florida Atlantic Univ, Harbor Branch Ocean Inst, Syst & Imaging Lab SAIL, 5600 US 1 North, Ft Pierce, FL 34946 USA.",cdenouden@fau.edu; pwills2@fau.edu; lucaslopez2016@fau.edu; jsanderson2020@fau.edu; bouyang@fau.edu,,"Wills, Paul/0000-0001-5193-0142; Ouyang, Bing/0000-0003-4663-8088",National Institute of Food and Agriculture/United States Department of Agriculture [2019-67022-29204],National Institute of Food and Agriculture/United States Department of Agriculture(United States Department of Agriculture (USDA)),"This research was funded with support under Contract No. 2019-67022-29204, awarded by the National Institute of Food and Agriculture/United States Department of Agriculture.",,41,2,2,0,3,MDPI,BASEL,"ST ALBAN-ANLAGE 66, CH-4052 BASEL, SWITZERLAND",,2624-8921,,VEHICLES-BASEL,Vehicles,JUN,2022,4,2,,,,,390,408,,10.3390/vehicles4020023,http://dx.doi.org/10.3390/vehicles4020023,,,19,"Engineering, Mechanical; Transportation Science & Technology",Emerging Sources Citation Index (ESCI),Engineering; Transportation,2M1IL,,gold,,,2023-11-26,WOS:000817462200001,View Full Record in Web of Science
