J,"Ruan, JH; Wang, YX; Chan, FTS; Hu, XP; Zhao, MJ; Zhu, FW; Shi, BF; Shi, Y; Lin, F",,,,"Ruan, Junhu; Wang, Yuxuan; Chan, Felix Tung Sun; Hu, Xiangpei; Zhao, Minjuan; Zhu, Fangwei; Shi, Baofeng; Shi, Yan; Lin, Fan",,,"A Life Cycle Framework of Green IoT-Based Agriculture and Its Finance, Operation, and Management Issues",IEEE COMMUNICATIONS MAGAZINE,,,English,Article,,,,,,,,"The increasing population in the world forces humans to improve farm yields using advanced technologies. The Internet of Things (IoT) is one promising technique to achieve precision agriculture, which is expected to greatly increase yields. However, the large-scale application of IoT systems in agriculture is facing challenges such as huge investment in agriculture IoT systems and non-tech-savvy farmers. To identify these challenges, we summarize the applications of IoT techniques in agriculture in four categories: controlled environment planting, open-field planting, livestock breeding, and aquaculture and aquaponics. The focus on implementing agriculture IoT systems is suggested to be expanded from the growth cycle to the agri-products life cycle. Meanwhile, the energy concern should be considered in the implementation of agriculture IoT systems. The construction of green IoT systems in the whole life cycle of agri-products will have great impact on farmers' interest in IoT techniques. With the life cycle framework, emerging finance, operation, and management (FOM) issues in the implementation of green IoT systems in agriculture are observed, such as IoT finance, supply chain and big data financing, network nodes recharging and repairing, and IoT data management. These FOM issues call for innovative farm production modes and new types of agribusiness enterprises.","[Ruan, Junhu; Zhao, Minjuan] Northwest A&F Univ, Coll Econ & Management, Xianyang, Peoples R China; [Wang, Yuxuan] Northwest A&F Univ, Coll Informat Engn, Xianyang, Peoples R China; [Shi, Baofeng] Northwest A&F Univ, Coll Econ, Xianyang, Peoples R China; [Chan, Felix Tung Sun] Hong Kong Potytech Univ, Dept Ind & Syst Engn, Hong Kong, Peoples R China; [Hu, Xiangpei; Zhu, Fangwei] Dalian Univ Technol, Fac Management & Econ, Dalian, Peoples R China; [Shi, Yan] Tokai Univ, Gen Educ Ctr, Tokyo, Japan; [Lin, Fan] Xiamen Univ, Software Sch, Xiamen, Peoples R China",Northwest A&F University - China; Northwest A&F University - China; Northwest A&F University - China; Dalian University of Technology; Tokai University; Xiamen University,"Lin, F (corresponding author), Xiamen Univ, Software Sch, Xiamen, Peoples R China.",rjh@nwsuaf.edu.cn; wyx19980727@126.com; f.chan@polyu.edu.hk; drhxp@dlut.edu.cn; yshi@ktmail.tokai-u.jp; iamafan@xmu.edu.cn,"jam, amir/O-6460-2019; Chan, Felix/O-8875-2016","Chan, Felix/0000-0001-7374-2396","National Natural Science Foundation of China [71703122, 71531002, 71503199]; National Special Fund for Modern Agricultural Industry Technology System on Oats and Buckwheat [CARS-07-F-1]; China Ministry of Education Social Sciences and Humanities Research Youth Fund [16YJC630102]; Natural Science Basic Research Project in Shaanxi Province [2016JQ7005]; Science and Technology Plan Projects of Yangling Demonstration Zone [2016RKX-04]; Fundamental Research Funds for the Central Universities [2018RWSK02]; Hong Kong Polytechnic University Internal Project",National Natural Science Foundation of China(National Natural Science Foundation of China (NSFC)); National Special Fund for Modern Agricultural Industry Technology System on Oats and Buckwheat; China Ministry of Education Social Sciences and Humanities Research Youth Fund; Natural Science Basic Research Project in Shaanxi Province; Science and Technology Plan Projects of Yangling Demonstration Zone; Fundamental Research Funds for the Central Universities(Fundamental Research Funds for the Central Universities); Hong Kong Polytechnic University Internal Project(Hong Kong Polytechnic University),"This work was supported in part by National Natural Science Foundation of China under Grants 71703122, 71531002 and 71503199, the National Special Fund for Modern Agricultural Industry Technology System on Oats and Buckwheat under Grant CARS-07-F-1, China Ministry of Education Social Sciences and Humanities Research Youth Fund Project under Grant 16YJC630102, the Natural Science Basic Research Project in Shaanxi Province under Grant 2016JQ7005, Science and Technology Plan Projects of Yangling Demonstration Zone under Grant 2016RKX-04, the Fundamental Research Funds for the Central Universities under Grant 2018RWSK02, and The Hong Kong Polytechnic University Internal Project under Grant G-UADM.",,15,87,89,15,232,IEEE-INST ELECTRICAL ELECTRONICS ENGINEERS INC,PISCATAWAY,"445 HOES LANE, PISCATAWAY, NJ 08855-4141 USA",0163-6804,1558-1896,,IEEE COMMUN MAG,IEEE Commun. Mag.,MAR,2019,57,3,,,,,90,96,,10.1109/MCOM.2019.1800332,http://dx.doi.org/10.1109/MCOM.2019.1800332,,,7,"Engineering, Electrical & Electronic; Telecommunications",Science Citation Index Expanded (SCI-EXPANDED),Engineering; Telecommunications,HO8WB,,,,,2023-11-26,WOS:000461239300014,View Full Record in Web of Science
J,"Huan, J; Li, H; Wu, F; Cao, WJ",,,,"Huan, Juan; Li, Hui; Wu, Fan; Cao, Weijian",,,Design of water quality monitoring system for aquaculture ponds based on NB-IoT,AQUACULTURAL ENGINEERING,,,English,Article,,,,,,Aquaculture; The water quality; Monitoring; The internet of things; Narrow band internet of things,,"In order to promote the development of aquaculture informatization and monitor aquaculture ponds more accurately and conveniently, this article has developed a water quality monitoring system for aquaculture ponds based on the narrow band internet of things (NB-IoT) technology. This system realizes remote collection and data storage of mull-sensor processor information (temperature, pH, dissolved oxygen (DO) and other environmental parameters), as well as intelligent control and centralized management of breeding ponds. The system uses STM32L151C8 microcontroller and sensor terminal real-time acquisition, such as temperature, pH value, dissolved oxygen. It realizes data aggregation and transmission over a long distance to the Internet of things (IoT) telecom cloud platform through the technology of NB-IoT. The software called Keil implement the data format design of wireless communication module and data transmission. Java is used to develop background monitoring applications for accessing cloud platform, controlling underlying devices and local data processing. It can not only send hypertext transfer protocol (HTTP) requests to monitor cloud platform data, but also issue commands to the underlying control module to control the startup and shutdown of equipment such as aerator. The system was implemented and tested in ChangZhou, JiangSu Province, China. The experimental results showed that the system can obtain water quality parameters in time. The temperature control accuracy is maintained at +/- 0.12 degrees C, the average relative error is 0.15 %, the dissolved oxygen control accuracy is maintained within +/- 0.55mg/L, the average relative error is 2.48 %, the pH control accuracy is maintained at +/- 0.09, and the average relative error is 0.21 %. The system has stable overall operation, real-time and accurate data transmission, which can meet the actual production needs and provide strong data and technical support for further water quality regulation and aquaculture production management.","[Huan, Juan; Li, Hui; Wu, Fan; Cao, Weijian] Changzhou Univ, Sch Informat Sci & Engn, Changzhou, Jiangsu, Peoples R China",Changzhou University,"Huan, J (corresponding author), Changzhou Univ, 1 Gehu Rd, Changzhou 213164, Jiangsu, Peoples R China.",huanjuan@cczu.edu.cn,,,"Chinese National Natural Science Foundation [61803050, LB2016003]",Chinese National Natural Science Foundation(National Natural Science Foundation of China (NSFC)),This study is funded by the Chinese National Natural Science Foundation (61803050) and the 2016 annual Liyang key research and development project (modern agriculture) (LB2016003).,,26,47,50,7,75,ELSEVIER SCI LTD,OXFORD,"THE BOULEVARD, LANGFORD LANE, KIDLINGTON, OXFORD OX5 1GB, OXON, ENGLAND",0144-8609,1873-5614,,AQUACULT ENG,Aquac. Eng.,AUG,2020,90,,,,,,,,102088,10.1016/j.aquaeng.2020.102088,http://dx.doi.org/10.1016/j.aquaeng.2020.102088,,,10,Agricultural Engineering; Fisheries,Science Citation Index Expanded (SCI-EXPANDED),Agriculture; Fisheries,MO9KE,,,,,2023-11-26,WOS:000551834300006,View Full Record in Web of Science
J,"Suciu, I; Boquet, G; Tuset-Peiró, P; Vilajosana, X",,,,"Suciu, Ioana; Boquet, Guillem; Tuset-Peiro, Pere; Vilajosana, Xavier",,,ADO: An open digital end-to-end tank based aquaculture platform,HARDWAREX,,,English,Article,,,,,,Aquaculture; Fisheries; End-to-end solution; Open source; Digitization platform; Water sensors,,"The ADO project proposes the development of an IoT solution that allows the digitization of the aquaculture sector, developing the basic elements (data acquisition systems, data storage system and visualization platform) in open source format. Hence, ADO makes it easier for small and medium-sized producers to obtain success stories with limited technology background and smaller economic investments. In this article we provide a comprehensive description of the platform building blocks, including the hardware elements, integration procedures and structure, and operation details of the back-end infrastructure. (c) 2022 The Author(s). Published by Elsevier Ltd. This is an open access article under the CC BY-NC-ND license (http://creativecommons.org/licenses/by-nc-nd/4.0/).","[Suciu, Ioana; Boquet, Guillem; Tuset-Peiro, Pere; Vilajosana, Xavier] Univ Oberta Catalunya UOC, Internet Interdisciplinary Inst IN3, Wireless Networks WiNe Res Lab, Barcelona, Spain",UOC Universitat Oberta de Catalunya,"Suciu, I (corresponding author), Univ Oberta Catalunya UOC, Internet Interdisciplinary Inst IN3, Wireless Networks WiNe Res Lab, Barcelona, Spain.",isuciu0@uoc.edu,,,European Maritime and Fisheries Fund (EMFF) [ARP059]; Generalitat de Catalunya [2017 SGR 60]; CYTED AgIoT Research project [520RT0011],European Maritime and Fisheries Fund (EMFF); Generalitat de Catalunya(Generalitat de Catalunya); CYTED AgIoT Research project,"We would like to acknowledge the team of excellent professors at the IEPAAC center for their patience, support, feedback, and expertise. In addition, this project received funding from the ADO project ARP059 supported by the European Maritime and Fisheries Fund (EMFF), the 2017 SGR 60 project granted by the Generalitat de Catalunya and from the CYTED 520RT0011 AgIoT Research project.",,13,1,1,0,3,ELSEVIER,AMSTERDAM,"RADARWEG 29, 1043 NX AMSTERDAM, NETHERLANDS",,2468-0672,,HARDWAREX,HardwareX,APR,2022,11,,,,,,,,e00283,10.1016/j.ohx.2022.e00283,http://dx.doi.org/10.1016/j.ohx.2022.e00283,,MAR 2022,18,"Engineering, Electrical & Electronic; Instruments & Instrumentation; Materials Science, Multidisciplinary",Emerging Sources Citation Index (ESCI),Engineering; Instruments & Instrumentation; Materials Science,1D4VQ,35509942,"gold, Green Published",,,2023-11-26,WOS:000793800200005,View Full Record in Web of Science
C,"Ganokratanaa, T; Pramkeaw, P; Ketcham, M; Chumuang, N; Yimyam, W; Timted, P",,,IEEE,"Ganokratanaa, Thittaporn; Pramkeaw, Patiyuth; Ketcham, Mahasak; Chumuang, Narumol; Yimyam, Worawut; Timted, Parinya",,,IoT System Design for Agro-Tourism,2021 18TH INTERNATIONAL JOINT CONFERENCE ON COMPUTER SCIENCE AND SOFTWARE ENGINEERING (JCSSE-2021),International Joint Conference on Computer Science and Software Engineering,,English,Proceedings Paper,18th International Joint Conference on Computer Science and Software Engineering (JCSSE) - Cybernetics for Human Beings,"JUN 30-JUL 03, 2021",ELECTR NETWORK,"IEEE,Thai Australian Technol Serv Ctr,Thammasat Univ,KMUT NB,Maejo Univ,Prince Songkla Univ,Mahasarakham Univ,Burapha Univ,IEEE Thailand Sect,Thammasat Univ",,intelligent; IoT; Agro-Tourism; prototype; design,,"Agro-Tourism is another form of tourism in which the visitors can gain both enjoyment and knowledge. It covers various types of agriculture, including garden, herb, livestock, aquaculture facility, and pet farm. In modern technology, Agro-Tourism can be improved as a smart farm with the intelligent system design using the Internet of Things (IoT) to help care for crops. It also can be applied with educational institutions for research and agricultural production and development. Our proposed IoTs system helps to increase the convenience of farmers as the experimental results show that we achieve good performance with a 98% accuracy rate.","[Ganokratanaa, Thittaporn] King Mongkuts Univ Technol Thonburi, Appl Comp Sci Program, Bangkok, Thailand; [Pramkeaw, Patiyuth] King Mongkuts Univ Technol Thonburi, Media Technol Program, Bangkok, Thailand; [Ketcham, Mahasak; Timted, Parinya] King Mongkuts Univ Technol North Bangkok, Dept Informat Technol Management, Bangkok, Thailand; [Chumuang, Narumol] Muban Chombueng Rajabhat Univ, Dept Digital Media Technol, Ratchaburi, Thailand; [Yimyam, Worawut] Phetchaburi Rajabhat Univ, Dept Business Informat Management, Phetchaburi, Thailand",King Mongkuts University of Technology Thonburi; King Mongkuts University of Technology Thonburi; King Mongkuts University of Technology North Bangkok; Muban Chombueng Rajabhat University; Phetchaburi Rajabhat University,"Ganokratanaa, T (corresponding author), King Mongkuts Univ Technol Thonburi, Appl Comp Sci Program, Bangkok, Thailand.",thittaporn.gan@kmutt.ac.th; patiyuth.pra@kmutt.ac.th; mahasak.k@itd.kmutnb.ac.th; lecho20@hotmail.com; worawut_yimyam@hotmail.com,"Ketcham, Mao Mahasak/AAV-5700-2021",,"Applied Computer Science Program in the Department of Mathematics, King Mongkut's University of Technology Thonburi","Applied Computer Science Program in the Department of Mathematics, King Mongkut's University of Technology Thonburi","This work is supported by Applied Computer Science Program in the Department of Mathematics, King Mongkut's University of Technology Thonburi.",,16,1,1,1,2,IEEE,NEW YORK,"345 E 47TH ST, NEW YORK, NY 10017 USA",2372-1642,,978-1-6654-3831-5,INT JOINT CONF COMP,,,2021,,,,,,,,,,10.1109/JCSSE53117.2021.9493826,http://dx.doi.org/10.1109/JCSSE53117.2021.9493826,,,6,"Computer Science, Software Engineering; Computer Science, Theory & Methods",Conference Proceedings Citation Index - Science (CPCI-S),Computer Science,BU7LA,,,,,2023-11-26,WOS:000941588600020,View Full Record in Web of Science
C,"Gopi, AP; Naik, KJ",,,IEEE,"Gopi, Arepalli Peda; Naik, K. Jairam",,,A Model for Analysis of IoT based Aquarium Water Quality Data using CNN Model,2021 INTERNATIONAL CONFERENCE ON DECISION AID SCIENCES AND APPLICATION (DASA),,,English,Proceedings Paper,International Conference on Decision Aid Sciences and Application (DASA),"DEC 07-08, 2021",ELECTR NETWORK,,,Water quality; IoT data; Deep learning; Convolution neural network; Dissolved oxygen; Ph Value,NEURAL-NETWORKS; OXYGEN,"Water is essential for the survival and wellness of humans and other ecosystems. The mix of physical and chemical characteristics in a water sample is referred to as water quality. Mainly, water quality is critical in achieving a long-term sustainable aquaculture system. Conducting water quality parameter evaluations is crucial for executing an assessment operation and developing a more effective water resources management and planning strategy in aquaculture. The cumulative impact of water quality parameters may devastate the whole system if not managed properly. Predominantly, early diagnosis of fish illnesses and identifying the underlying causes are critical for farmers to take precautions to prevent an epidemic. Typically, fish illnesses are caused by viruses and bacteria. The presence of these pathogens may alter the pH, D.O., BOD, COD, E.C., PO43-, NO3-N, and NH3-N levels in the water. Previously, water quality was measured using handheld devices and mathematical functions. But these models fail in getting practical water quality analysis. The advances of IoT and deep learning technology adopted to aquaculture give insight analysis on the water for aquaculture. Most of the researchers working with water quality data based on one parameter and analysis with limited samples. This paper used the convolution neural networks (CNN)to classify water quality data to classify the water quality effectively for fish growth and survival with all the water quality parameters and with a good number of samples. The proposed model is compared with the existing models. Performance results show the impact of the proposed model.","[Gopi, Arepalli Peda; Naik, K. Jairam] Natl Inst Technol Raipur, Dept Comp Sci & Engn, Raipur, Chhattisgarh, India",National Institute of Technology (NIT System); National Institute of Technology Raipur,"Gopi, AP (corresponding author), Natl Inst Technol Raipur, Dept Comp Sci & Engn, Raipur, Chhattisgarh, India.",apgopi.phd2020.ese@nitrr.ac.in; jnaik.cse@nitrr.ac.in,,"Arepalli, Peda Gopi/0000-0003-2618-7806",,,,,18,1,1,2,5,IEEE,NEW YORK,"345 E 47TH ST, NEW YORK, NY 10017 USA",,,978-1-6654-1634-4,,,,2021,,,,,,,,,,10.1109/DASA53625.2021.9682251,http://dx.doi.org/10.1109/DASA53625.2021.9682251,,,5,"Computer Science, Artificial Intelligence; Computer Science, Hardware & Architecture; Computer Science, Theory & Methods",Conference Proceedings Citation Index - Science (CPCI-S),Computer Science,BS9DA,,,,,2023-11-26,WOS:000779330100181,View Full Record in Web of Science
C,"Bruzzese, R; Chatzigiannakis, I; Vitaletti, A",,,IEEE,"Bruzzese, Roberto; Chatzigiannakis, Ioannis; Vitaletti, Andrea",,,Monitoring Water Quality with a Spectrophotometer: a Proof of Concept of a Smart Buoy,2022 IEEE INTERNATIONAL CONFERENCE ON PERVASIVE COMPUTING AND COMMUNICATIONS WORKSHOPS AND OTHER AFFILIATED EVENTS (PERCOM WORKSHOPS),,,English,Proceedings Paper,IEEE International Conference on Pervasive Computing and Communications (PerCom),"MAR 21-25, 2022",ELECTR NETWORK,"IEEE,IEEE Comp Soc,IEEE Comp Soc, Tech Comm Comp Commun,IEEE Comp Soc, Tech Comm Parallel Proc",,Blue Growth; Internet of Things; low-cost prototyping; multi-parametric sensor,,"Marine fisheries and aquaculture are fundamental resources in the livelihood and development of many countries. Real-time monitoring of the environmental conditions of marine aquaculture allows targeted interventions to maintain the health of fish species and the marine environment. This work describes the design and first low-cost prototyping of a proof-of-concept of a smart buoy to monitor the quality of water in IoT deployments. The buoy is connected to the Internet by a LoRaWAN link that transmits data acquired by a spectrophotometer that in principle allows us with a single sensor to obtain multiple parameters on water quality. Our solution is aimed at those countries that, despite basing their economies on aquaculture, do not have sophisticated and expensive technologies.","[Bruzzese, Roberto; Chatzigiannakis, Ioannis; Vitaletti, Andrea] Sapienza Univ Rome, Rome, Italy",Sapienza University Rome,"Bruzzese, R (corresponding author), Sapienza Univ Rome, Rome, Italy.",bruzzese.953247@studenti.uniroma1.it; ichatz@diag.uniroma1.it; vitaletti@diag.uniroma1.it,,"bruzzese, roberto/0000-0002-5141-337X",,,,,13,1,1,0,7,IEEE,NEW YORK,"345 E 47TH ST, NEW YORK, NY 10017 USA",,,978-1-6654-1647-4,,,,2022,,,,,,,,,,10.1109/PerComWorkshops53856.2022.9767300,http://dx.doi.org/10.1109/PerComWorkshops53856.2022.9767300,,,6,"Computer Science, Information Systems; Computer Science, Interdisciplinary Applications; Computer Science, Theory & Methods; Engineering, Electrical & Electronic; Telecommunications",Conference Proceedings Citation Index - Science (CPCI-S),Computer Science; Engineering; Telecommunications,BT3OS,,,,,2023-11-26,WOS:000821801200102,View Full Record in Web of Science
C,"Encinas, C; Ruiz, E; Cortez, J; Espinoza, A",,,IEEE,"Encinas, Cesar; Ruiz, Erica; Cortez, Joaquin; Espinoza, Adolfo",,,Design and implementation of a distributed IoT system for the monitoring of water quality in aquaculture,2017 WIRELESS TELECOMMUNICATIONS SYMPOSIUM (WTS),Wireless Telecommunications Symposium,,English,Proceedings Paper,16th Annual Wireless Telecommunications Symposium (WTS) - Global Wireless Communications - Present and Future,"APR 26-28, 2017","Chicago, IL",,,Internet of Things; Wireless Sensor Networks; Aquaculture; Mobile & Cloud Computing; Global Wireless Services; Business & Applications,,"In this work we present the prototype and proof of concept of a distributed monitoring system of the most important variables in aquaculture water quality. This is of great importance because aquaculture is a lagging area of technology compared to other areas such as agriculture. So it is important to solve the problems that are in this area with the support of technology. Among the problems is the slow response time in the care of water quality, the waste of resources and losses. The system proposed in this work monitors the water quality based on wireless sensor networks and on the Internet of Things (IoT). This information is important for the development of this area, since it allows sharing the different conditions in the breeding of aquatic organisms between different breeders and organizations. This information is useful to know the conditions in which there is a better development of a product, worse development, what conditions can mean a possible disaster in the environment and how to optimize resources for the care of the pond.","[Encinas, Cesar; Ruiz, Erica; Cortez, Joaquin; Espinoza, Adolfo] Inst Tecnol Sonora, Dept Elect & Elect Engn, Obregon, Sonora, Mexico",,"Encinas, C (corresponding author), Inst Tecnol Sonora, Dept Elect & Elect Engn, Obregon, Sonora, Mexico.",cesarrer@hotmail.com; erica.ruiz@itson.edu.mx; joaquin.cortez@itson.edu.mx; adolfo.espinoza@itson.edu.mx,,,,,,,14,52,54,1,2,IEEE,NEW YORK,"345 E 47TH ST, NEW YORK, NY 10017 USA",1934-5070,,978-1-5090-3599-1,WIREL TELECOMM SYMP,,,2017,,,,,,,,,,,,,,7,"Computer Science, Hardware & Architecture; Engineering, Electrical & Electronic; Telecommunications",Conference Proceedings Citation Index - Science (CPCI-S),Computer Science; Engineering; Telecommunications,BI0WB,,,,,2023-11-26,WOS:000405194500021,View Full Record in Web of Science
