Publication Type,Authors,Book Authors,Book Editors,Book Group Authors,Author Full Names,Book Author Full Names,Group Authors,Article Title,Source Title,Book Series Title,Book Series Subtitle,Language,Document Type,Conference Title,Conference Date,Conference Location,Conference Sponsor,Conference Host,Author Keywords,Keywords Plus,Abstract,Addresses,Affiliations,Reprint Addresses,Email Addresses,Researcher Ids,ORCIDs,Funding Orgs,Funding Name Preferred,Funding Text,Cited References,Cited Reference Count,"Times Cited, WoS Core","Times Cited, All Databases",180 Day Usage Count,Since 2013 Usage Count,Publisher,Publisher City,Publisher Address,ISSN,eISSN,ISBN,Journal Abbreviation,Journal ISO Abbreviation,Publication Date,Publication Year,Volume,Issue,Part Number,Supplement,Special Issue,Meeting Abstract,Start Page,End Page,Article Number,DOI,DOI Link,Book DOI,Early Access Date,Number of Pages,WoS Categories,Web of Science Index,Research Areas,IDS Number,Pubmed Id,Open Access Designations,Highly Cited Status,Hot Paper Status,Date of Export,UT (Unique WOS ID),Web of Science Record
J,"Yadav, A; Noori, MT; Biswas, A; Min, B",,,,"Yadav, Anamika; Noori, Md Tabish; Biswas, Abhijit; Min, Booki",,,A Concise Review on the Recent Developments in the Internet of Things (IoT)-Based Smart Aquaculture Practices,REVIEWS IN FISHERIES SCIENCE & AQUACULTURE,,,English,Review,,,,,,Artificial intelligence; Internet of things; sensors; smart aquaculture systems,ARTIFICIAL-INTELLIGENCE; WATER-QUALITY; LOW-COST; FISH; DESIGN; SYSTEM; IOT; PERFORMANCE; CHALLENGES; BIOSENSOR,"A smart aquaculture management system (SAMS) based on the Internet of Things (IoT) has recently gained much attention for fulfilling the growing demand for aquaculture products. The SAMS uses cutting-edge sensing technologies with a modern networking system to continuously monitor water quality, animal health, and feeding behavior to improve the production yield. This review aims to comprehensively summarize and discussed the recent advancements in IoT-based technologies, e.g., sensors nodes, software interfacing, artificial intelligence, cloud computing, and storage, to develop reliable and robust SAMS for small- and large-scale aquaculture production modules. A future perspective section is included at the end of this review to recommend the needed research to be done to scale up the related digital technologies for application in aquaculture farms. The knowledge in this thorough review can be useful for the scientific community for needful advancements and modifications of the IoT technologies and for existing and future aquaculture farmers to adopt modern SAMS for improving the benefit-cost ratios.","[Yadav, Anamika] Assam Univ, Dept Agr Engn, Silchar, Assam, India; [Noori, Md Tabish; Min, Booki] Kyung Hee Univ, Dept Environm Sci & Engn, Global Campus, Yongin, South Korea; [Biswas, Abhijit] Assam Univ, Dept Comp Sci & Engn, Silchar, Assam, India",Assam University; Kyung Hee University; Assam University,"Min, B (corresponding author), Kyung Hee Univ, Dept Environm Sci & Engn, Global Campus, Yongin, South Korea.",bkmin@khu.ac.kr,"NOORI, MD TABISH/M-3853-2018","NOORI, MD TABISH/0000-0002-0389-0059","National Research Foundation; Republic of Korea [2021H1D3A2A02090873, 2018R1A2B6001507]",National Research Foundation; Republic of Korea,"This study received funding from the National Research Foundation, the Republic of Korea under grant numbers 2021H1D3A2A02090873 and 2018R1A2B6001507.",,150,4,4,25,58,TAYLOR & FRANCIS INC,PHILADELPHIA,"530 WALNUT STREET, STE 850, PHILADELPHIA, PA 19106 USA",2330-8249,2330-8257,,REV FISH SCI AQUAC,Rev. Fish. Sci. Aquac..,JAN 2,2023,31,1,,,,,103,118,,10.1080/23308249.2022.2090228,http://dx.doi.org/10.1080/23308249.2022.2090228,,JUN 2022,16,Fisheries,Science Citation Index Expanded (SCI-EXPANDED),Fisheries,8F2KH,,,,,2023-11-26,WOS:000814652400001,View Full Record in Web of Science
C,"Abid, A; Dupont, C; Le Gall, F; Third, A; Kane, F",,,IEEE,"Abid, Ahmed; Dupont, Charlotte; Le Gall, Franck; Third, Allan; Kane, Frank",,,Modelling Data For A Sustainable Aquaculture,2019 GLOBAL IOT SUMMIT (GIOTS),,,English,Proceedings Paper,3rd Global IoT Summit (GIoTS),"JUN 17-21, 2019","Aarhus, DENMARK","IEEE,IEEE Commun Soc,IEEE Commun Soc, Internet Things,IEEE, Internet Things",,aquaculture; IoT; Semantics; interoperability,,"Combining aquaculture and Internet of Things (IoT) technologies still poses several challenges. IoT technologies are exploited to enhance productivity in aquaculture sites by maintaining precise operating conditions and to avoid undesirable situations. Currently, human intervention is still needed to make good decisions, dependant on the values of parameters detected by sensors, often captured at one point in time in a day. This is not only a time-consuming task but also an inaccurate one since parameters, such as water quality, evolves continuously and affects the whole aquaculture system. This is mainly caused by the lack of information collection, exchange and process automation between different actors in aquaculture farms. To overcome these problems, technologies such as semantic Web technologies and Artificial Intelligence (AI), are bringing new capabilities to organise data in an inter-operable way to then be processed and used for monitoring and decision-making. In this context, we are proposing in this paper a fully semantic based-reference data model for Integrated Multi-Trophic Aquaculture (IMTA) that involves the collection, processing, and sharing of data both between components and between the platform and external aqua-systems by supporting IoT and data information standards. It is based on analysis of the current data models and covers the core concepts required for aquaculture management and has been validated against several business scenarios.","[Abid, Ahmed; Dupont, Charlotte; Le Gall, Franck] Easy Global Market, Sophia Antipolis, France; [Third, Allan] Open Univ, KMi Knowledge Media, Milton Keynes, Bucks, England; [Kane, Frank] Marine Inst, Galway, Ireland",Open University - UK; Marine Institute Ireland,"Abid, A (corresponding author), Easy Global Market, Sophia Antipolis, France.",ahmed.abid@eglobalmark.com; charlotte.dupont@eglobalmark.com; franck.legall@eglobalmark.com; allan.third@open.ac.uk; frank.kane@marine.ie,"A Samah, Azurah/ABB-2436-2021","LE GALL, Franck/0000-0001-8467-0017; Hashim, Haslina/0000-0003-0048-719X; Kane, Frank/0000-0001-8847-534X; Abid, Ahmed/0000-0002-5321-9247",European Union [774109]; H2020 Societal Challenges Programme [774109] Funding Source: H2020 Societal Challenges Programme,European Union(European Union (EU)); H2020 Societal Challenges Programme(Horizon 2020),"The research leading to these results has been supported by the IMPAQT project, which receives funding from the European Union's Horizon 2020 Research and Innovation Program under grant agreement No. 774109. The content of this article does not reflect the official opinion of the European Union. Responsibility for the information and views expressed in this article lies entirely with the authors.",,10,12,12,1,1,IEEE,NEW YORK,"345 E 47TH ST, NEW YORK, NY 10017 USA",,,978-1-7281-2171-0,,,,2019,,,,,,,,,,10.1109/giots.2019.8766376,http://dx.doi.org/10.1109/giots.2019.8766376,,,6,"Computer Science, Interdisciplinary Applications; Computer Science, Theory & Methods",Conference Proceedings Citation Index - Science (CPCI-S),Computer Science,BO0MZ,,,,,2023-11-26,WOS:000492300300018,View Full Record in Web of Science
J,"Ramanathan, R; Duan, YQ; Valverde, J; Van Ransbeeck, S; Ajmal, T; Valverde, S",,,,"Ramanathan, Ramakrishnan; Duan, Yanqing; Valverde, Joaquim; Van Ransbeeck, Samuel; Ajmal, Tahmina; Valverde, Silma",,,Using IoT Sensor Technologies to Reduce Waste and Improve Sustainability in Artisanal Fish Farming in Southern Brazil,SUSTAINABILITY,,,English,Article,,,,,,aquaculture; Brazil; IoT,NETWORK,"Modern digital technologies have the great potential to improve the sustainability of fish farming in artisanal fisheries. However, in spite of the popularity of these technologies for fish farming in other parts of the world, Brazil still lags behind. To fill this gap, this study has conducted the first field study in implementing the IoT sensor technologies in Southern Brazil and documents the experiences in this paper. More specifically, it discusses developing sustainable artisanal fisheries infrastructure using these technologies with reference to southern Brazil, where the study explores the use of sensor technology in aquaculture and its effectiveness in reducing waste and improving productivity. The overarching goal of the project is to demonstrate how simple data collection using IoT sensors and its analysis can support artisanal freshwater fish farms in Brazil and beyond to increase production, reduce waste, and thereby improve their sustainability. The pilot implementation of these technologies has demonstrated the potential of increasing the productivity of the artisanal fisheries, reducing waste (e.g., loss of farmed fish, optimised feeding to reduce waste of feeds), and improving the sustainability of aquaculture. This paper documents the valuable firsthand experiences of selecting, adapting, and implementing the IoT sensor technologies with close cooperation from local research institutions and artisanal fish farmers. The paper describes the different implementation stages and use interviews with stakeholders as a testimony of the effectiveness of the IoT technology adoption.","[Ramanathan, Ramakrishnan] Univ Essex, Essex Business Sch, Elmer Approach, Southend Campus, Southend On Sea SS1 1LW, Essex, England; [Duan, Yanqing; Van Ransbeeck, Samuel; Ajmal, Tahmina] Univ Bedfordshire, Res Inst Smart Cities, Pk Sq, Luton LU1 3JU, England; [Valverde, Joaquim] Inst Fed Educ Ciencia & Tecnol Catarinense, Campus Camboriu,Rua Joaquim Garcia, BR-88340055 Camboriu, Brazil; [Valverde, Silma] Univ Fed Parana, Dept Educ, Litoral Campus,Rua Jaguaria, 512, BR-83260000 Caioba Matinhos, Brazil",University of Essex; University of Bedfordshire; Universidade Federal do Parana,"Ramanathan, R (corresponding author), Univ Essex, Essex Business Sch, Elmer Approach, Southend Campus, Southend On Sea SS1 1LW, Essex, England.",r.ramanathan@essex.ac.uk,"Ajmal, Tahmina/B-4701-2013","Ajmal, Tahmina/0000-0003-2170-5248",UKRI Newton fund in the UK; University of Bedfordshire; Instituto Federal Catarinense; Interreg North-West Europe; [332387020]; [NWE831],UKRI Newton fund in the UK; University of Bedfordshire; Instituto Federal Catarinense; Interreg North-West Europe; ;,"This work was funded by the UKRI Newton fund (grant no 332387020) in the UK and FAPESC in Brazil. This project was a collaboration between the University of Bedfordshire and the Instituto Federal Catarinense. We would like to thank the farmers, cooperatives, students at the IFC, and EPAGRI for their input in the project. The paper also benefited from the REAMIT project funded by the Interreg North-West Europe (ref NWE831) in terms of the renewed focus on food waste.",,34,0,0,9,10,MDPI,BASEL,"ST ALBAN-ANLAGE 66, CH-4052 BASEL, SWITZERLAND",,2071-1050,,SUSTAINABILITY-BASEL,Sustainability,FEB,2023,15,3,,,,,,,2078,10.3390/su15032078,http://dx.doi.org/10.3390/su15032078,,,14,Green & Sustainable Science & Technology; Environmental Sciences; Environmental Studies,Science Citation Index Expanded (SCI-EXPANDED); Social Science Citation Index (SSCI),Science & Technology - Other Topics; Environmental Sciences & Ecology,8U1NM,,"Green Accepted, Green Published, gold",,,2023-11-26,WOS:000929718300001,View Full Record in Web of Science
J,"Rashid, MM; Nayan, AA; Rahman, MO; Saha, J; Simi, SA; Kibria, MG",,,,"Rashid, Md Mamunur; Nayan, Al-Akhir; Rahman, Md Obaidur; Saha, Joyeta; Simi, Sabrina Afrin; Kibria, Muhammad Golam",,,IoT based Smart Water Quality Prediction for Biofloc Aquaculture,INTERNATIONAL JOURNAL OF ADVANCED COMPUTER SCIENCE AND APPLICATIONS,,,English,Article,,,,,,Smart aquaculture system; biofloc technology; machine learning; life below water,INDEX,"Traditional fish farming faces several challenges, including water pollution, temperature imbalance, feed, space, cost, etc. Biofloc technology in aquaculture transforms the manual into an advanced system that allows the reuse of unused feed by converting them into microbial protein. The objective of the research is to propose an IoT-based solution to aquaculture that increases efficiency and productivity. The article presented a system that collects data using sensors, analyzes them using a machine learning model, generates decisions with the help of Artificial Intelligence (AI), and sends notifications to the user. The proposed system has been implemented and tested to validate and achieve a satisfactory result.","[Rashid, Md Mamunur] Univ Liberal Arts Bangladesh, Dept CSE, Dhaka, Bangladesh; [Nayan, Al-Akhir; Rahman, Md Obaidur] European Univ Bangladesh, Dept CSE, Dhaka, Bangladesh; [Saha, Joyeta] North South Univ, Dept ECE, Dhaka, Bangladesh; [Simi, Sabrina Afrin] Univ Siegen, Dept Human Comp Interact, Siegen, Germany; [Kibria, Muhammad Golam] Univ Liberal Arts Bangladesh, Dept CSE, IoT Lab, Dhaka, Bangladesh",North South University (NSU); Universitat Siegen,"Rashid, MM (corresponding author), Univ Liberal Arts Bangladesh, Dept CSE, Dhaka, Bangladesh.",,"NAYAN, AL-AKHIR/ADY-5643-2022","NAYAN, AL-AKHIR/0000-0001-7846-3249; Rashid, Md. Mamunur/0000-0003-2539-3333",Bangladesh Hi-Tech Park Authority of ICT Division; IoT Lab,Bangladesh Hi-Tech Park Authority of ICT Division; IoT Lab,"The IoT Lab has supported this research work, a state-of-art specialized research facility of its kind situated at ULAB, implemented, and supported by the Bangladesh Hi-Tech Park Authority of ICT Division.",,28,8,8,2,5,SCIENCE & INFORMATION SAI ORGANIZATION LTD,WEST YORKSHIRE,"19 BOLLING RD, BRADFORD, WEST YORKSHIRE, 00000, ENGLAND",2158-107X,2156-5570,,INT J ADV COMPUT SC,Int. J. Adv. Comput. Sci. Appl.,JUN,2021,12,6,,,,,56,62,,,,,,7,"Computer Science, Theory & Methods",Emerging Sources Citation Index (ESCI),Computer Science,UB9TB,,,,,2023-11-26,WOS:000686178900008,View Full Record in Web of Science
J,"Yu, YB; Lee, JH; Choi, JH; Choi, YJ; Jo, AH; Choi, CY; Kang, JC; Kim, JH",,,,"Yu, Young-Bin; Lee, Ju-Hyeong; Choi, Jae-Ho; Choi, Young Jae; Jo, A-Hyun; Choi, Cheol Young; Kang, Ju-Chan; Kim, Jun-Hwan",,,The application and future of biofloc technology (BFT) in aquaculture industry: A review,JOURNAL OF ENVIRONMENTAL MANAGEMENT,,,English,Review,,,,,,Advanced biofloc application; Biofloc technology mechanism; Biofloc technology with RAS; Biofloc technology with IoT; ICT; Smart aquafarm; Sustainable aquaculture,TILAPIA OREOCHROMIS-NILOTICUS; DIFFERENT CARBON-SOURCES; LIMITED WATER EXCHANGE; HEMATOLOGICAL PARAMETERS; PARALICHTHYS-OLIVACEUS; BIO-FLOC; NUTRITIONAL COMPOSITION; OLIVE FLOUNDERS; AFRICAN CATFISH; CN RATIOS,"This review describes the applicability of biofloc technology (BFT) to future aquaculture technologies. BFT is considered an innovative alternative for solving the problems of traditional aquaculture (for example, envi-ronmental pollution, high maintenance costs, and low productivity). Extensive research is being conducted to apply BFT to breed and raise many aquatic animal species. In BFT, maintaining an appropriate C:N ratio by adding a carbon source promotes the growth of microorganisms in water and maintains the aquaculture water quality through microbial processes such as nitrification. For the efficient use and sustainability of BFT, various factors such as total suspended solids, water turbidity, temperature, dissolved oxygen, pH, and salinity, stocking density, and light should be considered. The application of the transformative fourth industrial revolution technologies, Information and Communications Technology (ICT) and Internet of Things (IoT), to aquaculture can reduce the risk factors and manual interventions in aquaculture through automation and intelligence. The combination of ICT/IoT with BFT can enable real-time monitoring of the necessary elements of BFT farming using various sensors, which is expected to increase productivity by ensuring the growth and health of the or-ganisms being reared.","[Yu, Young-Bin; Lee, Ju-Hyeong; Choi, Jae-Ho; Kang, Ju-Chan] Pukyong Natl Univ, Dept Aquat Life Med, Busan, South Korea; [Choi, Young Jae] Natl Inst Fisheries Sci, Inland Fisheries Res Inst, Geumsan, South Korea; [Jo, A-Hyun; Kim, Jun-Hwan] Sun Moon Univ, Dept Aquat Life & Med Sci, Asan, South Korea; [Choi, Cheol Young] Korea Maritime & Ocean Univ, Div Marine Biosci, Busan 49112, South Korea",Pukyong National University; National Institute of Fisheries Science; Sun Moon University; Korea Maritime & Ocean University,"Kang, JC (corresponding author), Pukyong Natl Univ, Dept Aquat Life Med, Busan, South Korea.;Kim, JH (corresponding author), Sun Moon Univ, Dept Aquat Life & Med Sci, Asan, South Korea.;Choi, CY (corresponding author), Korea Maritime & Ocean Univ, Div Marine Biosci, Busan 49112, South Korea.",choic@kmou.ac.kr; jckang@pknu.ac.kr; junhwan1982@sunmoon.ac.kr,,,"National Institute of Fisheries Science, Ministry of Oceans and Fisheries, Korea [R2023017]","National Institute of Fisheries Science, Ministry of Oceans and Fisheries, Korea","This research was supported by the National Institute of Fisheries Science, Ministry of Oceans and Fisheries, Korea (R2023017) .",,106,2,2,33,33,ACADEMIC PRESS LTD- ELSEVIER SCIENCE LTD,LONDON,"24-28 OVAL RD, LONDON NW1 7DX, ENGLAND",0301-4797,1095-8630,,J ENVIRON MANAGE,J. Environ. Manage.,SEP 15,2023,342,,,,,,,,118237,10.1016/j.jenvman.2023.118237,http://dx.doi.org/10.1016/j.jenvman.2023.118237,,MAY 2023,14,Environmental Sciences,Science Citation Index Expanded (SCI-EXPANDED),Environmental Sciences & Ecology,J8UJ9,37267764,,,,2023-11-26,WOS:001012318400001,View Full Record in Web of Science
C,"Acar, U; Kane, F; Vlacheas, P; Foteinos, V; Demestichas, P; Yücetürk, G; Drigkopoulou, I; Vargün, A",,,IEEE,"Acar, Ugur; Kane, Frank; Vlacheas, Panagiotis; Foteinos, Vassilis; Demestichas, Panagiotis; Yuceturk, Guven; Drigkopoulou, Ioanna; Vargun, Aycan",,,Designing An IoT Cloud Solution for Aquaculture,2019 GLOBAL IOT SUMMIT (GIOTS),,,English,Proceedings Paper,3rd Global IoT Summit (GIoTS),"JUN 17-21, 2019","Aarhus, DENMARK","IEEE,IEEE Commun Soc,IEEE Commun Soc, Internet Things,IEEE, Internet Things",,internet of things; smart farm; cloud; gateway,,"Farming has been changing through multiple technological transformations in recent years, in parallel with the earth's growing population and demands. The Internet of Things (IoT) provides very remarkable technological innovations on farming by bringing a new paradigm. Aquaculture in fresh or salt water is a rapidly growing food sector to produce aquatic plants or animals. IoT can also produce encouraging solutions for the problems in the implementation and maintenance of aquaculture systems. In this paper, we present a use case with an IoT cloud solution after summarizing the potential technologies and tools to use in accordance with the use case problem as identified in the Horizon2020 Project, the intelligent management system for integrated multi-trophic aquaculture (IMPAQT) in which we have been participating in.","[Acar, Ugur; Yuceturk, Guven; Vargun, Aycan] Netas Telekomunikasyon Anonim Sirketi, Istanbul, Turkey; [Kane, Frank] Marine Inst, Galway, Ireland; [Vlacheas, Panagiotis; Foteinos, Vassilis; Demestichas, Panagiotis] WINGS ICT Solut, Athens, Greece; [Drigkopoulou, Ioanna] INTRASOFT Int, Luxembourg, Luxembourg",Marine Institute Ireland,"Acar, U (corresponding author), Netas Telekomunikasyon Anonim Sirketi, Istanbul, Turkey.",uacar@netas.com.tr; Frank.Kane@Marine.ie; panvlah@wings-ict-solutions.eu; vfotein@wings-ict-solutions.eu; pdemest@wings-ict-solutions.eu; guveny@netas.com.tr; Ioanna.Drigkopoulou@intrasoft-intl.com; avargun@netas.com.tr,,"Kane, Frank/0000-0001-8847-534X",European Union [774109]; H2020 Societal Challenges Programme [774109] Funding Source: H2020 Societal Challenges Programme,European Union(European Union (EU)); H2020 Societal Challenges Programme(Horizon 2020),This work has been realized in context of the IMPAQT project. This project has received funding from the European Union's Horizon 2020 research and innovation programme under grant agreement No 774109.,,16,6,6,1,4,IEEE,NEW YORK,"345 E 47TH ST, NEW YORK, NY 10017 USA",,,978-1-7281-2171-0,,,,2019,,,,,,,,,,,,,,6,"Computer Science, Interdisciplinary Applications; Computer Science, Theory & Methods",Conference Proceedings Citation Index - Science (CPCI-S),Computer Science,BO0MZ,,,,,2023-11-26,WOS:000492300300065,View Full Record in Web of Science
J,"Prapti, DR; Shariff, ARM; Man, HC; Ramli, NM; Perumal, T; Shariff, M",,,,"Prapti, Dipika Roy; Mohamed Shariff, Abdul Rashid; Che Man, Hasfalina; Ramli, Norulhuda Mohamed; Perumal, Thinagaran; Shariff, Mohamed",,,Internet of Things (IoT)-based aquaculture: An overview of IoT application on water quality monitoring,REVIEWS IN AQUACULTURE,,,English,Review,,,,,,Aquaculture 4; 0; aquaculture water quality; aqua-tech; Industrial Revolution 4; 0; smart aquaculture; water quality monitoring,WIRELESS SENSOR; SYSTEM,"Aquaculture based on the Internet of Things (IoT) is a growing field of interest in the fishing industry. The IoT technology is advancing the agriculture 4.0 era, and yet, Aquaculture 4.0 is a lagging field in many countries. This article presents results obtained so far from ongoing research of published work highlighting water quality monitoring in fishponds. This analysis was performed extensively from May to December 2020 by meticulously selecting a total of 30 internationally published research papers. This review is divided into five categories: (1) recent research (2011-2020), (2) aquaculture environments, (3) research approaches, (4) most common water quality parameters and (5) forms of the solution provided. Most of the published research concentrated on inland aquaculture (81%), while research articles on marine aquaculture species accounted for 19% of papers reviewed so far. The framework and architecture approach (48%) was the most widely practised research approach in IoT-based aquaculture for water quality monitoring. There is a need for long-term experimental research to identify the challenges and suggest appropriate solutions. With regards to water quality parameters, temperature (20%), dissolved oxygen (18%) and pH (17%) are the topmost prioritised water quality parameters considered in the IoT-based aquaculture. Finally, real-time monitoring (50%) is offered generally as a form of a solution while autonomous (3%) monitoring can be a unique solution. The findings from this study are expected to support the aquaculture industry, researchers, practitioners and decision-makers in the long run.","[Prapti, Dipika Roy; Mohamed Shariff, Abdul Rashid; Che Man, Hasfalina; Ramli, Norulhuda Mohamed] Univ Putra Malaysia, Fac Engn, Dept Biol & Agr Engn, Serdang 43400, Selangor, Malaysia; [Mohamed Shariff, Abdul Rashid] Univ Putra Malaysia, Fac Engn, SMART Farming Technol Res Ctr SFTRC, Serdang, Selangor, Malaysia; [Mohamed Shariff, Abdul Rashid] Univ Putra Malaysia, Inst Plantat Studies IKP, Serdang, Selangor, Malaysia; [Perumal, Thinagaran] Univ Putra Malaysia, Fac Comp Sci & Informat Technol, Dept Comp Sci, Serdang, Selangor, Malaysia; [Shariff, Mohamed] Univ Putra Malaysia, Inst Biosci, Serdang, Selangor, Malaysia",Universiti Putra Malaysia; Universiti Putra Malaysia; Universiti Putra Malaysia; Universiti Putra Malaysia; Universiti Putra Malaysia,"Shariff, ARM (corresponding author), Univ Putra Malaysia, Fac Engn, Dept Biol & Agr Engn, Serdang 43400, Selangor, Malaysia.",dipika.prapti@gmail.com; rashidpls@upm.edu.my,"Shariff, Mohamed/E-8780-2012","Shariff, Mohamed/0000-0003-2828-4773; shariff, rashid/0000-0003-4626-4995; Che Man, Hasfalina/0000-0001-8514-2152","ICT Division, Bangladesh; Universiti Putra Malaysia, Malaysia","ICT Division, Bangladesh; Universiti Putra Malaysia, Malaysia","ICT Division, Bangladesh; Universiti Putra Malaysia, Malaysia",,70,14,14,14,87,WILEY,HOBOKEN,"111 RIVER ST, HOBOKEN 07030-5774, NJ USA",1753-5123,1753-5131,,REV AQUACULT,Rev. Aquac.,MAR,2022,14,2,,,,,979,992,,10.1111/raq.12637,http://dx.doi.org/10.1111/raq.12637,,NOV 2021,14,Fisheries,Science Citation Index Expanded (SCI-EXPANDED),Fisheries,0A3LC,,,,,2023-11-26,WOS:000720368600001,View Full Record in Web of Science
