J,"Haque, BMH; Moni, DJ; Gracia, D",,,,"Haque, B. Mary Havilah; Moni, D. Jackuline; Gracia, D.",,,A Literature Survey on the Applications of Internet of Things,PRZEGLAD ELEKTROTECHNICZNY,,,English,Article,,,,,,Internet of Things; Raspberry Pi; Arduino; Monitoring,MONITORING-SYSTEM; IOT APPLICATIONS; TECHNOLOGIES,"Internet of Things can ensure easy and comfortable life of the human. This present era is mostly digitized and appliances can be operated remotely by human, calling these as smart devices, smart home, smart city etc. This paper is the literature review covering the IoT applications in various fields, sectors such as smart cities and homes, health center, railway system, air pollution in environment, power/energy sector, agriculture, water monitoring for aquaculture, Space-IoT and specifies the advancements in those areas.","[Haque, B. Mary Havilah; Moni, D. Jackuline] Karunya Inst Technol & Sci, Coimbatore, Tamil Nadu, India; [Gracia, D.] Sri Ramakrishna Engn Coll, ECE Dept, Coimbatore, Tamil Nadu, India; [Haque, B. Mary Havilah] Karunya Univ, Elect & Commun Engn Dept, Coimbatore, Tamil Nadu, India; [Moni, D. Jackuline] Karunya Univ, ECE Dept, Coimbatore, Tamil Nadu, India",Karunya Institute of Technology & Sciences; Sri Ramakrishna Engineering College; Karunya Institute of Technology & Sciences; Karunya Institute of Technology & Sciences,"Haque, BMH (corresponding author), Karunya Inst Technol & Sci, Coimbatore, Tamil Nadu, India.;Haque, BMH (corresponding author), Karunya Univ, Elect & Commun Engn Dept, Coimbatore, Tamil Nadu, India.",havilah737@gmail.com; moni@karunya.edu.in; graciadevaraj@gmail.com,"Devaraj, Gracia/GQA-8891-2022",,,,,,98,0,0,3,16,WYDAWNICTWO SIGMA-NOT SP ZOO,WARSAW,"UL RATUSZOWA 11, PO BOX 1004, 00-950 WARSAW, POLAND",0033-2097,2449-9544,,PRZ ELEKTROTECHNICZN,Prz. Elektrotechniczny,,2021,97,12,,,,,51,56,,10.15199/48.2021.12.08,http://dx.doi.org/10.15199/48.2021.12.08,,,6,"Engineering, Electrical & Electronic",Emerging Sources Citation Index (ESCI),Engineering,XJ3ZV,,,,,2023-11-26,WOS:000726731300008,View Full Record in Web of Science
J,"Bohara, K; Joshi, P; Acharya, KP; Ramena, G",,,,"Bohara, Kailash; Joshi, Pabitra; Acharya, Krishna Prasad; Ramena, Grace",,,Emerging technologies revolutionising disease diagnosis and monitoring in aquatic animal health,REVIEWS IN AQUACULTURE,,,English,Review; Early Access,,,,,,aquatic disease; early diagnosis; internet of things (IoT); smart aquaculture; UAVs,MEDIATED ISOTHERMAL AMPLIFICATION; DESORPTION IONIZATION-TIME; SEQUENCING TECHNOLOGIES; NILE TILAPIA; REAL-TIME; FISH; IDENTIFICATION; SYSTEM; VIRUS; DIFFERENTIATION,"In recent years, aquaculture has seen tremendous growth worldwide due to technological advancements, leading to research and development of various innovations. Aquaculture farmers prioritise early diagnosis for timely treatment to achieve better productive and economic performance. Aquatic animal health experts still employ traditional diagnostic methods using visual diagnosis, cell culture, media culture, histopathology and serology. However, the developments of technologies in aquamedicine, such as sequencing, biosensors and CRISPR, have enabled rapid disease detection within minutes. Furthermore, integrating sensors, drones, artificial intelligence and the internet in aquaculture farm monitoring has helped farmers take decisive actions to improve production. Advancements in diagnostic techniques have significantly enhanced the efficient detection of bacterial, viral, parasitic and fungal diseases in aquatic animals. Moreover, monitoring water quality, aquatic animal health and animal behaviour on farms has become exceptionally streamlined with cutting-edge tools like drones, sensors and artificial intelligence. Summarising research and development in aquatic animal health and monitoring aids efficient technology adoption in aquaculture. With these advanced technologies' continued development and adoption in developed countries, the aquaculture industry is experiencing growth and increased efficiency, benefiting farmers and consumers in these regions. However, farmers and educators in developing countries lack information about these technologies. Training of agricultural educators and efficient dissemination of knowledge and technologies through advertising and publication in collaboration with companies is essential. This review delves into emerging technologies capable of replacing the conventional diagnostic and monitoring methods utilised in aquaculture. We also explore their strengths, limitations and potential future applications within aquaculture settings. Innovations in technology for efficient diagnosis and monitoring of diseases and abnormality in aquaculture have significantly streamlined the process of identifying issues within the aquaculture industry, saving time and effort.image","[Bohara, Kailash; Ramena, Grace] Univ Arkansas, Dept Aquaculture & Fisheries, Pine Bluff, AR 71601 USA; [Joshi, Pabitra] Univ Idaho, Dept Plant Sci, Moscow, ID USA; [Acharya, Krishna Prasad] Anim Quarantine Off, Kathmandu, Nepal",University of Arkansas System; University of Arkansas Fayetteville; Idaho; University of Idaho,"Bohara, K (corresponding author), Univ Arkansas, Dept Aquaculture & Fisheries, Pine Bluff, AR 71601 USA.",boharak@uapb.edu,"Bohara, Kailash/GXM-8403-2022","Bohara, Kailash/0000-0002-1722-9229; Acharya, Krishna Prasad/0000-0002-4208-7592","The authors extend their gratitude to the Agriculture Extension at 1890 Land-Grant Institutions (University of Arkansas at Pine Bluff) for their support in making this publication possible, under the Federal award ID number: NI211444XXXXG014. [NI211444XXXXG014]","The authors extend their gratitude to the Agriculture Extension at 1890 Land-Grant Institutions (University of Arkansas at Pine Bluff) for their support in making this publication possible, under the Federal award ID number: NI211444XXXXG014.","The authors extend their gratitude to the Agriculture Extension at 1890 Land-Grant Institutions (University of Arkansas at Pine Bluff) for their support in making this publication possible, under the Federal award ID number: NI211444XXXXG014.",,208,0,0,7,7,WILEY,HOBOKEN,"111 RIVER ST, HOBOKEN 07030-5774, NJ USA",1753-5123,1753-5131,,REV AQUACULT,Rev. Aquac.,2023 OCT 30,2023,,,,,,,,,,10.1111/raq.12870,http://dx.doi.org/10.1111/raq.12870,,OCT 2023,19,Fisheries,Science Citation Index Expanded (SCI-EXPANDED),Fisheries,W1UR3,,hybrid,,,2023-11-26,WOS:001089558700001,View Full Record in Web of Science
C,"Bhawiyuga, A; Amron, K; Primanandha, R; Kartikasari, DP; Arijudin, H; Prabandari, DA",,,IEEE,"Bhawiyuga, Adhitya; Amron, Kasyful; Primanandha, Rakhmadhany; Kartikasari, Dani Primanita; Arijudin, Haidar; Prabandari, Dyah Ayu",,,LoRa-MQTT Gateway Device for Supporting Sensor-to-Cloud Data Transmission in Smart Aquaculture IoT Application,PROCEEDINGS OF 2019 4TH INTERNATIONAL CONFERENCE ON SUSTAINABLE INFORMATION ENGINEERING AND TECHNOLOGY (SIET 2019),,,English,Proceedings Paper,4th International Conference on Sustainable Information Engineering and Technology (SIET),"SEP 28-30, 2019","Senggigi, INDONESIA","Brawiijaya Univ, Fac Comp Sci,IEEE, Indonesia Sect,Univ Mataram",,,,"One of many services that could be developed with IoT technology and Wireless Sensor Network (WSN) is a smart aquaculture service. In order to establish the smart aquaculture service, in previous research we developed a sensor node equipped with LoRa communication module to observe several physical parameters of the aquaculture water including acidity, dissolved oxygen, turbidity and temperature level. As the number of collected data growth, an integration between the WSN and cloud based computing platform is required to handle the storage and processing of those collected data. One of the challenges faced in that integration is a limited LoRa communication module which is expected to be able to send sensor data directly to the cloud platform. Therefore, a gateway device which is able to act as a bridge between sensor node devices and cloud platform is required. This research proposes the design of LoRa-MQTT gateway device for supporting the sensor-to-cloud data transmission in smart aquaculture IoT application. In its main functionality, the gateway device receives collected sensor from sensor device using LoRa communication module, build a message and transmit them to the cloud based data storage server using MQTT protocol. From the functional and performance testing, the gateway can perform as a communication connector between sensor nodes and cloud based entity using both LoRa and MQTT protocols with reasonable performance.","[Bhawiyuga, Adhitya; Amron, Kasyful; Primanandha, Rakhmadhany; Kartikasari, Dani Primanita; Arijudin, Haidar; Prabandari, Dyah Ayu] Univ Brawijaya, Fac Comp Sci, Malang, Indonesia",Brawijaya University,"Bhawiyuga, A (corresponding author), Univ Brawijaya, Fac Comp Sci, Malang, Indonesia.",bhawiyuga@ub.ac.id; kasyful@ub.ac.id; rakhmadhany@ub.ac.id; dani.jalin@ub.ac.id; haidarari@gmail.com; dyahayuprabandarii@gmail.com,"Amron, Kasyful/HTO-7245-2023","Amron, Kasyful/0000-0002-6488-2036",,,,,13,3,3,0,1,IEEE,NEW YORK,"345 E 47TH ST, NEW YORK, NY 10017 USA",,,978-1-7281-3880-0,,,,2019,,,,,,,187,190,,10.1109/siet48054.2019.8986124,http://dx.doi.org/10.1109/siet48054.2019.8986124,,,4,"Computer Science, Theory & Methods; Green & Sustainable Science & Technology; Engineering, Electrical & Electronic",Conference Proceedings Citation Index - Science (CPCI-S),Computer Science; Science & Technology - Other Topics; Engineering,BP2KY,,,,,2023-11-26,WOS:000542995000035,View Full Record in Web of Science
J,"Sousa, D; Hernandez, D; Oliveira, F; Luis, M; Sargento, S",,,,"Sousa, Daniela; Hernandez, Diego; Oliveira, Francisco; Luis, Miguel; Sargento, Susana",,,A Platform of Unmanned Surface Vehicle Swarms for Real Time Monitoring in Aquaculture Environments,SENSORS,,,English,Article,,,,,,aquatic sensing platform; unmanned surface vehicles; multi-technology network systems; embedded systems in Internet of Things (IoT) platforms,FOLLOWER FORMATION CONTROL; COORDINATION; SYSTEM,"The Internet of Things (IoT) is a rapidly evolving technology that is changing almost every business, and aquaculture is no exception. In this work we present an integrated IoT platform for the acquisition of environmental data and the monitoring of aquaculture environments, supported by a real-time communication and processing network. The complete monitoring platform consists of environmental sensors equipped in a swarm of mobile Unmanned Surface Vehicles (USVs) and Buoys, capable of collecting aquatic and outside information, and sending it to a central station where it will be stored and processed. The sensing platform, formed by the USVs and Buoys, are equipped with multi-communication technology: IEEE 802.11n (Wi-Fi) and Bluetooth for short range communication, for mission delegation and the transmission of data collection, and LoRa for periodic report. On the back-end side, supported by FIWARE technology, an interactive web-based platform can be used to define sensing missions and for data visualization. Results on the sensing platform lifetime, mission control and delay processing time are presented to assess the performance of the aquatic monitoring system.","[Sousa, Daniela; Hernandez, Diego; Oliveira, Francisco; Luis, Miguel; Sargento, Susana] Inst Telecomunicacoes, P-3810193 Aveiro, Portugal; [Sousa, Daniela; Hernandez, Diego; Oliveira, Francisco; Sargento, Susana] Univ Aveiro, Dept Eletron Telecomunicacoes & Informat, P-3810193 Aveiro, Portugal",Universidade de Aveiro; Universidade de Aveiro,"Sousa, D (corresponding author), Inst Telecomunicacoes, P-3810193 Aveiro, Portugal.;Sousa, D (corresponding author), Univ Aveiro, Dept Eletron Telecomunicacoes & Informat, P-3810193 Aveiro, Portugal.",dcsousa@ua.pt; dc.hernandez@ua.pt; fbpo@ua.pt; nmal@av.it.pt; susana@ua.pt,"Sargento, Susana I. B. M/A-5586-2012; Luís, Miguel/Y-5621-2018","Luís, Miguel/0000-0003-3488-2462; Sargento, Susana/0000-0001-8761-8281; Sousa, Daniela/0000-0003-4802-7336; Caldeira Hernandez, Diego/0000-0002-4019-4626",[POCI-01-0145-FEDER-016426],,"This work was funded by the Project MOBIWISE, POCI-01-0145-FEDER-016426.",,30,6,7,3,25,MDPI,BASEL,"ST ALBAN-ANLAGE 66, CH-4052 BASEL, SWITZERLAND",,1424-8220,,SENSORS-BASEL,Sensors,NOV,2019,19,21,,,,,,,4695,10.3390/s19214695,http://dx.doi.org/10.3390/s19214695,,,22,"Chemistry, Analytical; Engineering, Electrical & Electronic; Instruments & Instrumentation",Science Citation Index Expanded (SCI-EXPANDED),Chemistry; Engineering; Instruments & Instrumentation,JQ3FF,31671733,"Green Published, gold",,,2023-11-26,WOS:000498834000092,View Full Record in Web of Science
C,"Aishwarya, KS; Harish, M; Prathibhashree, S; Panimozhi, K",,,IEEE,"Aishwarya, K. S.; Harish, M.; Prathibhashree, S.; Panimozhi, K.",,,Survey On Automated Aquponics Based Gardening Approaches,PROCEEDINGS OF THE 2018 SECOND INTERNATIONAL CONFERENCE ON INVENTIVE COMMUNICATION AND COMPUTATIONAL TECHNOLOGIES (ICICCT),,,English,Proceedings Paper,International Conference on Inventive Communication and Computational Technologies (ICICCT),"APR 20-21, 2018","Coimbatore, INDIA","IEEE,Ranganathan Engn Coll",,aquaponics; hydroponics; aquaculture; IOT,,"Aquaponics is a system which combines the aquaculture & hydroponics that grows fish and plants together in one system. It uses fish wastes to provide essential nutrients to the plants and in return the plants will purify the water and gives it back to the fishes. The purpose of this paper is to build an efficient system by implementing aquaponics system by using the technology of IOT (Internet of Things). By creating an automated System with the help of sensors interfaced with the Arduino board, it possible to automate fish feeding and water supply to the plants at the regular interval of time. Existing system that combines these technologies must overcome the fundamental issues like cost, food quality control and limited grow. In this paper we intend to propose a kit which contains all these features mentioned above, and that is helpful to provide the basic organic vegetation for the home.","[Aishwarya, K. S.; Harish, M.; Prathibhashree, S.; Panimozhi, K.] BMS Coll Engn, Dept CSE, Bangalore, Karnataka, India",BMS College of Engineering,"Aishwarya, KS (corresponding author), BMS Coll Engn, Dept CSE, Bangalore, Karnataka, India.",Aishwaryakabbin.24@gmail.com; harishkumar9845@gmail.com; Prathibhashree9@gmail.com; panimozhi.cse@bmsce.ac.in,"K, Panimozhi/E-2574-2017","K, Panimozhi/0000-0001-5306-7514",BMS College of Engineering,BMS College of Engineering,The authors would like to thank BMS College of Engineering and the TEQIP-III for the support.,,7,6,6,0,2,IEEE,NEW YORK,"345 E 47TH ST, NEW YORK, NY 10017 USA",,,978-1-5386-1974-2,,,,2018,,,,,,,1377,1381,,,,,,5,"Computer Science, Theory & Methods; Engineering, Electrical & Electronic; Telecommunications",Conference Proceedings Citation Index - Science (CPCI-S),Computer Science; Engineering; Telecommunications,BL8FP,,,,,2023-11-26,WOS:000456251700276,View Full Record in Web of Science
C,"Ma, YC; Ding, W",,"Xu, B",,"Ma, Yinchi; Ding, Wen",,,Design of Intelligent Monitoring System for Aquaculture Water Dissolved Oxygen,"PROCEEDINGS OF 2018 IEEE 3RD ADVANCED INFORMATION TECHNOLOGY, ELECTRONIC AND AUTOMATION CONTROL CONFERENCE (IAEAC 2018)",,,English,Proceedings Paper,"3rd IEEE Advanced Information Technology, Electronic and Automation Control Conference (IAEAC)","OCT 12-14, 2018","Chongqing, PEOPLES R CHINA",IEEE,,aquaculture water; dissolved oxygen; intelligent; monitoring,SENSOR,"Rapid hypoxia of the aquaculture water is one of the important factors that cause large area death of the aquaculture animals. The monitoring for the dissolved oxygen (DO) of the aquaculture water is very important to the safety of the aquaculture production. An intelligent monitoring system for DO of the aquaculture water is designed which provides a powerful technology method for maintaining the DO level of the aquaculture water in a good range. The optical and polarographic DO sensor, the NB-IoT low-power and narrow-band communication technology and the programmable logic controller (PLC) technology are used to build this system which realizes the full-automatic and intelligent monitoring for DO of the aquaculture water. A continuous monitoring test for DO of the experiment Kio pond is made while the DO standard is set between 5 to 8mg/L in summer. Analyzing result from the data records of the system and the artificial sampling shows that the response time of the system reaches 5.92s. The system can control the circuit breaker of the oxygen-increasing machine intelligently without the human intervention. The system can also send the alarm message and feedback the working status of the oxygen increasing device to the aquaculture manager and technician. The result shows that the system can replace the traditional artificial DO monitoring and the field control mode of the aquaculture water, while reducing the daily workload and power consumption of the oxygen-increasing machine effectively. The system can realize the intelligent 24-hour security monitoring for the DO level of the aquaculture water.","[Ma, Yinchi; Ding, Wen] Beijing Fisheries Res Inst, Fisheries Informat Ctr, Beijing, Peoples R China",Beijing Academy of Agriculture & Forestry Sciences (BAAFS),"Ma, YC (corresponding author), Beijing Fisheries Res Inst, Fisheries Informat Ctr, Beijing, Peoples R China.",mayinchi@bjfishery.com; 19275469@qq.com,"Ding, Wen/JGD-3843-2023",,Beijing Academy of Agriculture and Forestry Cold Water Fish Science and Technology Innovation Team [INKST201611]; Beijing Finance Bureau Science and Technology Innovation Center Construction Project Research of Spectrum Sensing Monitoring Technology for Aquaculture Pond Water Quality [PXM2018179303000015],Beijing Academy of Agriculture and Forestry Cold Water Fish Science and Technology Innovation Team; Beijing Finance Bureau Science and Technology Innovation Center Construction Project Research of Spectrum Sensing Monitoring Technology for Aquaculture Pond Water Quality,This research is supported by Beijing Academy of Agriculture and Forestry Cold Water Fish Science and Technology Innovation Team (INKST201611) project financing and Beijing Finance Bureau Science and Technology Innovation Center Construction Project Research of Spectrum Sensing Monitoring Technology for Aquaculture Pond Water Quality (PXM2018179303000015) financing.,,10,11,11,2,11,IEEE,NEW YORK,"345 E 47TH ST, NEW YORK, NY 10017 USA",,,978-1-5386-4509-3,,,,2018,,,,,,,414,418,,,,,,5,"Automation & Control Systems; Computer Science, Theory & Methods; Engineering, Electrical & Electronic",Conference Proceedings Citation Index - Science (CPCI-S),Automation & Control Systems; Computer Science; Engineering,BL9JF,,,,,2023-11-26,WOS:000457576900084,View Full Record in Web of Science
C,"Dzulqornain, MI; Al Rasyid, MUH; Sukaridhoto, S",,"Setyobudi, RH; Alasaarela, E; Pasila, F; Chan, G; Lee, SG",,"Dzulqornain, Muhammad Iskandar; Al Rasyid, M. Udin Harun; Sukaridhoto, Sritrusta",,,Design and Development of Smart Aquaculture System Based on IFTTT Model and Cloud Integration,"3RD INTERNATIONAL CONFERENCE ON ELECTRICAL SYSTEMS, TECHNOLOGY AND INFORMATION (ICESTI 2017)",MATEC Web of Conferences,,English,Proceedings Paper,"3rd International Conference on Electrical Systems, Technology and Information (ICESTI)","SEP 26-29, 2017","Bali, INDONESIA","Petra Christian Univ, Continuing Educ Ctr",,Cloud computing; IFTTT; IoT; smart aerator; smart aquaculture,,"The internet of things technology (IoT) is growing very rapidly. IoT implementation has been conducted in several sectors. One of them is for aquaculture. For the traditional farmers, they face problems for monitoring water quality and the way to increase the quality of the water quickly and efficiently. This paper presents a real-time monitoring and controlling system for aquaculture based on If This Then That (IFTTT) model and cloud integration. This system was composed of smart sensor module which supports modularity, smart aeration system for controlling system, local network system, cloud computing system and client visualization data. In order to monitor the water condition, we collect the data from smart sensor module. Smart sensor module consists of sensor dissolved oxygen, potential of hydrogen, water temperature and water level. The components of smart aeration system are microcontroller NodeMCU v3, relay, power supply, and propeller that can produce oxygen. The system could set the IFTTT rules for the ideal water condition for the pond in any kinds of aquaculture based on its needs through the web and android application. The experimental result shows that use IFTTT model makes the aquaculture monitoring system more customizable, expandable and dynamic.","[Dzulqornain, Muhammad Iskandar; Al Rasyid, M. Udin Harun; Sukaridhoto, Sritrusta] Elect Engn Polytech Inst Surabaya, Dept Informat & Comp Engn, Surabaya 60111, Jawa Timur, Indonesia",Electronic Engineering Polytechnic Institute of Surabaya,"Dzulqornain, MI (corresponding author), Elect Engn Polytech Inst Surabaya, Dept Informat & Comp Engn, Surabaya 60111, Jawa Timur, Indonesia.",midzulqornain@gmail.com,"SUKARIDHOTO, SRITRUSTA/P-8058-2019","SUKARIDHOTO, SRITRUSTA/0000-0002-8157-5863; Dzulqornain, Muhammad Iskandar/0000-0003-3239-9768; harun, udin/0000-0002-4473-2364",,,,,15,14,14,1,5,E D P SCIENCES,CEDEX A,"17 AVE DU HOGGAR PARC D ACTIVITES COUTABOEUF BP 112, F-91944 CEDEX A, FRANCE",2261-236X,,,MATEC WEB CONF,,,2018,164,,,,,,,,1030,10.1051/matecconf/201816401030,http://dx.doi.org/10.1051/matecconf/201816401030,,,11,"Engineering, Electrical & Electronic; Materials Science, Multidisciplinary",Conference Proceedings Citation Index - Science (CPCI-S),Engineering; Materials Science,BN3KH,,"Green Published, Green Submitted, gold",,,2023-11-26,WOS:000479290000030,View Full Record in Web of Science
C,"Rajesh, S",,"Wu, J; Perez, GM; Thampi, SM; Atiquzzaman, M; Berretti, S; Rodrigues, JJPC; Tomar, R; Gorthi, RP; Siarry, P; Pathan, AK; Li, J; Bedi, P; Mehta, S; Kammoun, MH; Jain, V",,"Rajesh, Sangeetha",,,Ubiquitous Energy Efficient Aquaculture Management System,"2016 INTERNATIONAL CONFERENCE ON ADVANCES IN COMPUTING, COMMUNICATIONS AND INFORMATICS (ICACCI)",,,English,Proceedings Paper,"International Conference on Advances in Computing, Communications and Informatics (ICACCI)","SEP 21-24, 2016","Jaipur, INDIA","LNM Inst Informat Technol,IEEE Commun Soc,IEEE Syst Man & Cybernet Soc",,Internet of Things; IoT; RFID; aquaculture; sensor; wireless sensor networks; thread; actuator,,Pervasive computing enabled by wireless network technologies span a wide area of applications in modern living. Heterogeneous devices used in Internet of Things are highly constrained in terms of energy efficiency. Aquaculture is a technique of human intervention in the rearing process of aquatic animals. Several natural water parameters affect the productivity of aquaculture farming. This paper proposes an energy efficient ubiquitous architecture based on Internet of Things for an aquaculture environment. The proposed system collects the aqua_data in real-time using sensors. It applies the changes in the water environment at suitable times without human intervention. The algorithm for decision making in expert system is depicted. The paper converse about Thread wireless network protocol which provides longevity to the battery operated heterogeneous devices.,"[Rajesh, Sangeetha] KJ Somaiya Inst Management Studies & Res, Dept Informat Technol, Bombay, Maharashtra, India",Somaiya Vidyavihar University; K J Somaiya Institute of Management,"Rajesh, S (corresponding author), KJ Somaiya Inst Management Studies & Res, Dept Informat Technol, Bombay, Maharashtra, India.",rajesh.sangeetha@gmail.com,"Rajesh, Sangeetha/AAB-2684-2021",,,,,,16,1,1,0,3,IEEE,NEW YORK,"345 E 47TH ST, NEW YORK, NY 10017 USA",,,978-1-5090-2028-7,,,,2016,,,,,,,1124,1127,,,,,,4,"Computer Science, Interdisciplinary Applications; Computer Science, Theory & Methods; Telecommunications",Conference Proceedings Citation Index - Science (CPCI-S),Computer Science; Telecommunications,BG8NK,,,,,2023-11-26,WOS:000392503100179,View Full Record in Web of Science
